date_seen	source_name	source_url	paper_url	title	authors	abstract	keywords	pub_date	place	category	viewed	read	bookmarked	labelled
20260627	NeuralMemoryPapers	https://github.com/Alexzhuan/NeuralMemoryPapers	https://arxiv.org/abs/2202.01110	A Survey on Retrieval-Augmented Text Generation	Huayang Li, Yixuan Su, Deng Cai, Yan Wang, Lemao Liu	Recently, retrieval-augmented text generation attracted increasing attention of the computational linguistics community. Compared with conventional generation models, retrieval-augmented text generation has remarkable advantages and particularly has achieved state-of-the-art performance in many NLP tasks. This paper aims to conduct a survey about retrieval-augmented text generation. It firstly highlights the generic paradigm of retrieval-augmented generation, and then it reviews notable approaches according to different tasks including dialogue response generation, machine translation, and other generation tasks. Finally, it points out some important directions on top of recent methods to facilitate future research.	cs.CL	2022-02-02		memory				
20260627	NeuralMemoryPapers	https://github.com/Alexzhuan/NeuralMemoryPapers	https://arxiv.org/abs/2201.09651	Artefact Retrieval: Overview of NLP Models with Knowledge Base Access	Vilém Zouhar, Marius Mosbach, Debanjali Biswas, Dietrich Klakow	Many NLP models gain performance by having access to a knowledge base. A lot of research has been devoted to devising and improving the way the knowledge base is accessed and incorporated into the model, resulting in a number of mechanisms and pipelines. Despite the diversity of proposed mechanisms, there are patterns in the designs of such systems. In this paper, we systematically describe the typology of artefacts (items retrieved from a knowledge base), retrieval mechanisms and the way these artefacts are fused into the model. This further allows us to uncover combinations of design decisions that had not yet been tried. Most of the focus is given to language models, though we also show how question answering, fact-checking and knowledgable dialogue models fit into this system as well. Having an abstract model which can describe the architecture of specific models also helps with transferring these architectures between multiple NLP tasks.	cs.CL, cs.IR	2022-01-24		memory				
20260627	NeuralMemoryPapers	https://github.com/Alexzhuan/NeuralMemoryPapers	https://arxiv.org/abs/1805.00327	A Taxonomy for Neural Memory Networks	Ying Ma, Jose Principe	In this paper, a taxonomy for memory networks is proposed based on their memory organization. The taxonomy includes all the popular memory networks: vanilla recurrent neural network (RNN), long short term memory (LSTM ), neural stack and neural Turing machine and their variants. The taxonomy puts all these networks under a single umbrella and shows their relative expressive power , i.e. vanilla RNN <=LSTM<=neural stack<=neural RAM. The differences and commonality between these networks are analyzed. These differences are also connected to the requirements of different tasks which can give the user instructions of how to choose or design an appropriate memory network for a specific task. As a conceptual simplified class of problems, four tasks of synthetic symbol sequences: counting, counting with interference, reversing and repeat counting are developed and tested to verify our arguments. And we use two natural language processing problems to discuss how this taxonomy helps choosing the appropriate neural memory networks for real world problem.	cs.LG, stat.ML	2018-05-01	Published in: IEEE Transactions on Neural Networks and Learning Systems ( Volume: 31, Issue: 6, June 2020)	memory				
20260627	NeuralMemoryPapers	https://github.com/Alexzhuan/NeuralMemoryPapers	https://arxiv.org/abs/2204.07937	Unsupervised Cross-Task Generalization via Retrieval Augmentation	Bill Yuchen Lin, Kangmin Tan, Chris Miller, Beiwen Tian, Xiang Ren	Humans can perform unseen tasks by recalling relevant skills acquired previously and then generalizing them to the target tasks, even if there is no supervision at all. In this paper, we aim to improve this kind of cross-task generalization ability of massive multi-task language models, such as T0 and FLAN, in an unsupervised setting. We propose a retrieval-augmentation method named ReCross that takes a few unlabelled examples as queries to retrieve a small subset of upstream data and uses them to update the multi-task model for better generalization. ReCross is a straightforward yet effective retrieval method that combines both efficient dense retrieval and effective pair-wise reranking. Our results and analysis show that it significantly outperforms both non-retrieval methods and other baseline methods.	cs.AI, cs.CL, cs.LG	2022-04-17		memory				
20260627	NeuralMemoryPapers	https://github.com/Alexzhuan/NeuralMemoryPapers	https://arxiv.org/abs/2204.04581	Augmenting Pre-trained Language Models with QA-Memory for Open-Domain Question Answering	Wenhu Chen, Pat Verga, Michiel de Jong, John Wieting, William Cohen	Retrieval augmented language models have recently become the standard for knowledge intensive tasks. Rather than relying purely on latent semantics within the parameters of large neural models, these methods enlist a semi-parametric memory to encode an index of knowledge for the model to retrieve over. Most prior work has employed text passages as the unit of knowledge, which has high coverage at the cost of interpretability, controllability, and efficiency. The opposite properties arise in other methods which have instead relied on knowledge base (KB) facts. At the same time, more recent work has demonstrated the effectiveness of storing and retrieving from an index of Q-A pairs derived from text \citep{lewis2021paq}. This approach yields a high coverage knowledge representation that maintains KB-like properties due to its representations being more atomic units of information. In this work we push this line of research further by proposing a question-answer augmented encoder-decoder model and accompanying pretraining strategy. This yields an end-to-end system that not only outperforms prior QA retrieval methods on single-hop QA tasks but also enables compositional reasoning, as demonstrated by strong performance on two multi-hop QA datasets. Together, these methods improve the ability to interpret and control the model while narrowing the performance gap with passage retrieval systems.	cs.AI, cs.CL, cs.LG	2022-04-10		memory				
20260627	NeuralMemoryPapers	https://github.com/Alexzhuan/NeuralMemoryPapers	https://arxiv.org/abs/2201.09680	Relational Memory Augmented Language Models	Qi Liu, Dani Yogatama, Phil Blunsom	We present a memory-augmented approach to condition an autoregressive language model on a knowledge graph. We represent the graph as a collection of relation triples and retrieve relevant relations for a given context to improve text generation. Experiments on WikiText-103, WMT19, and enwik8 English datasets demonstrate that our approach produces a better language model in terms of perplexity and bits per character. We also show that relational memory improves coherence, is complementary to token-based memory, and enables causal interventions. Our model provides a simple yet effective way to combine an autoregressive language model with a knowledge graph for a more coherent and logical generation.	cs.AI, cs.CL	2022-01-24		memory				
20260627	NeuralMemoryPapers	https://github.com/Alexzhuan/NeuralMemoryPapers	https://arxiv.org/abs/2203.08913	Memorizing Transformers	Yuhuai Wu, Markus N. Rabe, DeLesley Hutchins, Christian Szegedy	Language models typically need to be trained or finetuned in order to acquire new knowledge, which involves updating their weights. We instead envision language models that can simply read and memorize new data at inference time, thus acquiring new knowledge immediately. In this work, we extend language models with the ability to memorize the internal representations of past inputs. We demonstrate that an approximate kNN lookup into a non-differentiable memory of recent (key, value) pairs improves language modeling across various benchmarks and tasks, including generic webtext (C4), math papers (arXiv), books (PG-19), code (Github), as well as formal theorems (Isabelle). We show that the performance steadily improves when we increase the size of memory up to 262K tokens. On benchmarks including code and mathematics, we find that the model is capable of making use of newly defined functions and theorems during test time.	cs.AI, cs.CL, cs.LG	2022-03-16		memory				
20260627	NeuralMemoryPapers	https://github.com/Alexzhuan/NeuralMemoryPapers	https://arxiv.org/abs/2203.11670	Improving Meta-learning for Low-resource Text Classification and Generation via Memory Imitation	Yingxiu Zhao, Zhiliang Tian, Huaxiu Yao, Yinhe Zheng, Dongkyu Lee, Yiping Song, Jian Sun, Nevin L. Zhang	Building models of natural language processing (NLP) is challenging in low-resource scenarios where only limited data are available. Optimization-based meta-learning algorithms achieve promising results in low-resource scenarios by adapting a well-generalized model initialization to handle new tasks. Nonetheless, these approaches suffer from the memorization overfitting issue, where the model tends to memorize the meta-training tasks while ignoring support sets when adapting to new tasks. To address this issue, we propose a memory imitation meta-learning (MemIML) method that enhances the model's reliance on support sets for task adaptation. Specifically, we introduce a task-specific memory module to store support set information and construct an imitation module to force query sets to imitate the behaviors of some representative support-set samples stored in the memory. A theoretical analysis is provided to prove the effectiveness of our method, and empirical results also demonstrate that our method outperforms competitive baselines on both text classification and generation tasks.	cs.CL, cs.LG	2022-03-22		memory				
20260627	NeuralMemoryPapers	https://github.com/Alexzhuan/NeuralMemoryPapers	https://arxiv.org/abs/2203.02985	Dynamic Key-value Memory Enhanced Multi-step Graph Reasoning for Knowledge-based Visual Question Answering	Mingxiao Li, Marie-Francine Moens	Knowledge-based visual question answering (VQA) is a vision-language task that requires an agent to correctly answer image-related questions using knowledge that is not presented in the given image. It is not only a more challenging task than regular VQA but also a vital step towards building a general VQA system. Most existing knowledge-based VQA systems process knowledge and image information similarly and ignore the fact that the knowledge base (KB) contains complete information about a triplet, while the extracted image information might be incomplete as the relations between two objects are missing or wrongly detected. In this paper, we propose a novel model named dynamic knowledge memory enhanced multi-step graph reasoning (DMMGR), which performs explicit and implicit reasoning over a key-value knowledge memory module and a spatial-aware image graph, respectively. Specifically, the memory module learns a dynamic knowledge representation and generates a knowledge-aware question representation at each reasoning step. Then, this representation is used to guide a graph attention operator over the spatial-aware image graph. Our model achieves new state-of-the-art accuracy on the KRVQR and FVQA datasets. We also conduct ablation experiments to prove the effectiveness of each component of the proposed model.	cs.AI, cs.CL, cs.CV	2022-03-06		memory				
20260627	NeuralMemoryPapers	https://github.com/Alexzhuan/NeuralMemoryPapers	https://arxiv.org/abs/2205.02355	Relation Extraction as Open-book Examination: Retrieval-enhanced Prompt Tuning	Xiang Chen, Lei Li, Ningyu Zhang, Chuanqi Tan, Fei Huang, Luo Si, Huajun Chen	Pre-trained language models have contributed significantly to relation extraction by demonstrating remarkable few-shot learning abilities. However, prompt tuning methods for relation extraction may still fail to generalize to those rare or hard patterns. Note that the previous parametric learning paradigm can be viewed as memorization regarding training data as a book and inference as the close-book test. Those long-tailed or hard patterns can hardly be memorized in parameters given few-shot instances. To this end, we regard RE as an open-book examination and propose a new semiparametric paradigm of retrieval-enhanced prompt tuning for relation extraction. We construct an open-book datastore for retrieval regarding prompt-based instance representations and corresponding relation labels as memorized key-value pairs. During inference, the model can infer relations by linearly interpolating the base output of PLM with the non-parametric nearest neighbor distribution over the datastore. In this way, our model not only infers relation through knowledge stored in the weights during training but also assists decision-making by unwinding and querying examples in the open-book datastore. Extensive experiments on benchmark datasets show that our method can achieve state-of-the-art in both standard supervised and few-shot settings. Code are available in https://github.com/zjunlp/PromptKG/tree/main/research/RetrievalRE.	cs.AI, cs.CL, cs.IR, cs.LG	2022-05-04		memory				
20260627	NeuralMemoryPapers	https://github.com/Alexzhuan/NeuralMemoryPapers	https://arxiv.org/abs/2112.04426	Improving language models by retrieving from trillions of tokens	Sebastian Borgeaud, Arthur Mensch, Jordan Hoffmann, Trevor Cai, Eliza Rutherford, Katie Millican, George van den Driessche, Jean-Baptiste Lespiau, Bogdan Damoc, Aidan Clark, Diego de Las Casas, Aurelia Guy, Jacob Menick, Roman Ring, Tom Hennigan, Saffron Huang, Loren Maggiore, Chris Jones, Albin Cassirer, Andy Brock, Michela Paganini, Geoffrey Irving, Oriol Vinyals, Simon Osindero, Karen Simonyan, Jack W. Rae, Erich Elsen, Laurent Sifre	We enhance auto-regressive language models by conditioning on document chunks retrieved from a large corpus, based on local similarity with preceding tokens. With a $2$ trillion token database, our Retrieval-Enhanced Transformer (RETRO) obtains comparable performance to GPT-3 and Jurassic-1 on the Pile, despite using 25$\times$ fewer parameters. After fine-tuning, RETRO performance translates to downstream knowledge-intensive tasks such as question answering. RETRO combines a frozen Bert retriever, a differentiable encoder and a chunked cross-attention mechanism to predict tokens based on an order of magnitude more data than what is typically consumed during training. We typically train RETRO from scratch, yet can also rapidly RETROfit pre-trained transformers with retrieval and still achieve good performance. Our work opens up new avenues for improving language models through explicit memory at unprecedented scale.	cs.CL, cs.LG	2021-12-08		memory				
20260627	NeuralMemoryPapers	https://github.com/Alexzhuan/NeuralMemoryPapers	https://arxiv.org/abs/2110.08743	GNN-LM: Language Modeling based on Global Contexts via GNN	Yuxian Meng, Shi Zong, Xiaoya Li, Xiaofei Sun, Tianwei Zhang, Fei Wu, Jiwei Li	Inspired by the notion that ``{\it to copy is easier than to memorize}``, in this work, we introduce GNN-LM, which extends the vanilla neural language model (LM) by allowing to reference similar contexts in the entire training corpus. We build a directed heterogeneous graph between an input context and its semantically related neighbors selected from the training corpus, where nodes are tokens in the input context and retrieved neighbor contexts, and edges represent connections between nodes. Graph neural networks (GNNs) are constructed upon the graph to aggregate information from similar contexts to decode the token. This learning paradigm provides direct access to the reference contexts and helps improve a model's generalization ability. We conduct comprehensive experiments to validate the effectiveness of the GNN-LM: GNN-LM achieves a new state-of-the-art perplexity of 14.8 on WikiText-103 (a 3.9 point improvement over its counterpart of the vanilla LM model), and shows substantial improvement on One Billion Word and Enwiki8 datasets against strong baselines. In-depth ablation studies are performed to understand the mechanics of GNN-LM. \footnote{The code can be found at https://github.com/ShannonAI/GNN-LM	cs.CL	2021-10-17		memory				
20260627	NeuralMemoryPapers	https://github.com/Alexzhuan/NeuralMemoryPapers	https://arxiv.org/abs/2109.04212	Efficient Nearest Neighbor Language Models	Junxian He, Graham Neubig, Taylor Berg-Kirkpatrick	Non-parametric neural language models (NLMs) learn predictive distributions of text utilizing an external datastore, which allows them to learn through explicitly memorizing the training datapoints. While effective, these models often require retrieval from a large datastore at test time, significantly increasing the inference overhead and thus limiting the deployment of non-parametric NLMs in practical applications. In this paper, we take the recently proposed $k$-nearest neighbors language model (Khandelwal et al., 2020) as an example, exploring methods to improve its efficiency along various dimensions. Experiments on the standard WikiText-103 benchmark and domain-adaptation datasets show that our methods are able to achieve up to a 6x speed-up in inference speed while retaining comparable performance. The empirical analysis we present may provide guidelines for future research seeking to develop or deploy more efficient non-parametric NLMs.	cs.CL	2021-09-09		memory				
20260627	NeuralMemoryPapers	https://github.com/Alexzhuan/NeuralMemoryPapers	https://arxiv.org/abs/2110.02523	KNN-BERT: Fine-Tuning Pre-Trained Models with KNN Classifier	Linyang Li, Demin Song, Ruotian Ma, Xipeng Qiu, Xuanjing Huang	Pre-trained models are widely used in fine-tuning downstream tasks with linear classifiers optimized by the cross-entropy loss, which might face robustness and stability problems. These problems can be improved by learning representations that focus on similarities in the same class and contradictions in different classes when making predictions. In this paper, we utilize the K-Nearest Neighbors Classifier in pre-trained model fine-tuning. For this KNN classifier, we introduce a supervised momentum contrastive learning framework to learn the clustered representations of the supervised downstream tasks. Extensive experiments on text classification tasks and robustness tests show that by incorporating KNNs with the traditional fine-tuning process, we can obtain significant improvements on the clean accuracy in both rich-source and few-shot settings and can improve the robustness against adversarial attacks. \footnote{all codes is available at https://github.com/LinyangLee/KNN-BERT}	cs.CL	2021-10-06		memory				
20260627	NeuralMemoryPapers	https://github.com/Alexzhuan/NeuralMemoryPapers	https://arxiv.org/abs/2112.08459	Rethinking Nearest Neighbors for Visual Classification	Menglin Jia, Bor-Chun Chen, Zuxuan Wu, Claire Cardie, Serge Belongie, Ser-Nam Lim	"Neural network classifiers have become the de-facto choice for current ""pre-train then fine-tune"" paradigms of visual classification. In this paper, we investigate k-Nearest-Neighbor (k-NN) classifiers, a classical model-free learning method from the pre-deep learning era, as an augmentation to modern neural network based approaches. As a lazy learning method, k-NN simply aggregates the distance between the test image and top-k neighbors in a training set. We adopt k-NN with pre-trained visual representations produced by either supervised or self-supervised methods in two steps: (1) Leverage k-NN predicted probabilities as indications for easy vs. hard examples during training. (2) Linearly interpolate the k-NN predicted distribution with that of the augmented classifier. Via extensive experiments on a wide range of classification tasks, our study reveals the generality and flexibility of k-NN integration with additional insights: (1) k-NN achieves competitive results, sometimes even outperforming a standard linear classifier. (2) Incorporating k-NN is especially beneficial for tasks where parametric classifiers perform poorly and / or in low-data regimes. We hope these discoveries will encourage people to rethink the role of pre-deep learning, classical methods in computer vision. Our code is available at: https://github.com/KMnP/nn-revisit."	cs.CV	2021-12-15		memory				
20260627	NeuralMemoryPapers	https://github.com/Alexzhuan/NeuralMemoryPapers	https://arxiv.org/abs/1910.02720	Meta-Learning Deep Energy-Based Memory Models	Sergey Bartunov, Jack W Rae, Simon Osindero, Timothy P Lillicrap	We study the problem of learning associative memory -- a system which is able to retrieve a remembered pattern based on its distorted or incomplete version. Attractor networks provide a sound model of associative memory: patterns are stored as attractors of the network dynamics and associative retrieval is performed by running the dynamics starting from a query pattern until it converges to an attractor. In such models the dynamics are often implemented as an optimization procedure that minimizes an energy function, such as in the classical Hopfield network. In general it is difficult to derive a writing rule for a given dynamics and energy that is both compressive and fast. Thus, most research in energy-based memory has been limited either to tractable energy models not expressive enough to handle complex high-dimensional objects such as natural images, or to models that do not offer fast writing. We present a novel meta-learning approach to energy-based memory models (EBMM) that allows one to use an arbitrary neural architecture as an energy model and quickly store patterns in its weights. We demonstrate experimentally that our EBMM approach can build compressed memories for synthetic and natural data, and is capable of associative retrieval that outperforms existing memory systems in terms of the reconstruction error and compression rate.	cs.LG, cs.NE, stat.ML	2019-10-07		memory				
20260627	NeuralMemoryPapers	https://github.com/Alexzhuan/NeuralMemoryPapers	https://arxiv.org/abs/2002.08909	REALM: Retrieval-Augmented Language Model Pre-Training	Kelvin Guu, Kenton Lee, Zora Tung, Panupong Pasupat, Ming-Wei Chang	Language model pre-training has been shown to capture a surprising amount of world knowledge, crucial for NLP tasks such as question answering. However, this knowledge is stored implicitly in the parameters of a neural network, requiring ever-larger networks to cover more facts.   To capture knowledge in a more modular and interpretable way, we augment language model pre-training with a latent knowledge retriever, which allows the model to retrieve and attend over documents from a large corpus such as Wikipedia, used during pre-training, fine-tuning and inference. For the first time, we show how to pre-train such a knowledge retriever in an unsupervised manner, using masked language modeling as the learning signal and backpropagating through a retrieval step that considers millions of documents.   We demonstrate the effectiveness of Retrieval-Augmented Language Model pre-training (REALM) by fine-tuning on the challenging task of Open-domain Question Answering (Open-QA). We compare against state-of-the-art models for both explicit and implicit knowledge storage on three popular Open-QA benchmarks, and find that we outperform all previous methods by a significant margin (4-16% absolute accuracy), while also providing qualitative benefits such as interpretability and modularity.	cs.CL, cs.LG	2020-02-10		memory				
20260627	NeuralMemoryPapers	https://github.com/Alexzhuan/NeuralMemoryPapers	https://arxiv.org/abs/2001.10913	MEMO: A Deep Network for Flexible Combination of Episodic Memories	Andrea Banino, Adrià Puigdomènech Badia, Raphael Köster, Martin J. Chadwick, Vinicius Zambaldi, Demis Hassabis, Caswell Barry, Matthew Botvinick, Dharshan Kumaran, Charles Blundell	"Recent research developing neural network architectures with external memory have often used the benchmark bAbI question and answering dataset which provides a challenging number of tasks requiring reasoning. Here we employed a classic associative inference task from the memory-based reasoning neuroscience literature in order to more carefully probe the reasoning capacity of existing memory-augmented architectures. This task is thought to capture the essence of reasoning -- the appreciation of distant relationships among elements distributed across multiple facts or memories. Surprisingly, we found that current architectures struggle to reason over long distance associations. Similar results were obtained on a more complex task involving finding the shortest path between nodes in a path. We therefore developed MEMO, an architecture endowed with the capacity to reason over longer distances. This was accomplished with the addition of two novel components. First, it introduces a separation between memories (facts) stored in external memory and the items that comprise these facts in external memory. Second, it makes use of an adaptive retrieval mechanism, allowing a variable number of ""memory hops"" before the answer is produced. MEMO is capable of solving our novel reasoning tasks, as well as match state of the art results in bAbI."	cs.AI, cs.LG	2020-01-29		memory				
