date_seen	source_name	source_url	paper_url	title	authors	abstract	keywords	pub_date	place	category	viewed	read	bookmarked	labelled
20260627	Agent-Memory-Paper-List	https://github.com/Shichun-Liu/Agent-Memory-Paper-List	https://arxiv.org/abs/2308.00352	MetaGPT: Meta Programming for A Multi-Agent Collaborative Framework	Sirui Hong, Mingchen Zhuge, Jiaqi Chen, Xiawu Zheng, Yuheng Cheng, Ceyao Zhang, Jinlin Wang, Zili Wang, Steven Ka Shing Yau, Zijuan Lin, Liyang Zhou, Chenyu Ran, Lingfeng Xiao, Chenglin Wu, Jürgen Schmidhuber	Remarkable progress has been made on automated problem solving through societies of agents based on large language models (LLMs). Existing LLM-based multi-agent systems can already solve simple dialogue tasks. Solutions to more complex tasks, however, are complicated through logic inconsistencies due to cascading hallucinations caused by naively chaining LLMs. Here we introduce MetaGPT, an innovative meta-programming framework incorporating efficient human workflows into LLM-based multi-agent collaborations. MetaGPT encodes Standardized Operating Procedures (SOPs) into prompt sequences for more streamlined workflows, thus allowing agents with human-like domain expertise to verify intermediate results and reduce errors. MetaGPT utilizes an assembly line paradigm to assign diverse roles to various agents, efficiently breaking down complex tasks into subtasks involving many agents working together. On collaborative software engineering benchmarks, MetaGPT generates more coherent solutions than previous chat-based multi-agent systems. Our project can be found at https://github.com/geekan/MetaGPT	cs.AI, cs.MA	2023-08-01		memory				
20260627	Agent-Memory-Paper-List	https://github.com/Shichun-Liu/Agent-Memory-Paper-List	https://arxiv.org/abs/2308.08239	MemoChat: Tuning LLMs to Use Memos for Consistent Long-Range Open-Domain Conversation	Junru Lu, Siyu An, Mingbao Lin, Gabriele Pergola, Yulan He, Di Yin, Xing Sun, Yunsheng Wu	"We propose MemoChat, a pipeline for refining instructions that enables large language models (LLMs) to effectively employ self-composed memos for maintaining consistent long-range open-domain conversations. We demonstrate a long-range open-domain conversation through iterative ""memorization-retrieval-response"" cycles. This requires us to carefully design tailored tuning instructions for each distinct stage. The instructions are reconstructed from a collection of public datasets to teach the LLMs to memorize and retrieve past dialogues with structured memos, leading to enhanced consistency when participating in future conversations. We invite experts to manually annotate a test set designed to evaluate the consistency of long-range conversations questions. Experiments on three testing scenarios involving both open-source and API-accessible chatbots at scale verify the efficacy of MemoChat, which outperforms strong baselines. Our codes, data and models are available here: https://github.com/LuJunru/MemoChat."	cs.CL	2023-08-16		memory				
20260627	Agent-Memory-Paper-List	https://github.com/Shichun-Liu/Agent-Memory-Paper-List	https://arxiv.org/abs/2308.15022	Recursively Summarizing Enables Long-Term Dialogue Memory in Large Language Models	Qingyue Wang, Yanhe Fu, Yanan Cao, Shuai Wang, Zhiliang Tian, Liang Ding	Recently, large language models (LLMs), such as GPT-4, stand out remarkable conversational abilities, enabling them to engage in dynamic and contextually relevant dialogues across a wide range of topics. However, given a long conversation, these chatbots fail to recall past information and tend to generate inconsistent responses. To address this, we propose to recursively generate summaries/ memory using large language models (LLMs) to enhance long-term memory ability. Specifically, our method first stimulates LLMs to memorize small dialogue contexts and then recursively produce new memory using previous memory and following contexts. Finally, the chatbot can easily generate a highly consistent response with the help of the latest memory. We evaluate our method on both open and closed LLMs, and the experiments on the widely-used public dataset show that our method can generate more consistent responses in a long-context conversation. Also, we show that our strategy could nicely complement both long-context (e.g., 8K and 16K) and retrieval-enhanced LLMs, bringing further long-term dialogue performance. Notably, our method is a potential solution to enable the LLM to model the extremely long context. The code and scripts are released.	cs.AI, cs.CL	2023-08-29		memory				
20260627	Agent-Memory-Paper-List	https://github.com/Shichun-Liu/Agent-Memory-Paper-List	https://arxiv.org/abs/2305.13304	RecurrentGPT: Interactive Generation of (Arbitrarily) Long Text	Wangchunshu Zhou, Yuchen Eleanor Jiang, Peng Cui, Tiannan Wang, Zhenxin Xiao, Yifan Hou, Ryan Cotterell, Mrinmaya Sachan	The fixed-size context of Transformer makes GPT models incapable of generating arbitrarily long text. In this paper, we introduce RecurrentGPT, a language-based simulacrum of the recurrence mechanism in RNNs. RecurrentGPT is built upon a large language model (LLM) such as ChatGPT and uses natural language to simulate the Long Short-Term Memory mechanism in an LSTM. At each timestep, RecurrentGPT generates a paragraph of text and updates its language-based long-short term memory stored on the hard drive and the prompt, respectively. This recurrence mechanism enables RecurrentGPT to generate texts of arbitrary length without forgetting. Since human users can easily observe and edit the natural language memories, RecurrentGPT is interpretable and enables interactive generation of long text. RecurrentGPT is an initial step towards next-generation computer-assisted writing systems beyond local editing suggestions. In addition to producing AI-generated content (AIGC), we also demonstrate the possibility of using RecurrentGPT as an interactive fiction that directly interacts with consumers. We call this usage of generative models by ``AI As Contents'' (AIAC), which we believe is the next form of conventional AIGC. We further demonstrate the possibility of using RecurrentGPT to create personalized interactive fiction that directly interacts with readers instead of interacting with writers. More broadly, RecurrentGPT demonstrates the utility of borrowing ideas from popular model designs in cognitive science and deep learning for prompting LLMs. Our code is available at https://github.com/aiwaves-cn/RecurrentGPT and an online demo is available at https://www.aiwaves.org/recurrentgpt.	cs.CL, cs.LG	2023-05-22		memory				
20260627	Agent-Memory-Paper-List	https://github.com/Shichun-Liu/Agent-Memory-Paper-List	https://arxiv.org/abs/2305.10250	MemoryBank: Enhancing Large Language Models with Long-Term Memory	Wanjun Zhong, Lianghong Guo, Qiqi Gao, He Ye, Yanlin Wang	Revolutionary advancements in Large Language Models have drastically reshaped our interactions with artificial intelligence systems. Despite this, a notable hindrance remains-the deficiency of a long-term memory mechanism within these models. This shortfall becomes increasingly evident in situations demanding sustained interaction, such as personal companion systems and psychological counseling. Therefore, we propose MemoryBank, a novel memory mechanism tailored for LLMs. MemoryBank enables the models to summon relevant memories, continually evolve through continuous memory updates, comprehend, and adapt to a user personality by synthesizing information from past interactions. To mimic anthropomorphic behaviors and selectively preserve memory, MemoryBank incorporates a memory updating mechanism, inspired by the Ebbinghaus Forgetting Curve theory, which permits the AI to forget and reinforce memory based on time elapsed and the relative significance of the memory, thereby offering a human-like memory mechanism. MemoryBank is versatile in accommodating both closed-source models like ChatGPT and open-source models like ChatGLM. We exemplify application of MemoryBank through the creation of an LLM-based chatbot named SiliconFriend in a long-term AI Companion scenario. Further tuned with psychological dialogs, SiliconFriend displays heightened empathy in its interactions. Experiment involves both qualitative analysis with real-world user dialogs and quantitative analysis with simulated dialogs. In the latter, ChatGPT acts as users with diverse characteristics and generates long-term dialog contexts covering a wide array of topics. The results of our analysis reveal that SiliconFriend, equipped with MemoryBank, exhibits a strong capability for long-term companionship as it can provide emphatic response, recall relevant memories and understand user personality.	cs.AI, cs.CL	2023-05-17		memory				
20260627	Agent-Memory-Paper-List	https://github.com/Shichun-Liu/Agent-Memory-Paper-List	https://arxiv.org/abs/2305.14322	RET-LLM: Towards a General Read-Write Memory for Large Language Models	Ali Modarressi, Ayyoob Imani, Mohsen Fayyaz, Hinrich Schütze	Large language models (LLMs) have significantly advanced the field of natural language processing (NLP) through their extensive parameters and comprehensive data utilization. However, existing LLMs lack a dedicated memory unit, limiting their ability to explicitly store and retrieve knowledge for various tasks. In this paper, we propose RET-LLM a novel framework that equips LLMs with a general write-read memory unit, allowing them to extract, store, and recall knowledge from the text as needed for task performance. Inspired by Davidsonian semantics theory, we extract and save knowledge in the form of triplets. The memory unit is designed to be scalable, aggregatable, updatable, and interpretable. Through qualitative evaluations, we demonstrate the superiority of our proposed framework over baseline approaches in question answering tasks. Moreover, our framework exhibits robust performance in handling temporal-based question answering tasks, showcasing its ability to effectively manage time-dependent information.	cs.CL	2023-05-23		memory				
20260627	Agent-Memory-Paper-List	https://github.com/Shichun-Liu/Agent-Memory-Paper-List	https://arxiv.org/abs/2304.03442	Generative Agents: Interactive Simulacra of Human Behavior	Joon Sung Park, Joseph C. O'Brien, Carrie J. Cai, Meredith Ringel Morris, Percy Liang, Michael S. Bernstein	Believable proxies of human behavior can empower interactive applications ranging from immersive environments to rehearsal spaces for interpersonal communication to prototyping tools. In this paper, we introduce generative agents--computational software agents that simulate believable human behavior. Generative agents wake up, cook breakfast, and head to work; artists paint, while authors write; they form opinions, notice each other, and initiate conversations; they remember and reflect on days past as they plan the next day. To enable generative agents, we describe an architecture that extends a large language model to store a complete record of the agent's experiences using natural language, synthesize those memories over time into higher-level reflections, and retrieve them dynamically to plan behavior. We instantiate generative agents to populate an interactive sandbox environment inspired by The Sims, where end users can interact with a small town of twenty five agents using natural language. In an evaluation, these generative agents produce believable individual and emergent social behaviors: for example, starting with only a single user-specified notion that one agent wants to throw a Valentine's Day party, the agents autonomously spread invitations to the party over the next two days, make new acquaintances, ask each other out on dates to the party, and coordinate to show up for the party together at the right time. We demonstrate through ablation that the components of our agent architecture--observation, planning, and reflection--each contribute critically to the believability of agent behavior. By fusing large language models with computational, interactive agents, this work introduces architectural and interaction patterns for enabling believable simulations of human behavior.	cs.AI, cs.HC, cs.LG	2023-04-07		memory				
20260627	Agent-Memory-Paper-List	https://github.com/Shichun-Liu/Agent-Memory-Paper-List	https://arxiv.org/abs/2304.06975	HuaTuo: Tuning LLaMA Model with Chinese Medical Knowledge	Haochun Wang, Chi Liu, Nuwa Xi, Zewen Qiang, Sendong Zhao, Bing Qin, Ting Liu	Large Language Models (LLMs), such as the LLaMA model, have demonstrated their effectiveness in various general-domain natural language processing (NLP) tasks. Nevertheless, LLMs have not yet performed optimally in biomedical domain tasks due to the need for medical expertise in the responses. In response to this challenge, we propose HuaTuo, a LLaMA-based model that has been supervised-fine-tuned with generated QA (Question-Answer) instances. The experimental results demonstrate that HuaTuo generates responses that possess more reliable medical knowledge. Our proposed HuaTuo model is accessible at https://github.com/SCIR-HI/Huatuo-Llama-Med-Chinese.	cs.CL	2023-04-14		memory				
20260627	Agent-Memory-Paper-List	https://github.com/Shichun-Liu/Agent-Memory-Paper-List	https://arxiv.org/abs/2304.13343	SCM: Enhancing Large Language Model with Self-Controlled Memory Framework	Bing Wang, Xinnian Liang, Jian Yang, Hui Huang, Shuangzhi Wu, Peihao Wu, Lu Lu, Zejun Ma, Zhoujun Li	Large Language Models (LLMs) are constrained by their inability to process lengthy inputs, resulting in the loss of critical historical information. To address this limitation, in this paper, we propose the Self-Controlled Memory (SCM) framework to enhance the ability of LLMs to maintain long-term memory and recall relevant information. Our SCM framework comprises three key components: an LLM-based agent serving as the backbone of the framework, a memory stream storing agent memories, and a memory controller updating memories and determining when and how to utilize memories from memory stream. Additionally, the proposed SCM is able to process ultra-long texts without any modification or fine-tuning, which can integrate with any instruction following LLMs in a plug-and-play paradigm. Furthermore, we annotate a dataset to evaluate the effectiveness of SCM for handling lengthy inputs. The annotated dataset covers three tasks: long-term dialogues, book summarization, and meeting summarization. Experimental results demonstrate that our method achieves better retrieval recall and generates more informative responses compared to competitive baselines in long-term dialogues. (https://github.com/wbbeyourself/SCM4LLMs)	cs.CL	2023-04-26		memory				
20260627	Agent-Memory-Paper-List	https://github.com/Shichun-Liu/Agent-Memory-Paper-List	https://arxiv.org/abs/2512.04763	MemLoRA: Distilling Expert Adapters for On-Device Memory Systems	Massimo Bini, Ondrej Bohdal, Umberto Michieli, Zeynep Akata, Mete Ozay, Taha Ceritli	Memory-augmented Large Language Models (LLMs) have demonstrated remarkable consistency during prolonged dialogues by storing relevant memories and incorporating them as context. Such memory-based personalization is also key in on-device settings that allow users to keep their conversations and data private. However, memory-augmented systems typically rely on LLMs that are too costly for local on-device deployment. Even though Small Language Models (SLMs) are more suitable for on-device inference than LLMs, they cannot achieve sufficient performance. Additionally, these LLM-based systems lack native visual capabilities, limiting their applicability in multimodal contexts. In this paper, we introduce (i) MemLoRA, a novel memory system that enables local deployment by equipping SLMs with specialized memory adapters, and (ii) its vision extension MemLoRA-V, which integrates small Vision-Language Models (SVLMs) to memory systems, enabling native visual understanding. Following knowledge distillation principles, each adapter is trained separately for specific memory operations$\unicode{x2013}$knowledge extraction, memory update, and memory-augmented generation. Equipped with memory adapters, small models enable accurate on-device memory operations without cloud dependency. On text-only operations, MemLoRA outperforms 10$\times$ larger baseline models (e.g., Gemma2-27B) and achieves performance comparable to 60$\times$ larger models (e.g., GPT-OSS-120B) on the LoCoMo benchmark. To evaluate visual understanding operations instead, we extend LoCoMo with challenging Visual Question Answering tasks that require direct visual reasoning. On this, our VLM-integrated MemLoRA-V shows massive improvements over caption-based approaches (81.3 vs. 23.7 accuracy) while keeping strong performance in text-based tasks, demonstrating the efficacy of our method in multimodal contexts.	cs.CL, cs.CV, cs.LG	2025-12-04		memory				
20260627	Agent-Memory-Paper-List	https://github.com/Shichun-Liu/Agent-Memory-Paper-List	https://arxiv.org/abs/2510.02375	Pretraining with hierarchical memories: separating long-tail and common knowledge	Hadi Pouransari, David Grangier, C Thomas, Michael Kirchhof, Oncel Tuzel	The impressive performance gains of modern language models currently rely on scaling parameters: larger models store more world knowledge and reason better. Yet compressing all world knowledge into parameters is unnecessary, as only a fraction is used per prompt, and impractical for edge devices with limited inference-time memory and compute. We address this shortcoming by a memory-augmented architecture and a pretraining strategy aligned with existing hardware paradigms. We introduce small language models that access large hierarchical parametric memory banks encoding world knowledge. During pretraining and inference, we fetch a small, context-dependent memory block and add it to the model. Our pretraining learns to store long-tail world knowledge in the memory parameters, while the small language model acts as an anchor capturing common knowledge and general reasoning abilities. Through trillion-token-scale experiments, we show significant gains: a 160M-parameters model augmented with an 18M-parameters memory fetched from a 4.6B memory bank obtains comparable performance to a regular model with more than 2x the parameters. Through extensive experiments, we study the optimal type and size of parametric memories in transformers, scaling them to over 21B parameters. We find that our proposed hierarchical feed-forward memories work robustly across transformer architectures, whether added during pretraining or post-hoc.	cs.AI, cs.CL, cs.LG	2025-09-29		memory				
20260627	Agent-Memory-Paper-List	https://github.com/Shichun-Liu/Agent-Memory-Paper-List	https://arxiv.org/abs/2508.09874	Memory Decoder: A Pretrained, Plug-and-Play Memory for Large Language Models	Jiaqi Cao, Jiarui Wang, Rubin Wei, Qipeng Guo, Kai Chen, Bowen Zhou, Zhouhan Lin	Large Language Models (LLMs) have shown strong abilities in general language tasks, yet adapting them to specific domains remains a challenge. Current method like Domain Adaptive Pretraining (DAPT) requires costly full-parameter training and suffers from catastrophic forgetting. Meanwhile, Retrieval-Augmented Generation (RAG) introduces substantial inference latency due to expensive nearest-neighbor searches and longer context. This paper introduces Memory Decoder, a plug-and-play pretrained memory that enables efficient domain adaptation without changing the original model's parameters. Memory Decoder employs a small transformer decoder that learns to imitate the behavior of an external non-parametric retriever. Once trained, Memory Decoder can be seamlessly integrated with any pretrained language model that shares the same tokenizer, requiring no model-specific modifications. Experimental results demonstrate that Memory Decoder enables effective adaptation of various Qwen and Llama models to three distinct specialized domains: biomedicine, finance, and law, reducing perplexity by an average of 6.17 points. Overall, Memory Decoder introduces a novel paradigm centered on a specially pretrained memory component designed for domain-specific adaptation. This memory architecture can be integrated in a plug-and-play manner, consistently enhancing performance across multiple models within the target domain.	cs.AI, cs.CL	2025-08-13		memory				
20260627	Agent-Memory-Paper-List	https://github.com/Shichun-Liu/Agent-Memory-Paper-List	https://arxiv.org/abs/2508.01832	MLP Memory: A Retriever-Pretrained Memory for Large Language Models	Rubin Wei, Jiaqi Cao, Jiarui Wang, Jushi Kai, Qipeng Guo, Bowen Zhou, Zhouhan Lin	Modern approaches to enhancing Large Language Models' factual accuracy and knowledge utilization face a fundamental trade-off: non-parametric retrieval-augmented generation (RAG) provides flexible access to external knowledge but suffers from high inference latency and shallow integration, while parametric fine-tuning methods like LoRA risk catastrophic forgetting and degraded general capabilities. In this work, we propose MLP Memory, a lightweight parametric module that learns to internalize retrieval patterns without explicit document access. By pretraining an MLP to imitate a $k$NN retriever's behavior on the entire pretraining dataset, we create a differentiable memory component that captures the benefits of retrieval-based knowledge access in a fully parametric form. Our architecture integrates this pretrained MLP Memory with Transformer decoders through simple probability interpolation, yielding 17.5\% and 24.1\% scaling gains on WikiText-103 and Web datasets, respectively. It further achieves 12.3\% relative improvement on five question-answering benchmarks and 5.2 points absolute gain across nine general NLP tasks, while reducing hallucinations by up to 10 points on HaluEval. Moreover, MLP Memory delivers 2.5$\times$ faster inference than RAG with superior accuracy. Our findings show that learning retrieval patterns parametrically bridges the gap between efficient inference and effective knowledge access, offering a practical alternative to both RAG and fine-tuning approaches.	cs.CL	2025-08-03		memory				
20260627	Agent-Memory-Paper-List	https://github.com/Shichun-Liu/Agent-Memory-Paper-List	https://arxiv.org/abs/2410.02355	AlphaEdit: Null-Space Constrained Knowledge Editing for Language Models	Junfeng Fang, Houcheng Jiang, Kun Wang, Yunshan Ma, Shi Jie, Xiang Wang, Xiangnan He, Tat-seng Chua	Large language models (LLMs) often exhibit hallucinations due to incorrect or outdated knowledge. Hence, model editing methods have emerged to enable targeted knowledge updates. To achieve this, a prevailing paradigm is the locating-then-editing approach, which first locates influential parameters and then edits them by introducing a perturbation. While effective, current studies have demonstrated that this perturbation inevitably disrupt the originally preserved knowledge within LLMs, especially in sequential editing scenarios. To address this, we introduce AlphaEdit, a novel solution that projects perturbation onto the null space of the preserved knowledge before applying it to the parameters. We theoretically prove that this projection ensures the output of post-edited LLMs remains unchanged when queried about the preserved knowledge, thereby mitigating the issue of disruption. Extensive experiments on various LLMs, including LLaMA3, GPT2-XL, and GPT-J, show that AlphaEdit boosts the performance of most locating-then-editing methods by an average of 36.7% with a single line of additional code for projection solely. Our code is available at: https://github.com/jianghoucheng/AlphaEdit.	cs.AI, cs.CL	2024-10-03	13th International Conference on Learning Representations (ICLR 2025 Oral)	memory				
20260627	Agent-Memory-Paper-List	https://github.com/Shichun-Liu/Agent-Memory-Paper-List	https://arxiv.org/abs/2104.08164	Editing Factual Knowledge in Language Models	Nicola De Cao, Wilker Aziz, Ivan Titov	The factual knowledge acquired during pre-training and stored in the parameters of Language Models (LMs) can be useful in downstream tasks (e.g., question answering or textual inference). However, some facts can be incorrectly induced or become obsolete over time. We present KnowledgeEditor, a method which can be used to edit this knowledge and, thus, fix 'bugs' or unexpected predictions without the need for expensive re-training or fine-tuning. Besides being computationally efficient, KnowledgeEditordoes not require any modifications in LM pre-training (e.g., the use of meta-learning). In our approach, we train a hyper-network with constrained optimization to modify a fact without affecting the rest of the knowledge; the trained hyper-network is then used to predict the weight update at test time. We show KnowledgeEditor's efficacy with two popular architectures and knowledge-intensive tasks: i) a BERT model fine-tuned for fact-checking, and ii) a sequence-to-sequence BART model for question answering. With our method, changing a prediction on the specific wording of a query tends to result in a consistent change in predictions also for its paraphrases. We show that this can be further encouraged by exploiting (e.g., automatically-generated) paraphrases during training. Interestingly, our hyper-network can be regarded as a 'probe' revealing which components need to be changed to manipulate factual knowledge; our analysis shows that the updates tend to be concentrated on a small subset of components. Source code available at https://github.com/nicola-decao/KnowledgeEditor	cs.AI, cs.CL, cs.LG	2021-04-16		memory				
