date_seen	source_name	source_url	paper_url	title	authors	abstract	keywords	pub_date	place	category	viewed	read	bookmarked	labelled
20260627	Agent-Memory-Paper-List	https://github.com/Shichun-Liu/Agent-Memory-Paper-List	https://arxiv.org/abs/2510.13363	D-SMART: Enhancing LLM Dialogue Consistency via Dynamic Structured Memory And Reasoning Tree	Xiang Lei, Qin Li, Min Zhang, Min Zhang	Large Language Models (LLMs) often exhibit factual inconsistencies and logical decay in extended, multi-turn dialogues, a challenge stemming from their reliance on static, pre-trained knowledge and an inability to reason adaptively over the dialogue history. Prevailing mitigation strategies, such as Retrieval-Augmented Generation (RAG) and agentic working memories, improve information recall but still engage with fundamentally static knowledge sources and follow pre-defined single reasoning path. This hinders their ability to preserve factual and logical consistency of their responses in multi-turn dialogues while the context evolves over time. To address this issue, we propose D-SMART, a model-agnostic framework designed to maintain multi-turn dialogue consistency by enabling LLMs to build and reason over a dynamic, structured representation of the conversational context. This is achieved via two synergistic components: (1) a Dynamic Structured Memory (DSM), which incrementally constructs and maintains an authoritative, OWL-compliant knowledge graph of the conversation; and (2) a Reasoning Tree (RT), which executes inferences as an explicit and traceable multi-step search over the graph. As the popular-used quality score (judged by GPT-4) can overlook logical flaws, we introduce new NLI-based metrics to better measure multi-turn dialogue consistency. Comprehensive experiments on the MT-Bench-101 benchmark show that D-SMART significantly outperforms state-of-the-art baselines, elevating the dialogue consistency score by over 48\% for both proprietary and open-source models, and notably improves the quality score of the latter by up to 10.1\%.	cs.CL	2025-10-15		memory				
20260627	Agent-Memory-Paper-List	https://github.com/Shichun-Liu/Agent-Memory-Paper-List	https://arxiv.org/abs/2509.13312	WebWeaver: Structuring Web-Scale Evidence with Dynamic Outlines for Open-Ended Deep Research	Zijian Li, Xin Guan, Bo Zhang, Shen Huang, Houquan Zhou, Shaopeng Lai, Ming Yan, Yong Jiang, Pengjun Xie, Fei Huang, Jun Zhang, Jingren Zhou	This paper tackles \textbf{open-ended deep research (OEDR)}, a complex challenge where AI agents must synthesize vast web-scale information into insightful reports. Current approaches are plagued by dual-fold limitations: static research pipelines that decouple planning from evidence acquisition and monolithic generation paradigms that include redundant, irrelevant evidence, suffering from hallucination issues and low citation accuracy. To address these challenges, we introduce \textbf{WebWeaver}, a novel dual-agent framework that emulates the human research process. The planner operates in a dynamic cycle, iteratively interleaving evidence acquisition with outline optimization to produce a comprehensive, citation-grounded outline linking to a memory bank of evidence. The writer then executes a hierarchical retrieval and writing process, composing the report section by section. By performing targeted retrieval of only the necessary evidence from the memory bank via citations for each part, it effectively mitigates long-context issues and citation hallucinations. Our framework establishes a new state-of-the-art across major OEDR benchmarks, including DeepResearch Bench, DeepConsult, and DeepResearchGym. These results validate our human-centric, iterative methodology, demonstrating that adaptive planning and focused synthesis are crucial for producing comprehensive, trusted, and well-structured reports.	cs.CL	2025-09-16		memory				
20260627	Agent-Memory-Paper-List	https://github.com/Shichun-Liu/Agent-Memory-Paper-List	https://arxiv.org/abs/2510.05520	CAM: A Constructivist View of Agentic Memory for LLM-Based Reading Comprehension	Rui Li, Zeyu Zhang, Xiaohe Bo, Zihang Tian, Xu Chen, Quanyu Dai, Zhenhua Dong, Ruiming Tang	Current Large Language Models (LLMs) are confronted with overwhelming information volume when comprehending long-form documents. This challenge raises the imperative of a cohesive memory module, which can elevate vanilla LLMs into autonomous reading agents. Despite the emergence of some heuristic approaches, a systematic design principle remains absent. To fill this void, we draw inspiration from Jean Piaget's Constructivist Theory, illuminating three traits of the agentic memory -- structured schemata, flexible assimilation, and dynamic accommodation. This blueprint forges a clear path toward a more robust and efficient memory system for LLM-based reading comprehension. To this end, we develop CAM, a prototype implementation of Constructivist Agentic Memory that simultaneously embodies the structurality, flexibility, and dynamicity. At its core, CAM is endowed with an incremental overlapping clustering algorithm for structured memory development, supporting both coherent hierarchical summarization and online batch integration. During inference, CAM adaptively explores the memory structure to activate query-relevant information for contextual response, akin to the human associative process. Compared to existing approaches, our design demonstrates dual advantages in both performance and efficiency across diverse long-text reading comprehension tasks, including question answering, query-based summarization, and claim verification.	cs.AI, cs.CL	2025-10-07		memory				
20260627	Agent-Memory-Paper-List	https://github.com/Shichun-Liu/Agent-Memory-Paper-List	https://arxiv.org/abs/2509.10852	Pre-Storage Reasoning for Episodic Memory: Shifting Inference Burden to Memory for Personalized Dialogue	Sangyeop Kim, Yohan Lee, Sanghwa Kim, Hyunjong Kim, Sungzoon Cho	Effective long-term memory in conversational AI requires synthesizing information across multiple sessions. However, current systems place excessive reasoning burden on response generation, making performance significantly dependent on model sizes. We introduce PREMem (Pre-storage Reasoning for Episodic Memory), a novel approach that shifts complex reasoning processes from inference to memory construction. PREMem extracts fine-grained memory fragments categorized into factual, experiential, and subjective information; it then establishes explicit relationships between memory items across sessions, capturing evolution patterns like extensions, transformations, and implications. By performing this reasoning during pre-storage rather than when generating a response, PREMem creates enriched representations while reducing computational demands during interactions. Experiments show significant performance improvements across all model sizes, with smaller models achieving results comparable to much larger baselines while maintaining effectiveness even with constrained token budgets. Code and dataset are available at https://github.com/sangyeop-kim/PREMem.	cs.AI, cs.CL	2025-09-13		memory				
20260627	Agent-Memory-Paper-List	https://github.com/Shichun-Liu/Agent-Memory-Paper-List	https://arxiv.org/abs/2510.18866	LightMem: Lightweight and Efficient Memory-Augmented Generation	Jizhan Fang, Xinle Deng, Haoming Xu, Ziyan Jiang, Yuqi Tang, Ziwen Xu, Shumin Deng, Yunzhi Yao, Mengru Wang, Shuofei Qiao, Huajun Chen, Ningyu Zhang	Despite their remarkable capabilities, Large Language Models (LLMs) struggle to effectively leverage historical interaction information in dynamic and complex environments. Memory systems enable LLMs to move beyond stateless interactions by introducing persistent information storage, retrieval, and utilization mechanisms. However, existing memory systems often introduce substantial time and computational overhead. To this end, we introduce a new memory system called LightMem, which strikes a balance between the performance and efficiency of memory systems. Inspired by the Atkinson-Shiffrin model of human memory, LightMem organizes memory into three complementary stages. First, cognition-inspired sensory memory rapidly filters irrelevant information through lightweight compression and groups information according to their topics. Next, topic-aware short-term memory consolidates these topic-based groups, organizing and summarizing content for more structured access. Finally, long-term memory with sleep-time update employs an offline procedure that decouples consolidation from online inference. On LongMemEval and LoCoMo, using GPT and Qwen backbones, LightMem consistently surpasses strong baselines, improving QA accuracy by up to 7.7% / 29.3%, reducing total token usage by up to 38x / 20.9x and API calls by up to 30x / 55.5x, while purely online test-time costs are even lower, achieving up to 106x / 117x token reduction and 159x / 310x fewer API calls. The code is available at https://github.com/zjunlp/LightMem.	cs.AI, cs.CL, cs.CV, cs.LG, cs.MA	2025-10-21		memory				
20260627	Agent-Memory-Paper-List	https://github.com/Shichun-Liu/Agent-Memory-Paper-List	https://arxiv.org/abs/2510.16392	RGMem: Renormalization Group-inspired Memory Evolution for Language Agents	Ao Tian, Yunfeng Lu, Xinxin Fan, Changhao Wang, Lanzhi Zhou, Yeyao Zhang, Yanfang Liu	Personalized and continuous interactions are critical for LLM-based conversational agents, yet finite context windows and static parametric memory hinder the modeling of long-term, cross-session user states. Existing approaches, including retrieval-augmented generation and explicit memory systems, primarily operate at the fact level, making it difficult to distill stable preferences and deep user traits from evolving and potentially conflicting dialogues.To address this challenge, we propose RGMem, a self-evolving memory framework inspired by the renormalization group (RG) perspective on multi-scale organization and emergence. RGMem models long-term conversational memory as a multi-scale evolutionary process: episodic interactions are transformed into semantic facts and user insights, which are then progressively integrated through hierarchical coarse-graining, thresholded updates, and rescaling into a dynamically evolving user profile.By explicitly separating fast-changing evidence from slow-varying traits and enabling non-linear, phase-transition-like dynamics, RGMem enables robust personalization beyond flat retrieval or static summarization. Extensive experiments on the LOCOMO and PersonaMem benchmarks demonstrate that RGMem consistently outperforms SOTA memory systems, achieving stronger cross-session continuity and improved adaptation to evolving user preferences. Code is available at https://github.com/fenhg297/RGMem	cs.AI	2025-10-18		memory				
20260627	Agent-Memory-Paper-List	https://github.com/Shichun-Liu/Agent-Memory-Paper-List	https://arxiv.org/abs/2509.25911	Mem-α: Learning Memory Construction via Reinforcement Learning	Yu Wang, Ryuichi Takanobu, Zhiqi Liang, Yuzhen Mao, Yuanzhe Hu, Julian McAuley, Xiaojian Wu	Large language model (LLM) agents are constrained by limited context windows, necessitating external memory systems for long-term information understanding. Current memory-augmented agents typically depend on pre-defined instructions and tools for memory updates. However, language models may lack the ability to determine which information to store, how to structure it, and when to update it, especially as memory systems become more complex. This results in suboptimal memory construction and information loss. To this end, we propose Mem-alpha, a reinforcement learning framework that trains agents to effectively manage complex memory systems through interaction and feedback. We also construct a specialized training dataset spanning diverse multi-turn interaction patterns paired with comprehensive evaluation questions designed to teach effective memory management. During training, agents process sequential information chunks, learn to extract and store relevant content, then update the memory system. The reward signal derives from downstream question-answering accuracy over the full interaction history, directly optimizing for memory construction. To illustrate the effectiveness of our training framework, we design a memory architecture comprising core, episodic, and semantic components, equipped with multiple tools for memory operations. Empirical evaluation demonstrates that Mem-alpha achieves significant improvements over existing memory-augmented agent baselines. Despite being trained exclusively on instances with a maximum length of 30k tokens, our agents exhibit remarkable generalization to sequences exceeding 400k tokens, over 13x the training length, highlighting the robustness of Mem-alpha.	cs.CL	2025-09-30		memory				
20260627	Agent-Memory-Paper-List	https://github.com/Shichun-Liu/Agent-Memory-Paper-List	https://arxiv.org/abs/2509.21212	SGMem: Sentence Graph Memory for Long-Term Conversational Agents	Yaxiong Wu, Yongyue Zhang, Sheng Liang, Yong Liu	Long-term conversational agents require effective memory management to handle dialogue histories that exceed the context window of large language models (LLMs). Existing methods based on fact extraction or summarization reduce redundancy but struggle to organize and retrieve relevant information across different granularities of dialogue and generated memory. We introduce SGMem (Sentence Graph Memory), which represents dialogue as sentence-level graphs within chunked units, capturing associations across turn-, round-, and session-level contexts. By combining retrieved raw dialogue with generated memory such as summaries, facts and insights, SGMem supplies LLMs with coherent and relevant context for response generation. Experiments on LongMemEval and LoCoMo show that SGMem consistently improves accuracy and outperforms strong baselines in long-term conversational question answering.	cs.CL, cs.IR	2025-09-25		memory				
20260627	Agent-Memory-Paper-List	https://github.com/Shichun-Liu/Agent-Memory-Paper-List	https://arxiv.org/abs/2508.03341	What Deserves Memory: Adaptive Memory Distillation for LLM Agents	Wenquan Ma, Jiayan Nan, Wenlong Wu, Yize Chen	Memory systems for LLM agents struggle to determine what information deserves retention. Existing approaches rely on predefined heuristics such as importance scores, emotional tags, or factual templates, encoding designer intuition rather than learning from the data itself. Inspired by cognitive ideas, we propose NEMORI, an adaptive memory distillation framework that casts the assessment of experience's future utility as a matter of predictability. Specifically, NEMORI comprises two cascading modules: Episodic Memory Integration transforms raw interactions into coherent narratives, and Semantic Knowledge Distillation extracts insights via prediction error. Centering on distillation, the framework remains agnostic to downstream management. Extensive experiments confirm that NEMORI achieves strong performance, efficiency, and storage reduction. Our work suggests that observing the intrinsic properties of interaction sequences offers a viable, data-driven alternative to heuristic-based memory design. Code: https://github.com/nemori-ai/nemori.	cs.AI	2025-08-05		memory				
20260627	Agent-Memory-Paper-List	https://github.com/Shichun-Liu/Agent-Memory-Paper-List	https://arxiv.org/abs/2509.11860	MOOM: Maintenance, Organization and Optimization of Memory in Ultra-Long Role-Playing Dialogues	Weishu Chen, Jinyi Tang, Zhouhui Hou, Shihao Han, Mingjie Zhan, Zhiyuan Huang, Delong Liu, Jiawei Guo, Zhicheng Zhao, Fei Su	Memory extraction is crucial for maintaining coherent ultra-long dialogues in human-robot role-playing scenarios. However, existing methods often exhibit uncontrolled memory growth. To address this, we propose MOOM, the first dual-branch memory plugin that leverages literary theory by modeling plot development and character portrayal as core storytelling elements. Specifically, one branch summarizes plot conflicts across multiple time scales, while the other extracts the user's character profile. MOOM further integrates a forgetting mechanism, inspired by the ``competition-inhibition'' memory theory, to constrain memory capacity and mitigate uncontrolled growth. Furthermore, we present ZH-4O, a Chinese ultra-long dialogue dataset specifically designed for role-playing, featuring dialogues that average 600 turns and include manually annotated memory information. Experimental results demonstrate that MOOM outperforms all state-of-the-art memory extraction methods, requiring fewer large language model invocations while maintaining a controllable memory capacity.	cs.CL	2025-09-15		memory				
20260627	Agent-Memory-Paper-List	https://github.com/Shichun-Liu/Agent-Memory-Paper-List	https://arxiv.org/abs/2508.15294	A Multi-Memory Segment System for Generating High-Quality Long-Term Memory Content in Agents	Gaoke Zhang, Bo Wang, Yunlong Ma, Dongming Zhao, Zifei Yu	In the current field of agent memory, extensive explorations have been conducted in the area of memory retrieval, yet few studies have focused on exploring the memory content. Most research simply stores summarized versions of historical dialogues, as exemplified by methods like A-MEM and MemoryBank. However, when humans form long-term memories, the process involves multi-dimensional and multi-component generation, rather than merely creating simple summaries. The low-quality memory content generated by existing methods can adversely affect recall performance and response quality. In order to better construct high-quality long-term memory content, we have designed a multi-memory segment system (MMS) inspired by cognitive psychology theory. The system processes short-term memory into multiple long-term memory segments, and constructs retrieval memory units and contextual memory units based on these segments, with a one-to-one correspondence between the two. During the retrieval phase, MMS will match the most relevant retrieval memory units based on the user's query. Then, the corresponding contextual memory units is obtained as the context for the response stage to enhance knowledge, thereby effectively utilizing historical data. We conducted experiments on the LoCoMo dataset and further performed ablation experiments, experiments on the robustness regarding the number of input memories, and overhead experiments, which demonstrated the effectiveness and practical value of our method.	cs.AI, cs.CL, cs.MA	2025-08-21		memory				
20260627	Agent-Memory-Paper-List	https://github.com/Shichun-Liu/Agent-Memory-Paper-List	https://arxiv.org/abs/2508.12630	Semantic Anchoring in Agentic Memory: Leveraging Linguistic Structures for Persistent Conversational Context	Maitreyi Chatterjee, Devansh Agarwal	Large Language Models (LLMs) have demonstrated impressive fluency and task competence in conversational settings. However, their effectiveness in multi-session and long-term interactions is hindered by limited memory persistence. Typical retrieval-augmented generation (RAG) systems store dialogue history as dense vectors, which capture semantic similarity but neglect finer linguistic structures such as syntactic dependencies, discourse relations, and coreference links. We propose Semantic Anchoring, a hybrid agentic memory architecture that enriches vector-based storage with explicit linguistic cues to improve recall of nuanced, context-rich exchanges. Our approach combines dependency parsing, discourse relation tagging, and coreference resolution to create structured memory entries. Experiments on adapted long-term dialogue datasets show that semantic anchoring improves factual recall and discourse coherence by up to 18% over strong RAG baselines. We further conduct ablation studies, human evaluations, and error analysis to assess robustness and interpretability.	cs.CL	2025-08-18		memory				
20260627	Agent-Memory-Paper-List	https://github.com/Shichun-Liu/Agent-Memory-Paper-List	https://arxiv.org/abs/2508.10419	ComoRAG: A Cognitive-Inspired Memory-Organized RAG for Stateful Long Narrative Reasoning	Juyuan Wang, Rongchen Zhao, Wei Wei, Yufeng Wang, Mo Yu, Jie Zhou, Jin Xu, Liyan Xu	Narrative comprehension on long stories and novels has been a challenging domain attributed to their intricate plotlines and entangled, often evolving relations among characters and entities. Given the LLM's diminished reasoning over extended context and its high computational cost, retrieval-based approaches remain a pivotal role in practice. However, traditional RAG methods could fall short due to their stateless, single-step retrieval process, which often overlooks the dynamic nature of capturing interconnected relations within long-range context. In this work, we propose ComoRAG, holding the principle that narrative reasoning is not a one-shot process, but a dynamic, evolving interplay between new evidence acquisition and past knowledge consolidation, analogous to human cognition on reasoning with memory-related signals in the brain. Specifically, when encountering a reasoning impasse, ComoRAG undergoes iterative reasoning cycles while interacting with a dynamic memory workspace. In each cycle, it generates probing queries to devise new exploratory paths, then integrates the retrieved evidence of new aspects into a global memory pool, thereby supporting the emergence of a coherent context for the query resolution. Across four challenging long-context narrative benchmarks (200K+ tokens), ComoRAG outperforms strong RAG baselines with consistent relative gains up to 11% compared to the strongest baseline. Further analysis reveals that ComoRAG is particularly advantageous for complex queries requiring global context comprehension, offering a principled, cognitively motivated paradigm towards retrieval-based stateful reasoning. Our framework is made publicly available at https://github.com/EternityJune25/ComoRAG.	cs.AI, cs.CL, cs.LG	2025-08-14		memory				
20260627	Agent-Memory-Paper-List	https://github.com/Shichun-Liu/Agent-Memory-Paper-List	https://arxiv.org/abs/2508.19005	Building Self-Evolving Agents via Experience-Driven Lifelong Learning: A Framework and Benchmark	Yuxuan Cai, Yipeng Hao, Jie Zhou, Hang Yan, Zhikai Lei, Rui Zhen, Zhenhua Han, Yutao Yang, Junsong Li, Qianjun Pan, Tianyu Huai, Qin Chen, Xin Li, Kai Chen, Bo Zhang, Xipeng Qiu, Liang He	"As AI advances toward general intelligence, the focus is shifting from systems optimized for static tasks to creating open-ended agents that learn continuously. In this paper, we introduce Experience-driven Lifelong Learning (ELL), a framework for building self-evolving agents capable of continuous growth through real-world interaction. The framework is built on four core principles: (1) Experience Exploration: Agents learn through continuous, self-motivated interaction with dynamic environments, navigating interdependent tasks and generating rich experiential trajectories. (2) Long-term Memory: Agents preserve and structure historical knowledge, including personal experiences, domain expertise, and commonsense reasoning, into a persistent memory system. (3) Skill Learning: Agents autonomously improve by abstracting recurring patterns from experience into reusable skills, which are actively refined and validated for application in new tasks. (4) Knowledge Internalization: Agents internalize explicit and discrete experiences into implicit and intuitive capabilities as ""second nature"".   We also introduce StuLife, a benchmark dataset for ELL that simulates a student's holistic college journey, from enrollment to academic and personal development, across three core phases and ten detailed sub-scenarios. StuLife is designed around three key paradigm"	cs.AI, cs.CL	2025-08-26		memory				
20260627	Agent-Memory-Paper-List	https://github.com/Shichun-Liu/Agent-Memory-Paper-List	https://arxiv.org/abs/2508.09736	Seeing, Listening, Remembering, and Reasoning: A Multimodal Agent with Long-Term Memory	Lin Long, Yichen He, Wentao Ye, Yiyuan Pan, Yuan Lin, Hang Li, Junbo Zhao, Wei Li	We introduce M3-Agent, a novel multimodal agent framework equipped with long-term memory. Like humans, M3-Agent can process real-time visual and auditory inputs to build and update episodic and semantic memories, gradually accumulating world knowledge. Its memory is organized in an entity-centric, multimodal manner, enabling deeper and more consistent understanding of the environment. Given an instruction, M3-Agent autonomously performs multi-turn reasoning and retrieves relevant memories to complete tasks. To evaluate memory effectiveness and memory-based reasoning in multimodal agents, we develop M3-Bench, a long-video question answering benchmark comprising 100 newly recorded robot-perspective videos (M3-Bench-robot) and 920 diverse web-sourced videos (M3-Bench-web). We annotate QA pairs designed to test capabilities essential for agent applications, such as person understanding, general knowledge extraction, and cross-modal reasoning. Experimental results show that M3-Agent, trained via reinforcement learning, outperforms the strongest baseline, a prompting agent using Gemini-1.5-pro and GPT-4o, achieving 6.7%, 7.7%, and 5.3% higher accuracy on M3-Bench-robot, M3-Bench-web and VideoMME-long, respectively. Our work advances multimodal agents toward more human-like long-term memory and provides insights for their practical design. Model, code and data are available at https://github.com/bytedance-seed/m3-agent.	cs.CV	2025-08-13		memory				
