date_seen	source_name	source_url	paper_url	title	authors	abstract	keywords	pub_date	place	category	viewed	read	bookmarked	labelled	impactful_researcher	impactful_institution
20260627	XieLab	https://github.com/xie-lab-ml/deep-learning-dynamics-paper-list	https://openreview.net/forum?id=UOgyaswHo7	Towards a better understanding of representation dynamics under TD-learning	Yunhao Tang, Remi Munos	TD-learning is a foundation reinforcement learning (RL) algorithm for value prediction. Critical to the accuracy of value predictions is the quality of state representations. In this work, we consider the question: how does end-to-end TD-learning impact the representation over time? Complementary to prior work, we provide a set of analysis that sheds further light on the representation dynamics under TD-learning. We first show that when the environments are reversible, end-to-end TD-learning strictly decreases the value approximation error over time. Under further assumptions on the environments, we can connect the representation dynamics with spectral decomposition over the transition matrix. This latter finding establishes fitting multiple value functions from randomly generated rewards as a useful auxiliary task for representation learning, as we empirically validate on both tabular and Atari game suites.		2023-01-24	ICML 2023	training						
20260627	XieLab	https://github.com/xie-lab-ml/deep-learning-dynamics-paper-list	https://openreview.net/forum?id=jNpmHrHVWZ	A Theoretical Analysis of the Learning Dynamics under Class Imbalance	Emanuele Francazi, Marco Baity-Jesi, Aurelien Lucchi	Data imbalance is a common problem in machine learning that can have a critical effect on the performance of a model. Various solutions exist but their impact on the convergence of the learning dynamics is not understood. Here, we elucidate the significant negative impact of data imbalance on learning, showing that the learning curves for minority and majority classes follow sub-optimal trajectories when training with a gradient-based optimizer. This slowdown is related to the imbalance ratio and can be traced back to a competition between the optimization of different classes. Our main contribution is the analysis of the convergence of full-batch (GD) and stochastic gradient descent (SGD), and of variants that renormalize the contribution of each per-class gradient. We find that GD is not guaranteed to decrease the loss for each class but that this problem can be addressed by performing a per-class normalization of the gradient. With SGD, class imbalance has an additional effect on the direction of the gradients: the minority class suffers from a higher directional noise, which reduces the effectiveness of the per-class gradient normalization. Our findings not only allow us to understand the potential and limitations of strategies involving the per-class gradients, but also the reason for the effectiveness of previously used solutions for class imbalancesuch as oversampling.		2023-01-26	ICML 2023	training						
20260627	XieLab	https://github.com/xie-lab-ml/deep-learning-dynamics-paper-list	https://openreview.net/forum?id=konBXvt2iS	Understanding Multi-phase Optimization Dynamics and Rich Nonlinear Behaviors of ReLU Networks	Mingze Wang, Chao Ma	The training process of ReLU neural networks often exhibits complicated nonlinear phenomena.  The nonlinearity of models and non-convexity of loss pose significant challenges for theoretical analysis. Therefore, most previous theoretical works on the optimization dynamics of neural networks focus either on local analysis (like the end of training) or approximate linear models (like Neural Tangent Kernel).  In this work, we conduct a complete theoretical characterization of the training process of a two-layer ReLU network trained by Gradient Flow on a linearly separable data. In this specific setting, our analysis captures the whole optimization process starting from random initialization to final convergence.  Despite the relatively simple model and data that we studied, we reveal four different phases from the whole training process showing a general simplifying-to-complicating learning trend. Specific nonlinear behaviors can also be precisely identified and captured theoretically, such as initial condensation, saddle-to-plateau dynamics, plateau escape, changes of activation patterns,  learning with increasing complexity, etc.	non-convex optimization, training dynamics, neural network	2023-05-10	NeurIPS 2023	training						
20260627	XieLab	https://github.com/xie-lab-ml/deep-learning-dynamics-paper-list	https://openreview.net/forum?id=GGIA1p9fDT	CORNN: Convex optimization of recurrent neural networks for rapid inference of neural dynamics	Fatih Dinc, Adam Shai, Mark Schnitzer, Hidenori Tanaka	Advances in optical and electrophysiological recording technologies have made it possible to record the dynamics of thousands of neurons, opening up new possibilities for interpreting and controlling large neural populations in behaving animals. A promising way to extract computational principles from these large datasets is to train data-constrained recurrent neural networks (dRNNs). Performing this training in real-time could open doors for research techniques and medical applications to model and control interventions at single-cell resolution and drive desired forms of animal behavior. However, existing training algorithms for dRNNs are inefficient and have limited scalability, making it a challenge to analyze large neural recordings even in offline scenarios. To address these issues, we introduce a training method termed Convex Optimization of Recurrent Neural Networks (CORNN). In studies of simulated recordings, CORNN attained training speeds $\sim$100-fold faster than traditional optimization approaches while maintaining or enhancing modeling accuracy. We further validated CORNN on simulations with thousands of cells that performed simple computations such as those of a 3-bit flip-flop or the execution of a timed response. Finally, we showed that CORNN can robustly reproduce network dynamics and underlying attractor structures despite mismatches between generator and inference models, severe subsampling of observed neurons, or mismatches in neural time-scales. Overall, by training dRNNs with millions of parameters in subminute processing times on a standard computer, CORNN constitutes a first step towards real-time network reproduction constrained on large-scale neural recordings and a powerful computational tool for advancing the understanding of neural computation.	brain-machine interfaces, recurrent neural networks, convex optimization, computational neuroscience	2023-05-10	NeurIPS 2023	training						
20260627	XieLab	https://github.com/xie-lab-ml/deep-learning-dynamics-paper-list	https://openreview.net/forum?id=9STYRIVx6u	Convergence of mean-field Langevin dynamics: time-space discretization, stochastic gradient, and variance reduction	Taiji Suzuki, Denny Wu, Atsushi Nitanda	The mean-field Langevin dynamics (MFLD) is a nonlinear generalization of the Langevin dynamics that incorporates a distribution-dependent drift, and it naturally arises from the optimization of two-layer neural networks via (noisy) gradient descent. Recent works have shown that MFLD globally minimizes an entropy-regularized convex functional in the space of measures. However, all prior analyses assumed the infinite-particle or continuous-time limit, and cannot handle stochastic gradient updates. We provide a general framework to prove a uniform-in-time propagation of chaos for MFLD that takes into account the errors due to finite-particle approximation, time-discretization, and stochastic gradient. To demonstrate the wide applicability of our framework, we establish quantitative convergence rate guarantees to the regularized global optimal solution for $(i)$ a wide range of learning problems such as mean-field neural network and MMD minimization, and $(ii)$ different gradient estimators including SGD and SVRG. Despite the generality of our results, we achieve an improved convergence rate in both the SGD and SVRG settings when specialized to the standard Langevin dynamics.	mean-field regime, interacting particle system, propagation of chaos, Neural network optimization, MMD minimization	2023-05-11	NeurIPS 2023	training						
20260627	XieLab	https://github.com/xie-lab-ml/deep-learning-dynamics-paper-list	https://openreview.net/forum?id=Tj0eXVPnRX	Loss Dynamics of Temporal Difference Reinforcement Learning	Blake Bordelon, Paul Masset, Henry Kuo, Cengiz Pehlevan	Reinforcement learning has been successful across several applications in which agents have to learn to act in environments with sparse feedback. However, despite this empirical success there is still a lack of theoretical understanding of how the parameters of reinforcement learning models and the features used to represent states interact to control the dynamics of learning. In this work, we use concepts from statistical physics, to study the typical case learning curves for temporal difference learning of a value function with linear function approximators. Our theory is derived under a Gaussian equivalence hypothesis where averages over the random trajectories are replaced with temporally correlated Gaussian feature averages and we validate our assumptions on small scale Markov Decision Processes. We find that the stochastic semi-gradient noise due to subsampling the space of possible episodes leads to significant plateaus in the value error, unlike in traditional gradient descent dynamics. We study how learning dynamics and plateaus depend on feature structure, learning rate, discount factor, and reward function. We then analyze how strategies like learning rate annealing and reward shaping can favorably alter learning dynamics and plateaus. To conclude, our work introduces new tools to open a new direction towards developing a theory of learning dynamics in reinforcement learning.	Reinforcement Learning, Statistical Mechanics, Stochastic Gradient Descent	2023-05-10	NeurIPS 2023	training						
20260627	XieLab	https://github.com/xie-lab-ml/deep-learning-dynamics-paper-list	https://openreview.net/forum?id=aRBa0lSxEB	A Dynamical System View of Langevin-Based Non-Convex Sampling	Mohammad Reza Karimi Jaghargh, Ya-Ping Hsieh, Andreas Krause	Non-convex sampling is a key challenge in machine learning, central to non-convex optimization in deep learning as well as to approximate probabilistic inference. Despite its significance, theoretically there remain some important challenges: Existing guarantees suffer from the drawback of lacking guarantees for the last-iterates, and little is known beyond the elementary schemes of stochastic gradient Langevin dynamics. To address these issues, we develop a novel framework that lifts the above issues by harnessing several tools from the theory of dynamical systems. Our key result is that, for a large class of state-of-the-art sampling schemes, their last-iterate convergence in Wasserstein distances can be reduced to the study of their continuous-time counterparts, which is much better understood. Coupled with standard assumptions of MCMC sampling, our theory immediately yields the last-iterate Wasserstein convergence of many advanced sampling schemes such as mirror Langevin, proximal, randomized mid-point, and Runge-Kutta methods.	Non-Convex Sampling, Langevin Dynamics, Dynamical Systems	2023-05-10	NeurIPS 2023	training						
20260627	AdaptiveFoundation	https://github.com/OptimalFoundation/awesome-optimizers	https://arxiv.org/abs/1609.04747	An overview of gradient descent optimization algorithms	Sebastian Ruder	Gradient descent optimization algorithms, while increasingly popular, are often used as black-box optimizers, as practical explanations of their strengths and weaknesses are hard to come by. This article aims to provide the reader with intuitions with regard to the behaviour of different algorithms that will allow her to put them to use. In the course of this overview, we look at different variants of gradient descent, summarize challenges, introduce the most common optimization algorithms, review architectures in a parallel and distributed setting, and investigate additional strategies for optimizing gradient descent.	cs.LG	2016-09-15		training						
20260627	AdaptiveFoundation	https://github.com/OptimalFoundation/awesome-optimizers	https://arxiv.org/abs/2007.01547	Descending through a Crowded Valley - Benchmarking Deep Learning Optimizers	Robin M. Schmidt, Frank Schneider, Philipp Hennig	Choosing the optimizer is considered to be among the most crucial design decisions in deep learning, and it is not an easy one. The growing literature now lists hundreds of optimization methods. In the absence of clear theoretical guidance and conclusive empirical evidence, the decision is often made based on anecdotes. In this work, we aim to replace these anecdotes, if not with a conclusive ranking, then at least with evidence-backed heuristics. To do so, we perform an extensive, standardized benchmark of fifteen particularly popular deep learning optimizers while giving a concise overview of the wide range of possible choices. Analyzing more than $50,000$ individual runs, we contribute the following three points: (i) Optimizer performance varies greatly across tasks. (ii) We observe that evaluating multiple optimizers with default parameters works approximately as well as tuning the hyperparameters of a single, fixed optimizer. (iii) While we cannot discern an optimization method clearly dominating across all tested tasks, we identify a significantly reduced subset of specific optimizers and parameter choices that generally lead to competitive results in our experiments: Adam remains a strong contender, with newer methods failing to significantly and consistently outperform it. Our open-sourced results are available as challenging and well-tuned baselines for more meaningful evaluations of novel optimization methods without requiring any further computational efforts.	cs.LG, stat.ML	2020-07-03		training						
20260627	AdaptiveFoundation	https://github.com/OptimalFoundation/awesome-optimizers	https://arxiv.org/abs/2107.03331	KOALA: A Kalman Optimization Algorithm with Loss Adaptivity	Aram Davtyan, Sepehr Sameni, Llukman Cerkezi, Givi Meishvilli, Adam Bielski, Paolo Favaro	Optimization is often cast as a deterministic problem, where the solution is found through some iterative procedure such as gradient descent. However, when training neural networks the loss function changes over (iteration) time due to the randomized selection of a subset of the samples. This randomization turns the optimization problem into a stochastic one. We propose to consider the loss as a noisy observation with respect to some reference optimum. This interpretation of the loss allows us to adopt Kalman filtering as an optimizer, as its recursive formulation is designed to estimate unknown parameters from noisy measurements. Moreover, we show that the Kalman Filter dynamical model for the evolution of the unknown parameters can be used to capture the gradient dynamics of advanced methods such as Momentum and Adam. We call this stochastic optimization method KOALA, which is short for Kalman Optimization Algorithm with Loss Adaptivity. KOALA is an easy to implement, scalable, and efficient method to train neural networks. We provide convergence analysis and show experimentally that it yields parameter estimates that are on par with or better than existing state of the art optimization algorithms across several neural network architectures and machine learning tasks, such as computer vision and language modeling.	cs.CV, cs.LG, math.OC, stat.ML	2021-07-07		training						
20260627	AdaptiveFoundation	https://github.com/OptimalFoundation/awesome-optimizers	https://arxiv.org/abs/1910.04952	Demon: Improved Neural Network Training with Momentum Decay	John Chen, Cameron Wolfe, Zhao Li, Anastasios Kyrillidis	Momentum is a widely used technique for gradient-based optimizers in deep learning. In this paper, we propose a decaying momentum (\textsc{Demon}) rule. We conduct the first large-scale empirical analysis of momentum decay methods for modern neural network optimization, in addition to the most popular learning rate decay schedules. Across 28 relevant combinations of models, epochs, datasets, and optimizers, \textsc{Demon} achieves the highest number of Top-1 and Top-3 finishes at 39\% and 85\% respectively, almost doubling the second-placed learning rate cosine schedule at 17\% and 60\%, respectively. \textsc{Demon} also outperforms other widely used schedulers including, but not limited to, the learning rate step schedule, linear schedule, OneCycle schedule, and exponential schedule. Compared with the widely used learning rate step schedule, \textsc{Demon} is observed to be less sensitive to parameter tuning, which is critical to training neural networks in practice. Results are demonstrated across a variety of settings and architectures, including image classification, generative models, and language models. \textsc{Demon} is easy to implement, requires no additional tuning, and incurs almost no extra computational overhead compared to the vanilla counterparts. Code is readily available.	cs.LG, eess.IV, math.OC, stat.ML	2019-10-11		training						
20260627	AdaptiveFoundation	https://github.com/OptimalFoundation/awesome-optimizers	https://arxiv.org/abs/2302.06675	Symbolic Discovery of Optimization Algorithms	Xiangning Chen, Chen Liang, Da Huang, Esteban Real, Kaiyuan Wang, Yao Liu, Hieu Pham, Xuanyi Dong, Thang Luong, Cho-Jui Hsieh, Yifeng Lu, Quoc V. Le	We present a method to formulate algorithm discovery as program search, and apply it to discover optimization algorithms for deep neural network training. We leverage efficient search techniques to explore an infinite and sparse program space. To bridge the large generalization gap between proxy and target tasks, we also introduce program selection and simplification strategies. Our method discovers a simple and effective optimization algorithm, $\textbf{Lion}$ ($\textit{Evo$\textbf{L}$ved S$\textbf{i}$gn M$\textbf{o}$me$\textbf{n}$tum}$). It is more memory-efficient than Adam as it only keeps track of the momentum. Different from adaptive optimizers, its update has the same magnitude for each parameter calculated through the sign operation. We compare Lion with widely used optimizers, such as Adam and Adafactor, for training a variety of models on different tasks. On image classification, Lion boosts the accuracy of ViT by up to 2% on ImageNet and saves up to 5x the pre-training compute on JFT. On vision-language contrastive learning, we achieve 88.3% $\textit{zero-shot}$ and 91.1% $\textit{fine-tuning}$ accuracy on ImageNet, surpassing the previous best results by 2% and 0.1%, respectively. On diffusion models, Lion outperforms Adam by achieving a better FID score and reducing the training compute by up to 2.3x. For autoregressive, masked language modeling, and fine-tuning, Lion exhibits a similar or better performance compared to Adam. Our analysis of Lion reveals that its performance gain grows with the training batch size. It also requires a smaller learning rate than Adam due to the larger norm of the update produced by the sign function. Additionally, we examine the limitations of Lion and identify scenarios where its improvements are small or not statistically significant. Lion is also successfully deployed in production systems such as Google search ads CTR model.	cs.AI, cs.CL, cs.CV, cs.LG, cs.NE	2023-02-13		training						
20260627	AdaptiveFoundation	https://github.com/OptimalFoundation/awesome-optimizers	https://arxiv.org/abs/1212.5701	ADADELTA: An Adaptive Learning Rate Method	Matthew D. Zeiler	We present a novel per-dimension learning rate method for gradient descent called ADADELTA. The method dynamically adapts over time using only first order information and has minimal computational overhead beyond vanilla stochastic gradient descent. The method requires no manual tuning of a learning rate and appears robust to noisy gradient information, different model architecture choices, various data modalities and selection of hyperparameters. We show promising results compared to other methods on the MNIST digit classification task using a single machine and on a large scale voice dataset in a distributed cluster environment.	cs.LG	2012-12-22		training						
20260627	AdaptiveFoundation	https://github.com/OptimalFoundation/awesome-optimizers	https://arxiv.org/abs/1412.6980	Adam: A Method for Stochastic Optimization	Diederik P. Kingma, Jimmy Ba	We introduce Adam, an algorithm for first-order gradient-based optimization of stochastic objective functions, based on adaptive estimates of lower-order moments. The method is straightforward to implement, is computationally efficient, has little memory requirements, is invariant to diagonal rescaling of the gradients, and is well suited for problems that are large in terms of data and/or parameters. The method is also appropriate for non-stationary objectives and problems with very noisy and/or sparse gradients. The hyper-parameters have intuitive interpretations and typically require little tuning. Some connections to related algorithms, on which Adam was inspired, are discussed. We also analyze the theoretical convergence properties of the algorithm and provide a regret bound on the convergence rate that is comparable to the best known results under the online convex optimization framework. Empirical results demonstrate that Adam works well in practice and compares favorably to other stochastic optimization methods. Finally, we discuss AdaMax, a variant of Adam based on the infinity norm.	cs.LG	2014-12-22		training						
20260627	AdaptiveFoundation	https://github.com/OptimalFoundation/awesome-optimizers	https://arxiv.org/abs/1711.05101	Decoupled Weight Decay Regularization	Ilya Loshchilov, Frank Hutter	"L$_2$ regularization and weight decay regularization are equivalent for standard stochastic gradient descent (when rescaled by the learning rate), but as we demonstrate this is \emph{not} the case for adaptive gradient algorithms, such as Adam. While common implementations of these algorithms employ L$_2$ regularization (often calling it ""weight decay"" in what may be misleading due to the inequivalence we expose), we propose a simple modification to recover the original formulation of weight decay regularization by \emph{decoupling} the weight decay from the optimization steps taken w.r.t. the loss function. We provide empirical evidence that our proposed modification (i) decouples the optimal choice of weight decay factor from the setting of the learning rate for both standard SGD and Adam and (ii) substantially improves Adam's generalization performance, allowing it to compete with SGD with momentum on image classification datasets (on which it was previously typically outperformed by the latter). Our proposed decoupled weight decay has already been adopted by many researchers, and the community has implemented it in TensorFlow and PyTorch; the complete source code for our experiments is available at https://github.com/loshchil/AdamW-and-SGDW"	cs.LG, cs.NE, math.OC	2017-11-14		training						
20260627	AdaptiveFoundation	https://github.com/OptimalFoundation/awesome-optimizers	https://arxiv.org/abs/2006.08217	AdamP: Slowing Down the Slowdown for Momentum Optimizers on Scale-invariant Weights	Byeongho Heo, Sanghyuk Chun, Seong Joon Oh, Dongyoon Han, Sangdoo Yun, Gyuwan Kim, Youngjung Uh, Jung-Woo Ha	Normalization techniques are a boon for modern deep learning. They let weights converge more quickly with often better generalization performances. It has been argued that the normalization-induced scale invariance among the weights provides an advantageous ground for gradient descent (GD) optimizers: the effective step sizes are automatically reduced over time, stabilizing the overall training procedure. It is often overlooked, however, that the additional introduction of momentum in GD optimizers results in a far more rapid reduction in effective step sizes for scale-invariant weights, a phenomenon that has not yet been studied and may have caused unwanted side effects in the current practice. This is a crucial issue because arguably the vast majority of modern deep neural networks consist of (1) momentum-based GD (e.g. SGD or Adam) and (2) scale-invariant parameters. In this paper, we verify that the widely-adopted combination of the two ingredients lead to the premature decay of effective step sizes and sub-optimal model performances. We propose a simple and effective remedy, SGDP and AdamP: get rid of the radial component, or the norm-increasing direction, at each optimizer step. Because of the scale invariance, this modification only alters the effective step sizes without changing the effective update directions, thus enjoying the original convergence properties of GD optimizers. Given the ubiquity of momentum GD and scale invariance in machine learning, we have evaluated our methods against the baselines on 13 benchmarks. They range from vision tasks like classification (e.g. ImageNet), retrieval (e.g. CUB and SOP), and detection (e.g. COCO) to language modelling (e.g. WikiText) and audio classification (e.g. DCASE) tasks. We verify that our solution brings about uniform gains in those benchmarks. Source code is available at https://github.com/clovaai/AdamP.	cs.CV, cs.LG, stat.ML	2020-06-15		training						
