date_seen	source_name	source_url	paper_url	title	authors	abstract	keywords	pub_date	place	category	viewed	read	bookmarked	labelled	impactful_researcher	impactful_institution
20260627	XieLab	https://github.com/xie-lab-ml/deep-learning-dynamics-paper-list	https://arxiv.org/abs/1710.11029	Stochastic gradient descent performs variational inference, converges to limit cycles for deep networks	Pratik Chaudhari, Stefano Soatto	"Stochastic gradient descent (SGD) is widely believed to perform implicit regularization when used to train deep neural networks, but the precise manner in which this occurs has thus far been elusive. We prove that SGD minimizes an average potential over the posterior distribution of weights along with an entropic regularization term. This potential is however not the original loss function in general. So SGD does perform variational inference, but for a different loss than the one used to compute the gradients. Even more surprisingly, SGD does not even converge in the classical sense: we show that the most likely trajectories of SGD for deep networks do not behave like Brownian motion around critical points. Instead, they resemble closed loops with deterministic components. We prove that such ""out-of-equilibrium"" behavior is a consequence of highly non-isotropic gradient noise in SGD; the covariance matrix of mini-batch gradients for deep networks has a rank as small as 1% of its dimension. We provide extensive empirical validation of these claims, proven in the appendix."	cond-mat.stat-mech, cs.LG, math.OC, stat.ML	2017-10-30		training						
20260627	XieLab	https://github.com/xie-lab-ml/deep-learning-dynamics-paper-list	https://arxiv.org/abs/1803.00195	The Anisotropic Noise in Stochastic Gradient Descent: Its Behavior of Escaping from Sharp Minima and Regularization Effects	Zhanxing Zhu, Jingfeng Wu, Bing Yu, Lei Wu, Jinwen Ma	Understanding the behavior of stochastic gradient descent (SGD) in the context of deep neural networks has raised lots of concerns recently. Along this line, we study a general form of gradient based optimization dynamics with unbiased noise, which unifies SGD and standard Langevin dynamics. Through investigating this general optimization dynamics, we analyze the behavior of SGD on escaping from minima and its regularization effects. A novel indicator is derived to characterize the efficiency of escaping from minima through measuring the alignment of noise covariance and the curvature of loss function. Based on this indicator, two conditions are established to show which type of noise structure is superior to isotropic noise in term of escaping efficiency. We further show that the anisotropic noise in SGD satisfies the two conditions, and thus helps to escape from sharp and poor minima effectively, towards more stable and flat minima that typically generalize well. We systematically design various experiments to verify the benefits of the anisotropic noise, compared with full gradient descent plus isotropic diffusion (i.e. Langevin dynamics).	cs.LG, stat.ML	2018-03-01		training						
20260627	XieLab	https://github.com/xie-lab-ml/deep-learning-dynamics-paper-list	https://arxiv.org/abs/2101.12176	On the Origin of Implicit Regularization in Stochastic Gradient Descent	Samuel L. Smith, Benoit Dherin, David G. T. Barrett, Soham De	For infinitesimal learning rates, stochastic gradient descent (SGD) follows the path of gradient flow on the full batch loss function. However moderately large learning rates can achieve higher test accuracies, and this generalization benefit is not explained by convergence bounds, since the learning rate which maximizes test accuracy is often larger than the learning rate which minimizes training loss. To interpret this phenomenon we prove that for SGD with random shuffling, the mean SGD iterate also stays close to the path of gradient flow if the learning rate is small and finite, but on a modified loss. This modified loss is composed of the original loss function and an implicit regularizer, which penalizes the norms of the minibatch gradients. Under mild assumptions, when the batch size is small the scale of the implicit regularization term is proportional to the ratio of the learning rate to the batch size. We verify empirically that explicitly including the implicit regularizer in the loss can enhance the test accuracy when the learning rate is small.	cs.LG, stat.ML	2021-01-28		training						
20260627	XieLab	https://github.com/xie-lab-ml/deep-learning-dynamics-paper-list	https://arxiv.org/abs/2102.05375	Strength of Minibatch Noise in SGD	Liu Ziyin, Kangqiao Liu, Takashi Mori, Masahito Ueda	The noise in stochastic gradient descent (SGD), caused by minibatch sampling, is poorly understood despite its practical importance in deep learning. This work presents the first systematic study of the SGD noise and fluctuations close to a local minimum. We first analyze the SGD noise in linear regression in detail and then derive a general formula for approximating SGD noise in different types of minima. For application, our results (1) provide insight into the stability of training a neural network, (2) suggest that a large learning rate can help generalization by introducing an implicit regularization, (3) explain why the linear learning rate-batchsize scaling law fails at a large learning rate or at a small batchsize and (4) can provide an understanding of how discrete-time nature of SGD affects the recently discovered power-law phenomenon of SGD.	cs.LG, stat.ML	2021-02-10		training						
20260627	XieLab	https://github.com/xie-lab-ml/deep-learning-dynamics-paper-list	https://arxiv.org/abs/2105.09557	Power-law escape rate of SGD	Takashi Mori, Liu Ziyin, Kangqiao Liu, Masahito Ueda	Stochastic gradient descent (SGD) undergoes complicated multiplicative noise for the mean-square loss. We use this property of SGD noise to derive a stochastic differential equation (SDE) with simpler additive noise by performing a random time change. Using this formalism, we show that the log loss barrier $Δ\log L=\log[L(θ^s)/L(θ^*)]$ between a local minimum $θ^*$ and a saddle $θ^s$ determines the escape rate of SGD from the local minimum, contrary to the previous results borrowing from physics that the linear loss barrier $ΔL=L(θ^s)-L(θ^*)$ decides the escape rate. Our escape-rate formula strongly depends on the typical magnitude $h^*$ and the number $n$ of the outlier eigenvalues of the Hessian. This result explains an empirical fact that SGD prefers flat minima with low effective dimensions, giving an insight into implicit biases of SGD.	cond-mat.dis-nn, cond-mat.stat-mech, cs.LG, stat.ML	2021-05-20		training						
20260627	XieLab	https://github.com/xie-lab-ml/deep-learning-dynamics-paper-list	https://arxiv.org/abs/2107.08225	On Constraints in First-Order Optimization: A View from Non-Smooth Dynamical Systems	Michael Muehlebach, Michael I. Jordan	We introduce a class of first-order methods for smooth constrained optimization that are based on an analogy to non-smooth dynamical systems. Two distinctive features of our approach are that (i) projections or optimizations over the entire feasible set are avoided, in stark contrast to projected gradient methods or the Frank-Wolfe method, and (ii) iterates are allowed to become infeasible, which differs from active set or feasible direction methods, where the descent motion stops as soon as a new constraint is encountered. The resulting algorithmic procedure is simple to implement even when constraints are nonlinear, and is suitable for large-scale constrained optimization problems in which the feasible set fails to have a simple structure. The key underlying idea is that constraints are expressed in terms of velocities instead of positions, which has the algorithmic consequence that optimizations over feasible sets at each iteration are replaced with optimizations over local, sparse convex approximations. In particular, this means that at each iteration only constraints that are violated are taken into account. The result is a simplified suite of algorithms and an expanded range of possible applications in machine learning.	cs.LG, eess.SY, math.OC	2021-07-17	Journal of Machine Learning Research, 23(256):1-47, 2022	training						
20260627	XieLab	https://github.com/xie-lab-ml/deep-learning-dynamics-paper-list	https://arxiv.org/abs/2206.04030	High-dimensional limit theorems for SGD: Effective dynamics and critical scaling	Gerard Ben Arous, Reza Gheissari, Aukosh Jagannath	We study the scaling limits of stochastic gradient descent (SGD) with constant step-size in the high-dimensional regime. We prove limit theorems for the trajectories of summary statistics (i.e., finite-dimensional functions) of SGD as the dimension goes to infinity. Our approach allows one to choose the summary statistics that are tracked, the initialization, and the step-size. It yields both ballistic (ODE) and diffusive (SDE) limits, with the limit depending dramatically on the former choices. We show a critical scaling regime for the step-size, below which the effective ballistic dynamics matches gradient flow for the population loss, but at which, a new correction term appears which changes the phase diagram. About the fixed points of this effective dynamics, the corresponding diffusive limits can be quite complex and even degenerate. We demonstrate our approach on popular examples including estimation for spiked matrix and tensor models and classification via two-layer networks for binary and XOR-type Gaussian mixture models. These examples exhibit surprising phenomena including multimodal timescales to convergence as well as convergence to sub-optimal solutions with probability bounded away from zero from random (e.g., Gaussian) initializations. At the same time, we demonstrate the benefit of overparametrization by showing that the latter probability goes to zero as the second layer width grows.	cs.LG, math.PR, math.ST, stat.ML	2022-06-08		training						
20260627	XieLab	https://github.com/xie-lab-ml/deep-learning-dynamics-paper-list	https://arxiv.org/abs/2002.12493	Optimization with Momentum: Dynamical, Control-Theoretic, and Symplectic Perspectives	Michael Muehlebach, Michael I. Jordan	We analyze the convergence rate of various momentum-based optimization algorithms from a dynamical systems point of view. Our analysis exploits fundamental topological properties, such as the continuous dependence of iterates on their initial conditions, to provide a simple characterization of convergence rates. In many cases, closed-form expressions are obtained that relate algorithm parameters to the convergence rate. The analysis encompasses discrete time and continuous time, as well as time-invariant and time-variant formulations, and is not limited to a convex or Euclidean setting. In addition, the article rigorously establishes why symplectic discretization schemes are important for momentum-based optimization algorithms, and provides a characterization of algorithms that exhibit accelerated convergence.	math.NA, math.OC, stat.ML	2020-02-28		training						
20260627	XieLab	https://github.com/xie-lab-ml/deep-learning-dynamics-paper-list	https://arxiv.org/abs/2103.03265	Better SGD using Second-order Momentum	Hoang Tran, Ashok Cutkosky	"We develop a new algorithm for non-convex stochastic optimization that finds an $ε$-critical point in the optimal $O(ε^{-3})$ stochastic gradient and Hessian-vector product computations. Our algorithm uses Hessian-vector products to ""correct"" a bias term in the momentum of SGD with momentum. This leads to better gradient estimates in a manner analogous to variance reduction methods. In contrast to prior work, we do not require excessively large batch sizes, and are able to provide an adaptive algorithm whose convergence rate automatically improves with decreasing variance in the gradient estimates. We validate our results on a variety of large-scale deep learning architectures and benchmarks tasks."	cs.LG, stat.ML	2021-03-04		training						
20260627	XieLab	https://github.com/xie-lab-ml/deep-learning-dynamics-paper-list	https://arxiv.org/abs/2006.15815	Adaptive Inertia: Disentangling the Effects of Adaptive Learning Rate and Momentum	Zeke Xie, Xinrui Wang, Huishuai Zhang, Issei Sato, Masashi Sugiyama	Adaptive Moment Estimation (Adam), which combines Adaptive Learning Rate and Momentum, would be the most popular stochastic optimizer for accelerating the training of deep neural networks. However, it is empirically known that Adam often generalizes worse than Stochastic Gradient Descent (SGD). The purpose of this paper is to unveil the mystery of this behavior in the diffusion theoretical framework. Specifically, we disentangle the effects of Adaptive Learning Rate and Momentum of the Adam dynamics on saddle-point escaping and flat minima selection. We prove that Adaptive Learning Rate can escape saddle points efficiently, but cannot select flat minima as SGD does. In contrast, Momentum provides a drift effect to help the training process pass through saddle points, and almost does not affect flat minima selection. This partly explains why SGD (with Momentum) generalizes better, while Adam generalizes worse but converges faster. Furthermore, motivated by the analysis, we design a novel adaptive optimization framework named Adaptive Inertia, which uses parameter-wise adaptive inertia to accelerate the training and provably favors flat minima as well as SGD. Our extensive experiments demonstrate that the proposed adaptive inertia method can generalize significantly better than SGD and conventional adaptive gradient methods.	cs.LG, stat.ML	2020-06-29		training						
20260627	XieLab	https://github.com/xie-lab-ml/deep-learning-dynamics-paper-list	https://arxiv.org/abs/1706.05350	L2 Regularization versus Batch and Weight Normalization	Twan van Laarhoven	Batch Normalization is a commonly used trick to improve the training of deep neural networks. These neural networks use L2 regularization, also called weight decay, ostensibly to prevent overfitting. However, we show that L2 regularization has no regularizing effect when combined with normalization. Instead, regularization has an influence on the scale of weights, and thereby on the effective learning rate. We investigate this dependence, both in theory, and experimentally. We show that popular optimization methods such as ADAM only partially eliminate the influence of normalization on the learning rate. This leads to a discussion on other ways to mitigate this issue.	cs.LG, stat.ML	2017-06-16		training						
20260627	XieLab	https://github.com/xie-lab-ml/deep-learning-dynamics-paper-list	https://arxiv.org/abs/1810.12281	Three Mechanisms of Weight Decay Regularization	Guodong Zhang, Chaoqi Wang, Bowen Xu, Roger Grosse	Weight decay is one of the standard tricks in the neural network toolbox, but the reasons for its regularization effect are poorly understood, and recent results have cast doubt on the traditional interpretation in terms of $L_2$ regularization. Literal weight decay has been shown to outperform $L_2$ regularization for optimizers for which they differ. We empirically investigate weight decay for three optimization algorithms (SGD, Adam, and K-FAC) and a variety of network architectures. We identify three distinct mechanisms by which weight decay exerts a regularization effect, depending on the particular optimization algorithm and architecture: (1) increasing the effective learning rate, (2) approximately regularizing the input-output Jacobian norm, and (3) reducing the effective damping coefficient for second-order optimization. Our results provide insight into how to improve the regularization of neural networks.	cs.LG, stat.ML	2018-10-29		training						
20260627	XieLab	https://github.com/xie-lab-ml/deep-learning-dynamics-paper-list	https://arxiv.org/abs/1812.03981	Theoretical Analysis of Auto Rate-Tuning by Batch Normalization	Sanjeev Arora, Zhiyuan Li, Kaifeng Lyu	Batch Normalization (BN) has become a cornerstone of deep learning across diverse architectures, appearing to help optimization as well as generalization. While the idea makes intuitive sense, theoretical analysis of its effectiveness has been lacking. Here theoretical support is provided for one of its conjectured properties, namely, the ability to allow gradient descent to succeed with less tuning of learning rates. It is shown that even if we fix the learning rate of scale-invariant parameters (e.g., weights of each layer with BN) to a constant (say, $0.3$), gradient descent still approaches a stationary point (i.e., a solution where gradient is zero) in the rate of $T^{-1/2}$ in $T$ iterations, asymptotically matching the best bound for gradient descent with well-tuned learning rates. A similar result with convergence rate $T^{-1/4}$ is also shown for stochastic gradient descent.	cs.LG, stat.ML	2018-12-10		training						
20260627	XieLab	https://github.com/xie-lab-ml/deep-learning-dynamics-paper-list	https://arxiv.org/abs/1905.11881	Why gradient clipping accelerates training: A theoretical justification for adaptivity	Jingzhao Zhang, Tianxing He, Suvrit Sra, Ali Jadbabaie	We provide a theoretical explanation for the effectiveness of gradient clipping in training deep neural networks. The key ingredient is a new smoothness condition derived from practical neural network training examples. We observe that gradient smoothness, a concept central to the analysis of first-order optimization algorithms that is often assumed to be a constant, demonstrates significant variability along the training trajectory of deep neural networks. Further, this smoothness positively correlates with the gradient norm, and contrary to standard assumptions in the literature, it can grow with the norm of the gradient. These empirical observations limit the applicability of existing theoretical analyses of algorithms that rely on a fixed bound on smoothness. These observations motivate us to introduce a novel relaxation of gradient smoothness that is weaker than the commonly used Lipschitz smoothness assumption. Under the new condition, we prove that two popular methods, namely, \emph{gradient clipping} and \emph{normalized gradient}, converge arbitrarily faster than gradient descent with fixed stepsize. We further explain why such adaptively scaled gradient methods can accelerate empirical convergence and verify our results empirically in popular neural network training settings.	cs.LG, math.OC	2019-05-28		training						
20260627	XieLab	https://github.com/xie-lab-ml/deep-learning-dynamics-paper-list	https://arxiv.org/abs/2002.10801	Layer-wise Conditioning Analysis in Exploring the Learning Dynamics of DNNs	Lei Huang, Jie Qin, Li Liu, Fan Zhu, Ling Shao	Conditioning analysis uncovers the landscape of an optimization objective by exploring the spectrum of its curvature matrix. This has been well explored theoretically for linear models. We extend this analysis to deep neural networks (DNNs) in order to investigate their learning dynamics. To this end, we propose layer-wise conditioning analysis, which explores the optimization landscape with respect to each layer independently. Such an analysis is theoretically supported under mild assumptions that approximately hold in practice. Based on our analysis, we show that batch normalization (BN) can stabilize the training, but sometimes result in the false impression of a local minimum, which has detrimental effects on the learning. Besides, we experimentally observe that BN can improve the layer-wise conditioning of the optimization problem. Finally, we find that the last linear layer of a very deep residual network displays ill-conditioned behavior. We solve this problem by only adding one BN layer before the last linear layer, which achieves improved performance over the original and pre-activation residual networks.	cs.CV, cs.LG	2020-02-25		training						
20260627	XieLab	https://github.com/xie-lab-ml/deep-learning-dynamics-paper-list	https://openreview.net/forum?id=BJij4yg0Z	A Bayesian Perspective on Generalization and Stochastic Gradient Descent	Samuel L. Smith and Quoc V. Le	"We consider two questions at the heart of machine learning; how can we predict if a minimum will generalize to the test set, and why does stochastic gradient descent find minima that generalize well? Our work responds to \citet{zhang2016understanding}, who showed deep neural networks can easily memorize randomly labeled training data, despite generalizing well on real labels of the same inputs. We show that the same phenomenon occurs in small linear models. These observations are explained by the Bayesian evidence, which penalizes sharp minima but is invariant to model parameterization. We also demonstrate that, when one holds the learning rate fixed, there is an optimum batch size which maximizes the test set accuracy. We propose that the noise introduced by small mini-batches drives the parameters towards minima whose evidence is large. Interpreting stochastic gradient descent as a stochastic differential equation, we identify the ``noise scale"" $g = \epsilon (\frac{N}{B} - 1) \approx \epsilon N/B$, where $\epsilon$ is the learning rate, $N$ the training set size and $B$ the batch size. Consequently the optimum batch size is proportional to both the learning rate and the size of the training set, $B_{opt} \propto \epsilon N$. We verify these predictions empirically."	generalization, stochastic gradient descent, stochastic differential equations, scaling rules, large batch training, bayes theorem, batch size	2018-02-15	ICLR 2018	training						
20260627	XieLab	https://github.com/xie-lab-ml/deep-learning-dynamics-paper-list	https://openreview.net/forum?id=wXgk_iCiYGo	A Diffusion Theory For Deep Learning Dynamics: Stochastic Gradient Descent Exponentially Favors Flat Minima	Zeke Xie, Issei Sato, Masashi Sugiyama	Stochastic Gradient Descent (SGD) and its variants are mainstream methods for training deep networks in practice. SGD is known to find a flat minimum that often generalizes well. However, it is mathematically unclear how deep learning can select a flat minimum among so many minima. To answer the question quantitatively, we develop a density diffusion theory to reveal how minima selection quantitatively depends on the minima sharpness and the hyperparameters. To the best of our knowledge, we are the first to theoretically and empirically prove that, benefited from the Hessian-dependent covariance of stochastic gradient noise, SGD favors flat minima exponentially more than sharp minima, while Gradient Descent (GD) with injected white noise favors flat minima only polynomially more than sharp minima. We also reveal that either a small learning rate or large-batch training requires exponentially many iterations to escape from minima in terms of the ratio of the batch size and learning rate. Thus, large-batch training cannot search flat minima efficiently in a realistic computational time.	deep learning dynamics, SGD, diffusion, flat minima, stochastic optimization	2020-09-28	ICLR 2021	training						
20260627	XieLab	https://github.com/xie-lab-ml/deep-learning-dynamics-paper-list	https://openreview.net/forum?id=9XhPLAjjRB	SGD Can Converge to Local Maxima	Liu Ziyin, Botao Li, James B Simon, Masahito Ueda	Previous works on stochastic gradient descent (SGD) often focus on its success. In this work, we construct worst-case optimization problems illustrating that, when not in the regimes that the previous works often assume, SGD can exhibit many strange and potentially undesirable behaviors. Specifically, we construct landscapes and data distributions such that (1) SGD converges to local maxima, (2) SGD escapes saddle points arbitrarily slowly, (3) SGD prefers sharp minima over flat ones, and (4) AMSGrad converges to local maxima. We also realize results in a minimal neural network-like example. Our results highlight the importance of simultaneously analyzing the minibatch sampling, discrete-time updates rules, and realistic landscapes to understand the role of SGD in deep learning.	stochastic gradient descent, saddle points, convergence, amsgrad, deep learning	2021-09-29	ICLR 2022	training						
