date_seen	source_name	source_url	paper_url	title	authors	abstract	keywords	pub_date	place	category	viewed	read	bookmarked	labelled	impactful_researcher	impactful_institution
20260627	XieLab	https://github.com/xie-lab-ml/deep-learning-dynamics-paper-list	https://openreview.net/forum?id=siCt4xZn5Ve	What Happens after SGD Reaches Zero Loss? --A Mathematical Framework	Zhiyuan Li, Tianhao Wang, Sanjeev Arora	"Understanding the implicit bias of Stochastic Gradient Descent (SGD) is one of the key challenges in deep learning, especially for overparametrized models, where the local minimizers of the loss function $L$ can form a manifold. Intuitively, with a sufficiently small learning rate $\eta$, SGD tracks Gradient Descent (GD) until it gets close to such manifold, where the gradient noise prevents further convergence. In such regime, Blanc et al. (2020) proved that SGD with label noise locally decreases a regularizer-like term, the sharpness of loss, $\text{tr}[\nabla^2 L]$. The current paper gives a general framework for such analysis by adapting ideas from Katzenberger (1991). It allows in principle a complete characterization for the regularization effect of SGD around such manifold---i.e., the ""implicit bias""---using a stochastic differential equation (SDE) describing the limiting dynamics of the parameters, which is determined jointly by the loss function and the noise covariance. This yields some new results: (1) a *global* analysis of the implicit bias valid for $\eta^{-2}$ steps, in contrast to the local analysis of Blanc et al. (2020) that is only valid for $\eta^{-1.6}$ steps and (2) allowing *arbitrary* noise covariance. As an application, we show with arbitrary large initialization, label noise SGD can always escape the kernel regime and only requires $O(\kappa\ln d)$ samples for learning an $\kappa$-sparse overparametrized linear model in $\mathbb{R}^d$ (Woodworth et al., 2020), while GD initialized in the kernel regime requires $\Omega(d)$ samples. This upper bound is minimax optimal and improves the previous $\widetilde{O}(\kappa^2)$ upper bound (HaoChen et al., 2020)."	SGD, implicit bias, generalization, deep learning, implicit regularization, manifold	2021-09-29	ICLR 2022	training						
20260627	XieLab	https://github.com/xie-lab-ml/deep-learning-dynamics-paper-list	https://openreview.net/forum?id=B3Nde6lvab	Eliminating Sharp Minima from SGD with Truncated Heavy-tailed Noise	Xingyu Wang, Sewoong Oh, Chang-Han Rhee	The empirical success of deep learning is often attributed to SGD’s mysterious ability to avoid sharp local minima in the loss landscape, as sharp minima are  known to lead to poor generalization. Recently, empirical evidence of heavy-tailed gradient noise was reported in many deep learning tasks; and it was shown in (Simsekli et al., 2019a;b) that SGD can escape sharp local minima under the presence of such heavy-tailed gradient noise, providing a partial solution to the mystery. In this work, we analyze a popular variant of SGD where gradients are truncated above a fixed threshold. We show that it achieves a stronger notion of avoiding sharp minima: it can effectively eliminate sharp local minima entirely from its training trajectory. We characterize the dynamics of truncated SGD driven by heavy-tailed noises. First, we show that the truncation threshold and width of the attraction field dictate the order of the first exit time from the associated local minimum. Moreover, when the objective function satisfies appropriate structural conditions, we prove that as the learning rate decreases, the dynamics of the heavy-tailed truncated SGD closely resemble those of a continuous-time Markov chain that never visits any sharp minima. Real data experiments on deep learning confirm our theoretical prediction that heavy-tailed SGD with gradient clipping finds a flatter local minima and achieves better generalization.	Stochastic Gradient Descent, SGD, Heavy-Tails, Generalization	2021-09-29	ICLR 2022	training						
20260627	XieLab	https://github.com/xie-lab-ml/deep-learning-dynamics-paper-list	https://openreview.net/forum?id=3tbDrs77LJ5	Large Learning Rate Tames Homogeneity: Convergence and Balancing Effect	Yuqing Wang, Minshuo Chen, Tuo Zhao, Molei Tao	Recent empirical advances show that training deep models with large learning rate often improves generalization performance. However, theoretical justifications on the benefits of large learning rate are highly limited, due to challenges in analysis. In this paper, we consider using Gradient Descent (GD) with a large learning rate on a homogeneous matrix factorization problem, i.e., $\min_{X, Y} \|A - XY^\top\|_{\sf F}^2$. We prove a convergence theory for constant large learning rates well beyond $2/L$, where $L$ is the largest eigenvalue of Hessian at the initialization. Moreover, we rigorously establish an implicit bias of GD induced by such a large learning rate, termed `balancing', meaning that magnitudes of $X$ and $Y$ at the limit of GD iterations will be close even if their initialization is significantly unbalanced. Numerical experiments are provided to support our theory.	large learning rate, gradient descent, matrix factorization, implicit regularization, convergence, balancing, alignment	2021-09-29	ICLR 2022	training						
20260627	XieLab	https://github.com/xie-lab-ml/deep-learning-dynamics-paper-list	https://openreview.net/forum?id=ffy-h0GKZbK	Chaotic Dynamics are Intrinsic to Neural Network Training with SGD	Luis Herrmann, Maximilian Granz, Tim Landgraf	With the advent of deep learning over the last decade, a considerable amount of effort has gone into better understanding and enhancing Stochastic Gradient Descent so as to improve the performance and stability of artificial neural network training. Active research fields in this area include exploiting second order information of the loss landscape and improving the understanding of chaotic dynamics in optimization. This paper exploits the theoretical connection between the curvature of the loss landscape and chaotic dynamics in neural network training to propose a modified SGD ensuring non-chaotic training dynamics to study the importance thereof in NN training. Building on this, we present empirical evidence suggesting that the negative eigenspectrum - and thus directions of local chaos - cannot be removed from SGD without hurting training performance. Extending our empirical analysis to long-term chaos dynamics, we challenge the widespread understanding of convergence against a confined region in parameter space. Our results show that although chaotic network behavior is mostly confined to the initial training phase, models perturbed upon initialization do diverge at a slow pace even after reaching top training performance, and that their divergence can be modelled through a composition of a random walk and a linear divergence. The tools and insights developed as part of our work contribute to improving the understanding of neural network training dynamics and provide a basis for future improvements of optimization methods.	Optimization, Deep Learning, Chaos, Neural Networks, Curvature, Seconder Order Optimization, SGD, Hessian	2022-05-16	NeurIPS 2022	training						
20260627	XieLab	https://github.com/xie-lab-ml/deep-learning-dynamics-paper-list	https://openreview.net/forum?id=lUyAaz-iA4u	Dynamics of SGD with Stochastic Polyak Stepsizes: Truly Adaptive Variants and Convergence to Exact Solution	Antonio Orvieto, Simon Lacoste-Julien, Nicolas Loizou	Recently Loizou et al. (2021), proposed and analyzed stochastic gradient descent (SGD) with stochastic Polyak stepsize (SPS). The proposed SPS comes with strong convergence guarantees and competitive performance; however, it has two main drawbacks when it is used in non-over-parameterized regimes: (i) It requires a priori knowledge of the optimal mini-batch losses, which are not available when the interpolation condition is not satisfied (e.g., regularized objectives), and (ii) it guarantees convergence only to a neighborhood of the solution. In this work, we study the dynamics and the convergence properties of SGD equipped with new variants of the stochastic Polyak stepsize and provide solutions to both drawbacks of the original SPS. We first show that a simple modification of the original SPS that uses lower bounds instead of the optimal function values can directly solve issue (i). On the other hand, solving issue (ii) turns out to be more challenging and leads us to valuable insights into the method's behavior. We show that if interpolation is not satisfied, the correlation between SPS and stochastic gradients introduces a bias, which effectively distorts the expectation of the gradient signal near minimizers, leading to non-convergence - even if the stepsize is scaled down during training. To fix this issue, we propose DecSPS, a novel modification of SPS, which guarantees convergence to the exact minimizer - without a priori knowledge of the problem parameters. For strongly-convex optimization problems, DecSPS is the first stochastic adaptive optimization method that converges to the exact solution without restrictive assumptions like bounded iterates/gradients.	Optimization, Convex Optimization, SGD, Gradient Descent, Adaptive Methods, Polyak Stepsize	2022-05-16	NeurIPS 2022	training						
20260627	XieLab	https://github.com/xie-lab-ml/deep-learning-dynamics-paper-list	https://openreview.net/forum?id=qq84D17BPu	Toward Equation of Motion for Deep Neural Networks: Continuous-time Gradient Descent and Discretization Error Analysis	Taiki Miyagawa	We derive and solve an ``Equation of Motion'' (EoM) for deep neural networks (DNNs), a differential equation that precisely describes the discrete learning dynamics of DNNs. Differential equations are continuous but have played a prominent role even in the study of discrete optimization (gradient descent (GD) algorithms). However, there still exist gaps between differential equations and the actual learning dynamics of DNNs due to discretization error. In this paper, we start from gradient flow (GF) and derive a counter term that cancels the discretization error between GF and GD. As a result, we obtain EoM, a continuous differential equation that precisely describes the discrete learning dynamics of GD. We also derive discretization error to show to what extent EoM is precise. In addition, we apply EoM to two specific cases: scale- and translation-invariant layers. EoM highlights differences between continuous and discrete GD, indicating the importance of the counter term for a better description of the discrete learning dynamics of GD. Our experimental results support our theoretical findings.	Discretization error, Gradient flow, Gradient descent, Equation of motion	2022-05-16	NeurIPS 2022	training						
20260627	XieLab	https://github.com/xie-lab-ml/deep-learning-dynamics-paper-list	https://openreview.net/forum?id=L74c-iUxQ1I	Gradient flow dynamics of shallow ReLU networks for square loss and orthogonal inputs	Etienne Boursier, Loucas Pillaud-Vivien, Nicolas Flammarion	The training of neural networks by gradient descent methods is a cornerstone of the deep learning revolution. Yet, despite some recent progress, a complete theory explaining its success is still missing. This article presents, for orthogonal input vectors, a precise description of the gradient flow dynamics of training one-hidden layer ReLU neural networks for the mean squared error at small initialisation. In this setting, despite non-convexity, we show that the gradient flow converges to zero loss and characterise its implicit bias towards minimum variation norm. Furthermore, some interesting phenomena are highlighted: a quantitative description of the initial alignment phenomenon and a proof that the process follows a specific saddle to saddle dynamics.	implicit bias, two-layer neural networks, gradient flow, gradient descent, global convergence, ReLU networks, variation norm, non-convex optimisation	2022-05-16	NeurIPS 2022	training						
20260627	XieLab	https://github.com/xie-lab-ml/deep-learning-dynamics-paper-list	https://openreview.net/forum?id=DnTuz0ziwN	SGD with Large Step Sizes Learns Sparse Features	Maksym Andriushchenko, Aditya Vardhan Varre, Loucas Pillaud-Vivien, Nicolas Flammarion	We showcase important features of the dynamics of the Stochastic Gradient Descent (SGD) in the training of neural networks. We present empirical observations that commonly used large step sizes (i) may lead the iterates to jump from one side of a valley to the other causing *loss stabilization*, and (ii) this stabilization induces a hidden stochastic dynamics that *biases it implicitly* toward simple predictors. Furthermore, we show empirically that the longer large step sizes keep SGD high in the loss landscape valleys, the better the implicit regularization can operate and find sparse representations. Notably, no explicit regularization is used: the regularization effect comes solely from the SGD dynamics influenced by the large step sizes schedule. Therefore, these observations unveil how, through the step size schedules, both gradient and noise drive together the SGD dynamics through the loss landscape of neural networks. We justify these findings theoretically through the study of simple neural network models as well as qualitative arguments inspired from stochastic processes. This analysis allows us to shed new light on some common practices and observed phenomena when training deep networks.		2023-01-26	ICML 2023	training						
20260627	XieLab	https://github.com/xie-lab-ml/deep-learning-dynamics-paper-list	https://openreview.net/forum?id=Al9yglQGKj	Phase diagram of early training dynamics in deep neural networks: effect of the learning rate, depth, and width	Dayal Singh Kalra, Maissam Barkeshli	"We systematically analyze optimization dynamics in deep neural networks (DNNs) trained with stochastic gradient descent (SGD) and study the effect of learning rate $\eta$, depth $d$, and width $w$ of the neural network. By analyzing the maximum eigenvalue $\lambda^H_t$ of the Hessian of the loss, which is a measure of sharpness of the loss landscape, we find that the dynamics can show four distinct regimes: (i) an early time transient regime, (ii) an intermediate saturation regime, (iii) a progressive sharpening regime, and (iv) a late time ""edge of stability"" regime. The early and intermediate regimes (i) and (ii) exhibit a rich phase diagram depending on $\eta \equiv c / \lambda_0^H $, $d$, and $w$. We identify several critical values of $c$, which separate qualitatively distinct phenomena in the early time dynamics of training loss and sharpness. Notably, we discover the opening up of a ""sharpness reduction"" phase, where sharpness decreases at early times, as $d$ and $ 1/w$ are increased."	Optimization dynamics, Phase diagrams, learning rate transition, Catapult effect	2023-05-11	NeurIPS 2023	training						
20260627	XieLab	https://github.com/xie-lab-ml/deep-learning-dynamics-paper-list	https://openreview.net/forum?id=z9poo2GhOh6	Trajectory of Mini-Batch Momentum: Batch Size Saturation and Convergence in High Dimensions	Kiwon Lee, Andrew Nicholas Cheng, Elliot Paquette, Courtney Paquette	We analyze the dynamics of large batch stochastic gradient descent with momentum (SGD+M) on the least squares problem when both the number of samples and dimensions are large. In this setting, we show that the dynamics of SGD+M converge to a deterministic discrete Volterra equation as dimension increases, which we analyze.  We identify a stability measurement, the implicit conditioning ratio (ICR), which regulates the ability of SGD+M to accelerate the algorithm.  When the batch size exceeds this ICR, SGD+M converges linearly at a rate of $\mathcal{O}(1/\sqrt{\kappa})$, matching optimal full-batch momentum (in particular performing as well as a full-batch but with a fraction of the size).  For batch sizes smaller than the ICR, in contrast, SGD+M has rates that scale like a multiple of the single batch SGD rate. We give explicit choices for the learning rate and momentum parameter in terms of the Hessian spectra that achieve this performance.	Stochastic Gradient Descent with Momentum, Random Matrix Theory, High Dimensional Probability	2022-05-16	NeurIPS 2022	training						
20260627	XieLab	https://github.com/xie-lab-ml/deep-learning-dynamics-paper-list	https://openreview.net/forum?id=a65YK0cqH8g	Noise Is Not the Main Factor Behind the Gap Between Sgd and Adam on Transformers, But Sign Descent Might Be	Frederik Kunstner, Jacques Chen, Jonathan Wilder Lavington, Mark Schmidt	The success of the Adam optimizer on a wide array of architectures has made it the default in settings where stochastic gradient descent (SGD) performs poorly. However, our theoretical understanding of this discrepancy is lagging, preventing the development of significant improvements on either algorithm. Recent work advances the hypothesis that Adam and other heuristics like gradient clipping outperform SGD on language tasks because the distribution of the error induced by sampling has heavy tails. This suggests that Adam outperform SGD because it uses a more robust gradient estimate. We evaluate this hypothesis by varying the batch size, up to the entire dataset, to control for stochasticity. We present evidence that stochasticity and heavy-tailed noise  are not major factors in the performance gap between SGD and Adam. Rather, Adam performs better as the batch size increases,  while SGD is less effective at taking advantage of the reduction in noise. This raises the question as to why Adam outperforms SGD in the full-batch setting. Through further investigation of simpler variants of SGD, we find that  the behavior of Adam with large batches is similar to sign descent with momentum.	optimization for deep learning, adaptive methods, adam, rmsprop, sgd, sign descent, noise, stochasticity, full batch	2022-09-22	ICLR 2023	training						
20260627	XieLab	https://github.com/xie-lab-ml/deep-learning-dynamics-paper-list	https://openreview.net/forum?id=gIG8LvTLuc	How Does Adaptive Optimization Impact Local Neural Network Geometry?	Kaiqi Jiang, Dhruv Malik, Yuanzhi Li	Adaptive optimization methods are well known to achieve superior convergence relative to vanilla gradient methods. The traditional viewpoint in optimization, particularly in convex optimization, explains this improved performance by arguing that, unlike vanilla gradient schemes, adaptive algorithms mimic the behavior of a second-order method by adapting to the *global* geometry of the loss function. We argue that in the context of neural network optimization, this traditional viewpoint is insufficient. Instead, we advocate for a *local* trajectory analysis. For iterate trajectories produced by running a generic optimization algorithm OPT, we introduce $R^{\text{OPT}}\_{\text{med}}$, a statistic that is analogous to the condition number of the loss Hessian evaluated at the iterates. Through extensive experiments on language models where adaptive algorithms converge faster than vanilla gradient methods like SGD, we show that adaptive methods such as Adam bias the trajectories towards regions where $R^{\text{Adam}}_{\text{med}}$ is small, where one might expect faster optimization. By contrast, SGD (with momentum) biases the trajectories towards regions where $R^{\text{SGD}}\_{\text{med}}$ is comparatively large. We complement these empirical observations with a theoretical result that provably demonstrates this phenomenon in the simplified setting of a two-layer linear network. We view our findings as evidence for the need of a new explanation of the success of adaptive methods, one that is different than the conventional wisdom.	optimization, adaptive algorithms, neural networks	2023-05-10	NeurIPS 2023	training						
20260627	XieLab	https://github.com/xie-lab-ml/deep-learning-dynamics-paper-list	https://openreview.net/forum?id=sof8l4cki9	Fast Mixing of Stochastic Gradient Descent with Normalization and Weight Decay	Zhiyuan Li, Tianhao Wang, Dingli Yu	We prove the Fast Equilibrium Conjecture proposed by Li et al., (2020), i.e., stochastic gradient descent (SGD) on a scale-invariant loss (e.g., using networks with various normalization schemes) with learning rate $\eta$ and weight decay factor $\lambda$ mixes in function space in $\mathcal{\tilde{O}}(\frac{1}{\lambda\eta})$ steps,  under two standard assumptions: (1) the noise covariance matrix is non-degenerate and (2) the minimizers of the loss form a connected, compact and analytic manifold. The analysis uses the framework of Li et al., (2021) and shows that for every $T>0$, the iterates of SGD with learning rate $\eta$ and weight decay factor $\lambda$ on the scale-invariant loss converge in distribution in $\Theta\left(\eta^{-1}\lambda^{-1}(T+\ln(\lambda/\eta))\right)$  iterations as $\eta\lambda\to 0$ while satisfying $\eta \le O(\lambda)\le O(1)$.  Moreover, the evolution of the limiting distribution can be described by a stochastic differential equation that mixes to the same equilibrium distribution for every initialization around the manifold of minimizers as $T\to\infty$.	stochastic gradient descent, weight decay, stochastic differential equation, equilibrium, mixing	2022-05-16	NeurIPS 2022	training						
20260627	XieLab	https://github.com/xie-lab-ml/deep-learning-dynamics-paper-list	https://openreview.net/forum?id=aJ5xc1QB7EX	Deep Active Learning by Leveraging Training Dynamics	Haonan Wang, Wei Huang, Ziwei Wu, Hanghang Tong, Andrew J Margenot, Jingrui He	Active learning theories and methods have been extensively studied in classical statistical learning settings. However, deep active learning, i.e., active learning with deep learning models, is usually based on empirical criteria without solid theoretical justification, thus suffering from heavy doubts when some of those fail to provide benefits in applications. In this paper, by exploring the connection between the generalization performance and the training dynamics, we propose a theory-driven deep active learning method (dynamicAL) which selects samples to maximize training dynamics. In particular, we prove that the convergence speed of training and the generalization performance is positively correlated under the ultra-wide condition and show that maximizing the training dynamics leads to a better generalization performance. Furthermore, to scale up to large deep neural networks and data sets, we introduce two relaxations for the subset selection problem and reduce the time complexity from polynomial to constant. Empirical results show that dynamicAL not only outperforms the other baselines consistently but also scales well on large deep learning models. We hope our work inspires more attempts in bridging the theoretical findings of deep networks and practical impacts in deep active learning applications.	Deep Active Learning, NTK	2022-05-16	NeurIPS 2022	training						
20260627	XieLab	https://github.com/xie-lab-ml/deep-learning-dynamics-paper-list	https://openreview.net/forum?id=4B7azgAbzda	Learning dynamics of deep linear networks with multiple pathways	Jianghong Shi, Eric Todd SheaBrown, Michael A Buice	Not only have deep networks become standard in machine learning, they are increasingly of interest in neuroscience as models of cortical computation that capture relationships between structural and functional properties.  In addition they are a useful target of theoretical research into the properties of network computation.  Deep networks typically have a serial or approximately serial organization across layers, and this is often mirrored in models that purport to represent computation in mammalian brains.  There are, however, multiple examples of parallel pathways in mammalian brains.  In some cases, such as the mouse, the entire visual system appears arranged in a largely parallel, rather than serial fashion.  While these pathways may be formed by differing cost functions that drive different computations, here we present a new mathematical analysis of learning dynamics in networks that have parallel computational pathways driven by the same cost function.  We use the approximation of deep linear networks with large hidden layer sizes to show that, as the depth of the parallel pathways increases, different features of the training set (defined by the singular values of the input-output correlation) will typically concentrate in one of the pathways.  This result is derived analytically and demonstrated with numerical simulation.  Thus, rather than sharing stimulus and task features across multiple pathways, parallel network architectures learn to produce sharply diversified representations with specialized and specific pathways, a mechanism which may hold important consequences for codes in both biological and artificial systems.	deep networks, linear networks, dynamical systems, theory, parallel pathways	2022-05-16	NeurIPS 2022	training						
