date_seen	source_name	source_url	paper_url	title	authors	abstract	keywords	pub_date	place	category	viewed	read	bookmarked	labelled	impactful_researcher	impactful_institution
20260627	FSL	https://github.com/Stonesusu/FewShotPapers	https://arxiv.org/abs/1903.03096	Meta-Dataset: A Dataset of Datasets for Learning to Learn from Few Examples	Eleni Triantafillou, Tyler Zhu, Vincent Dumoulin, Pascal Lamblin, Utku Evci, Kelvin Xu, Ross Goroshin, Carles Gelada, Kevin Swersky, Pierre-Antoine Manzagol, Hugo Larochelle	Few-shot classification refers to learning a classifier for new classes given only a few examples. While a plethora of models have emerged to tackle it, we find the procedure and datasets that are used to assess their progress lacking. To address this limitation, we propose Meta-Dataset: a new benchmark for training and evaluating models that is large-scale, consists of diverse datasets, and presents more realistic tasks. We experiment with popular baselines and meta-learners on Meta-Dataset, along with a competitive method that we propose. We analyze performance as a function of various characteristics of test tasks and examine the models' ability to leverage diverse training sources for improving their generalization. We also propose a new set of baselines for quantifying the benefit of meta-learning in Meta-Dataset. Our extensive experimentation has uncovered important research challenges and we hope to inspire work in these directions.	cs.LG, stat.ML	2019-03-07	International Conference on Learning Representations (2020)	training						
20260627	FSL	https://github.com/Stonesusu/FewShotPapers	https://openreview.net/forum?id=r1n5Osurf	Semi-Supervised Few-Shot Learning with MAML	Rinu Boney, Alexander Ilin	We present preliminary results on extending Model-Agnostic Meta-Learning (MAML) (Finn et al., 2017a) to fast adaptation to new classification tasks in the presence of unlabeled data. Using synthetic data, we show that MAML can adapt to new tasks without any labeled examples (unsupervised adaptation) when the new task has the same output space (classes) as the training tasks do. We further extend MAML to the semi-supervised few-shot learning scenario, when the output space of the new tasks can be different from the training tasks.	few-shot learning, meta learning, maml	2018-01-26	ICLR 2018	training						
20260627	FSL	https://github.com/Stonesusu/FewShotPapers	https://openreview.net/forum?id=HJcSzz-CZ	Meta-Learning for Semi-Supervised Few-Shot Classification	Mengye Ren, Eleni Triantafillou, Sachin Ravi, Jake Snell, Kevin Swersky, Joshua B. Tenenbaum, Hugo Larochelle, Richard S. Zemel	In few-shot classification, we are interested in learning algorithms that train a classifier from only a handful of labeled examples. Recent progress in few-shot classification has featured meta-learning, in which a parameterized model for a learning algorithm is defined and trained on episodes representing different classification problems, each with a small labeled training set and its corresponding test set. In this work, we advance this few-shot classification paradigm towards a scenario where unlabeled examples are also available within each episode. We consider two situations: one where all unlabeled examples are assumed to belong to the same set of classes as the labeled examples of the episode, as well as the more challenging situation where examples from other distractor classes are also provided. To address this paradigm, we propose novel extensions of Prototypical Networks (Snell et al., 2017) that are augmented with the ability to use unlabeled examples when producing prototypes. These models are trained in an end-to-end way on episodes, to learn to leverage the unlabeled examples successfully. We evaluate these methods on versions of the Omniglot and miniImageNet benchmarks, adapted to this new framework augmented with unlabeled examples. We also propose a new split of ImageNet, consisting of a large set of classes, with a hierarchical structure. Our experiments confirm that our Prototypical Networks can learn to improve their predictions due to unlabeled examples, much like a semi-supervised algorithm would.	Few-shot learning, semi-supervised learning, meta-learning	2018-02-15	ICLR 2018	training						
20260627	FSL	https://github.com/Stonesusu/FewShotPapers	https://openreview.net/forum?id=B1DmUzWAW	A Simple Neural Attentive Meta-Learner	Nikhil Mishra, Mostafa Rohaninejad, Xi Chen, Pieter Abbeel	Deep neural networks excel in regimes with large amounts of data, but tend to struggle when data is scarce or when they need to adapt quickly to changes in the task. In response, recent work in meta-learning proposes training a meta-learner on a distribution of similar tasks, in the hopes of generalization to novel but related tasks by learning a high-level strategy that captures the essence of the problem it is asked to solve. However, many recent meta-learning approaches are extensively hand-designed, either using architectures specialized to a particular application, or hard-coding algorithmic components that constrain how the meta-learner solves the task. We propose a class of simple and generic meta-learner architectures that use a novel combination of temporal convolutions and soft attention; the former to aggregate information from past experience and the latter to pinpoint specific pieces of information.  In the most extensive set of meta-learning experiments to date, we evaluate the resulting Simple Neural AttentIve Learner (or SNAIL) on several heavily-benchmarked tasks.  On all tasks, in both supervised and reinforcement learning, SNAIL attains state-of-the-art performance by significant margins.	meta-learning, few-shot learning	2018-02-15	ICLR 2018	training						
20260627	FSL	https://github.com/Stonesusu/FewShotPapers	https://openreview.net/forum?id=HyxnZh0ct7	Meta-learning with differentiable closed-form solvers	Luca Bertinetto, Joao F. Henriques, Philip Torr, Andrea Vedaldi	Adapting deep networks to new concepts from a few examples is challenging, due to the high computational requirements of standard fine-tuning procedures. Most work on few-shot learning has thus focused on simple learning techniques for adaptation, such as nearest neighbours or gradient descent. Nonetheless, the machine learning literature contains a wealth of methods that learn non-deep models very efficiently. In this paper, we propose to use these fast convergent methods as the main adaptation mechanism for few-shot learning. The main idea is to teach a deep network to use standard machine learning tools, such as ridge regression, as part of its own internal model, enabling it to quickly adapt to novel data. This requires back-propagating errors through the solver steps. While normally the cost of the matrix operations involved in such a process would be significant, by using the Woodbury identity we can make the small number of examples work to our advantage. We propose both closed-form and iterative solvers, based on ridge regression and logistic regression components. Our methods constitute a simple and novel approach to the problem of few-shot learning and achieve performance competitive with or superior to the state of the art on three benchmarks.	few-shot learning, one-shot learning, meta-learning, deep learning, ridge regression, classification	2018-09-27	ICLR 2019	training						
20260627	FSL	https://github.com/Stonesusu/FewShotPapers	https://openreview.net/forum?id=SyVuRiC5K7	LEARNING TO PROPAGATE LABELS: TRANSDUCTIVE PROPAGATION NETWORK FOR FEW-SHOT LEARNING	Yanbin Liu, Juho Lee, Minseop Park, Saehoon Kim, Eunho Yang, Sung Ju Hwang, Yi Yang	The goal of few-shot learning is to learn a classifier that generalizes well even when trained with a limited number of training instances per class. The recently introduced meta-learning approaches tackle this problem by learning a generic classifier across a large number of multiclass classification tasks and generalizing the model to a new task. Yet, even with such meta-learning, the low-data problem in the novel classification task still remains. In this paper, we propose Transductive Propagation Network (TPN), a novel meta-learning framework for transductive inference that classifies the entire test set at once to alleviate the low-data problem. Specifically, we propose to learn to propagate labels from labeled instances to unlabeled test instances, by learning a graph construction module that exploits the manifold structure in the data. TPN jointly learns both the parameters of feature embedding and the graph construction in an end-to-end manner.  We validate TPN on multiple benchmark datasets, on which it largely outperforms existing few-shot learning approaches and achieves the state-of-the-art results.	few-shot learning, meta-learning, label propagation, manifold learning	2018-09-27	ICLR 2019	training						
20260627	FSL	https://github.com/Stonesusu/FewShotPapers	https://openreview.net/forum?id=SJTQLdqlg	Learning to Remember Rare Events	Lukasz Kaiser, Ofir Nachum, Aurko Roy, Samy Bengio	Despite recent advances, memory-augmented deep neural networks are still limited when it comes to life-long and one-shot learning, especially in remembering rare events. We present a large-scale life-long memory module for use in deep learning. The module exploits fast nearest-neighbor algorithms for efficiency and thus scales to large memory sizes. Except for the nearest-neighbor query, the module is fully differentiable and trained end-to-end with no extra supervision.  It operates in a life-long manner, i.e., without the need to reset it during training. Our memory module can be easily added to any part of a supervised neural network. To show its versatility we add it to a number of networks, from simple convolutional ones tested on image classification to deep sequence-to-sequence and recurrent-convolutional models. In all cases, the enhanced network gains the ability to remember and do life-long one-shot learning. Our module remembers training examples shown many thousands of steps in the past and it can successfully generalize from them. We set new state-of-the-art for one-shot learning on the Omniglot dataset and demonstrate, for the first time, life-long one-shot learning in recurrent neural networks on a large-scale machine translation task.	Deep learning	2016-11-04	ICLR 2017	training						
20260627	FSL	https://github.com/Stonesusu/FewShotPapers	https://openreview.net/forum?id=ByeSdsC9Km	Adaptive Posterior Learning: few-shot learning with a surprise-based memory module	Tiago Ramalho, Marta Garnelo	The ability to generalize quickly from few observations is crucial for intelligent systems. In this paper we introduce APL, an algorithm that approximates probability distributions by remembering the most surprising observations it has encountered. These past observations are recalled from an external memory module and processed by a decoder network that can combine information from different memory slots to generalize beyond direct recall. We show this algorithm can perform as well as state of the art baselines on few-shot classification benchmarks with a smaller memory footprint.  In addition, its memory compression allows it to scale to thousands of unknown labels.  Finally, we introduce a meta-learning reasoning task which is more challenging than direct classification. In this setting, APL is able to generalize with fewer than one example per class via deductive reasoning.	metalearning, memory, few-shot, relational, self-attention, classification, sequential, reasoning, working memory, episodic memory	2018-09-27	ICLR 2019	training						
20260627	FSL	https://github.com/Stonesusu/FewShotPapers	https://openreview.net/forum?id=HJDBUF5le	Towards a Neural Statistician	Harrison Edwards, Amos Storkey	An efficient learner is one who reuses what they already know to tackle a new problem. For a machine learner, this means understanding the similarities amongst datasets. In order to do this, one must take seriously the idea of working with datasets, rather than datapoints, as the key objects to model. Towards this goal, we demonstrate an extension of a variational autoencoder that can learn a method for computing representations, or statistics, of datasets in an unsupervised fashion. The network is trained to produce statistics that encapsulate a generative model for each dataset. Hence the network enables efficient learning from new datasets for both unsupervised and supervised tasks. We show that we are able to learn statistics that can be used for: clustering datasets, transferring generative models to new datasets, selecting representative samples of datasets and classifying previously unseen classes. We refer to our model as a neural statistician, and by this we mean a neural network that can learn to compute summary statistics of datasets without supervision.		2016-11-04	ICLR 2017	training						
20260627	FSL	https://github.com/Stonesusu/FewShotPapers	https://openreview.net/forum?id=r1wEFyWCW	Few-shot Autoregressive Density Estimation: Towards Learning to Learn Distributions	Scott Reed, Yutian Chen, Thomas Paine, Aäron van den Oord, S. M. Ali Eslami, Danilo Rezende, Oriol Vinyals, Nando de Freitas	Deep autoregressive models have shown state-of-the-art performance in density estimation for natural images on large-scale datasets such as ImageNet.  However, such models require many thousands of gradient-based weight updates and unique image examples for training. Ideally, the models would rapidly learn visual concepts from only a handful of examples, similar to the manner in which humans learns across many vision tasks.  In this paper, we show how 1) neural attention and 2) meta learning techniques can be used in combination with autoregressive models to enable effective few-shot density estimation. Our proposed modifications to PixelCNN result in state-of-the art few-shot density estimation on the Omniglot dataset.  Furthermore, we visualize the learned attention policy and find that it learns intuitive algorithms for simple tasks such as image mirroring on ImageNet and handwriting on Omniglot without supervision. Finally, we extend the model to natural images and demonstrate few-shot image generation on the Stanford Online Products dataset.	few-shot learning, density models, meta learning	2018-02-15	ICLR 2018	training						
20260627	FSL	https://github.com/Stonesusu/FewShotPapers	https://openreview.net/forum?id=HkxStoC5F7	Meta-Learning Probabilistic Inference for Prediction	Jonathan Gordon, John Bronskill, Matthias Bauer, Sebastian Nowozin, Richard Turner	This paper introduces a new framework for data efficient and versatile learning. Specifically: 1) We develop ML-PIP, a general framework for Meta-Learning approximate Probabilistic Inference for Prediction. ML-PIP extends existing probabilistic interpretations of meta-learning to cover a broad class of methods.  2) We introduce \Versa{}, an instance of the framework employing a flexible and versatile amortization network that takes few-shot learning datasets as inputs, with arbitrary numbers of shots, and outputs a distribution over task-specific parameters in a single forward pass. \Versa{} substitutes optimization at test time with forward passes through inference networks, amortizing the cost of inference and relieving the need for second derivatives during training. 3) We evaluate \Versa{} on benchmark datasets where the method sets new state-of-the-art results, and can handle arbitrary number of shots, and for classification, arbitrary numbers of classes at train and test time. The power of the approach is then demonstrated through a challenging few-shot ShapeNet view reconstruction task.	probabilistic models, approximate inference, few-shot learning, meta-learning	2018-09-27	ICLR 2019	training						
20260627	FSL	https://github.com/Stonesusu/FewShotPapers	https://openreview.net/forum?id=tPCrkaLa9Y5ld	One-Shot Adaptation of Supervised Deep Convolutional Models	Trevor Darrell, Eric Tzeng, Yangqing Jia, Judy Hoffman, Kate Saenko, Jeff Donahue	Dataset bias remains a significant barrier towards solving real world computer vision tasks. Though deep convolutional networks have proven to be a competitive approach for image classification, a question remains: have these models have solved the dataset bias problem? In general, training or fine-tuning a state-of-the-art deep model on a new domain requires a significant amount of data, which for many applications is simply not available. Transfer of models directly to new domains without adaptation has historically led to poor recognition performance. In this paper, we pose the following question: is a single image dataset, much larger than previously explored for adaptation, comprehensive enough to learn general deep models that may be effectively applied to new image domains? In other words, are deep CNNs trained on large amounts of labeled data as susceptible to dataset bias as previous methods have been shown to be? We show that a generic supervised deep CNN model trained on a large dataset reduces, but does not remove, dataset bias. Furthermore, we propose several methods for adaptation with deep models that are able to operate with little (one example per category) or no labeled domain specific data. Our experiments show that adaptation of deep models on benchmark visual domain adaptation datasets can provide a significant performance boost.		2013-12-24	ICLR 2014	training						
20260627	FSL	https://github.com/Stonesusu/FewShotPapers	https://openreview.net/forum?id=BJ_UL-k0b	Recasting Gradient-Based Meta-Learning as Hierarchical Bayes	Erin Grant, Chelsea Finn, Sergey Levine, Trevor Darrell, Thomas Griffiths	Meta-learning allows an intelligent agent to leverage prior learning episodes as a basis for quickly improving performance on a novel task. Bayesian hierarchical modeling provides a theoretical framework for formalizing meta-learning as inference for a set of parameters that are shared across tasks. Here, we reformulate the model-agnostic meta-learning algorithm (MAML) of Finn et al. (2017) as a method for probabilistic inference in a hierarchical Bayesian model. In contrast to prior methods for meta-learning via hierarchical Bayes, MAML is naturally applicable to complex function approximators through its use of a scalable gradient descent procedure for posterior inference. Furthermore, the identification of MAML as hierarchical Bayes provides a way to understand the algorithm’s operation as a meta-learning procedure, as well as an opportunity to make use of computational strategies for efficient inference. We use this opportunity to propose an improvement to the MAML algorithm that makes use of techniques from approximate inference and curvature estimation.	meta-learning, learning to learn, hierarchical Bayes, approximate Bayesian methods	2018-02-15	ICLR 2018	training						
20260627	FSL	https://github.com/Stonesusu/FewShotPapers	https://openreview.net/forum?id=rkgpy3C5tX	Amortized Bayesian Meta-Learning	Sachin Ravi, Alex Beatson	Meta-learning, or learning-to-learn, has proven to be a successful strategy in attacking problems in supervised learning and reinforcement learning that involve small amounts of data. State-of-the-art solutions involve learning an initialization and/or learning algorithm using a set of training episodes so that the meta learner can generalize to an evaluation episode quickly. These methods perform well but often lack good quantification of uncertainty, which can be vital to real-world applications when data is lacking. We propose a meta-learning method which efficiently amortizes hierarchical variational inference across tasks, learning a prior distribution over neural network weights so that a few steps of Bayes by Backprop will produce a good task-specific approximate posterior. We show that our method produces good uncertainty estimates on contextual bandit and few-shot learning benchmarks.	variational inference, meta-learning, few-shot learning, uncertainty quantification	2018-09-27	ICLR 2019	training						
20260627	FSL	https://github.com/Stonesusu/FewShotPapers	https://openreview.net/forum?id=BJgklhAcK7	Meta-Learning with Latent Embedding Optimization	Andrei A. Rusu, Dushyant Rao, Jakub Sygnowski, Oriol Vinyals, Razvan Pascanu, Simon Osindero, Raia Hadsell	Gradient-based meta-learning techniques are both widely applicable and proficient at solving challenging few-shot learning and fast adaptation problems. However, they have practical difficulties when operating on high-dimensional parameter spaces in extreme low-data regimes. We show that it is possible to bypass these limitations by learning a data-dependent latent generative representation of model parameters, and performing gradient-based meta-learning in this low-dimensional latent space. The resulting approach, latent embedding optimization (LEO), decouples the gradient-based adaptation procedure from the underlying high-dimensional space of model parameters. Our evaluation shows that LEO can achieve state-of-the-art performance on the competitive miniImageNet and tieredImageNet few-shot classification tasks. Further analysis indicates LEO is able to capture uncertainty in the data, and can perform adaptation more effectively by optimizing in latent space.	meta-learning, few-shot, miniImageNet, tieredImageNet, hypernetworks, generative, latent embedding, optimization	2018-09-27	ICLR 2019	training						
20260627	FSL	https://github.com/Stonesusu/FewShotPapers	https://openreview.net/forum?id=rJY0-Kcll	Optimization as a Model for Few-Shot Learning	Sachin Ravi, Hugo Larochelle	Though deep neural networks have shown great success in the large data domain, they generally perform poorly on few-shot learning tasks, where a model has to quickly generalize after seeing very few examples from each class. The general belief is that gradient-based optimization in high capacity models requires many iterative steps over many examples to perform well. Here, we propose an LSTM-based meta-learner model to learn the exact optimization algorithm used to train another learner neural network in the few-shot regime. The parametrization of our model allows it to learn appropriate parameter updates specifically for the scenario where a set amount of updates will be made, while also learning a general initialization of the learner network that allows for quick convergence of training. We demonstrate that this meta-learning model is competitive with deep metric-learning techniques for few-shot learning.		2016-11-04	ICLR 2017	training						
20260627	FSL	https://github.com/Stonesusu/FewShotPapers	https://openreview.net/forum?id=Sk2u1g-0-	Continuous Adaptation via Meta-Learning in Nonstationary and Competitive Environments	Maruan Al-Shedivat, Trapit Bansal, Yura Burda, Ilya Sutskever, Igor Mordatch, Pieter Abbeel	Ability to continuously learn and adapt from limited experience in nonstationary environments is an important milestone on the path towards general intelligence. In this paper, we cast the problem of continuous adaptation into the learning-to-learn framework. We develop a simple gradient-based meta-learning algorithm suitable for adaptation in dynamically changing and adversarial scenarios. Additionally, we design a new multi-agent competitive environment, RoboSumo, and define iterated adaptation games for testing various aspects of continuous adaptation. We demonstrate that meta-learning enables significantly more efficient adaptation than reactive baselines in the few-shot regime. Our experiments with a population of agents that learn and compete suggest that meta-learners are the fittest.	reinforcement learning, nonstationarity, meta-learning, transfer learning, multi-agent	2018-02-15	ICLR 2018	training						
20260627	FSL	https://github.com/Stonesusu/FewShotPapers	https://openreview.net/forum?id=HkgSEnA5KQ	Guiding Policies with Language via Meta-Learning	John D. Co-Reyes, Abhishek Gupta, Suvansh Sanjeev, Nick Altieri, Jacob Andreas, John DeNero, Pieter Abbeel, Sergey Levine	Behavioral skills or policies for autonomous agents are conventionally learned from reward functions, via reinforcement learning, or from demonstrations, via imitation learning. However, both modes of task specification have their disadvantages: reward functions require manual engineering, while demonstrations require a human expert to be able to actually perform the task in order to generate the demonstration. Instruction following from natural language instructions provides an appealing alternative: in the same way that we can specify goals to other humans simply by speaking or writing, we would like to be able to specify tasks for our machines. However, a single instruction may be insufficient to fully communicate our intent or, even if it is, may be insufficient for an autonomous agent to actually understand how to perform the desired task. In this work, we propose an interactive formulation of the task specification problem, where iterative language corrections are provided to an autonomous agent, guiding it in acquiring the desired skill. Our proposed language-guided policy learning algorithm can integrate an instruction and a sequence of corrections to acquire new skills very quickly. In our experiments, we show that this method can enable a policy to follow instructions and corrections for simulated navigation and manipulation tasks, substantially outperforming direct, non-interactive instruction following.	meta-learning, language grounding, interactive	2018-09-27	ICLR 2019	training						
