date_seen	source_name	source_url	paper_url	title	authors	abstract	keywords	pub_date	place	category	viewed	read	bookmarked	labelled	impactful_researcher	impactful_institution
20260627	LongbiaoWang	https://export.arxiv.org/api/query?search_query=au:Wang_Longbiao&max_results=200	https://arxiv.org/abs/2108.01831	Information Sieve: Content Leakage Reduction in End-to-End Prosody For Expressive Speech Synthesis	Xudong Dai, Cheng Gong, Longbiao Wang, Kaili Zhang	"Expressive neural text-to-speech (TTS) systems incorporate a style encoder to learn a latent embedding as the style information. However, this embedding process may encode redundant textual information. This phenomenon is called content leakage. Researchers have attempted to resolve this problem by adding an ASR or other auxiliary supervision loss functions. In this study, we propose an unsupervised method called the ""information sieve"" to reduce the effect of content leakage in prosody transfer. The rationale of this approach is that the style encoder can be forced to focus on style information rather than on textual information contained in the reference speech by a well-designed downsample-upsample filter, i.e., the extracted style embeddings can be downsampled at a certain interval and then upsampled by duplication. Furthermore, we used instance normalization in convolution layers to help the system learn a better latent style space. Objective metrics such as the significantly lower word error rate (WER) demonstrate the effectiveness of this model in mitigating content leakage. Listening tests indicate that the model retains its prosody transferability compared with the baseline models such as the original GST-Tacotron and ASR-guided Tacotron."	cs.SD, eess.AS	2021-08-04		voice						
20260627	LongbiaoWang	https://export.arxiv.org/api/query?search_query=au:Wang_Longbiao&max_results=200	https://arxiv.org/abs/1910.10334	Relation Modeling with Graph Convolutional Networks for Facial Action Unit Detection	Zhilei Liu, Jiahui Dong, Cuicui Zhang, Longbiao Wang, Jianwu Dang	Most existing AU detection works considering AU relationships are relying on probabilistic graphical models with manually extracted features. This paper proposes an end-to-end deep learning framework for facial AU detection with graph convolutional network (GCN) for AU relation modeling, which has not been explored before. In particular, AU related regions are extracted firstly, latent representations full of AU information are learned through an auto-encoder. Moreover, each latent representation vector is feed into GCN as a node, the connection mode of GCN is determined based on the relationships of AUs. Finally, the assembled features updated through GCN are concatenated for AU detection. Extensive experiments on BP4D and DISFA benchmarks demonstrate that our framework significantly outperforms the state-of-the-art methods for facial AU detection. The proposed framework is also validated through a series of ablation studies.	cs.CV	2019-10-23		voice						
20260627	LongbiaoWang	https://export.arxiv.org/api/query?search_query=au:Wang_Longbiao&max_results=200	https://arxiv.org/abs/2211.01046	Monolingual Recognizers Fusion for Code-switching Speech Recognition	Tongtong Song, Qiang Xu, Haoyu Lu, Longbiao Wang, Hao Shi, Yuqin Lin, Yanbing Yang, Jianwu Dang	The bi-encoder structure has been intensively investigated in code-switching (CS) automatic speech recognition (ASR). However, most existing methods require the structures of two monolingual ASR models (MAMs) should be the same and only use the encoder of MAMs. This leads to the problem that pre-trained MAMs cannot be timely and fully used for CS ASR. In this paper, we propose a monolingual recognizers fusion method for CS ASR. It has two stages: the speech awareness (SA) stage and the language fusion (LF) stage. In the SA stage, acoustic features are mapped to two language-specific predictions by two independent MAMs. To keep the MAMs focused on their own language, we further extend the language-aware training strategy for the MAMs. In the LF stage, the BELM fuses two language-specific predictions to get the final prediction. Moreover, we propose a text simulation strategy to simplify the training process of the BELM and reduce reliance on CS data. Experiments on a Mandarin-English corpus show the efficiency of the proposed method. The mix error rate is significantly reduced on the test set after using open-source pre-trained MAMs.	cs.CL, cs.SD, eess.AS	2022-11-02		voice						
20260627	LongbiaoWang	https://export.arxiv.org/api/query?search_query=au:Wang_Longbiao&max_results=200	https://arxiv.org/abs/2501.02452	Reducing the Gap Between Pretrained Speech Enhancement and Recognition Models Using a Real Speech-Trained Bridging Module	Zhongjian Cui, Chenrui Cui, Tianrui Wang, Mengnan He, Hao Shi, Meng Ge, Caixia Gong, Longbiao Wang, Jianwu Dang	The information loss or distortion caused by single-channel speech enhancement (SE) harms the performance of automatic speech recognition (ASR). Observation addition (OA) is an effective post-processing method to improve ASR performance by balancing noisy and enhanced speech. Determining the OA coefficient is crucial. However, the currently supervised OA coefficient module, called the bridging module, only utilizes simulated noisy speech for training, which has a severe mismatch with real noisy speech. In this paper, we propose training strategies to train the bridging module with real noisy speech. First, DNSMOS is selected to evaluate the perceptual quality of real noisy speech with no need for the corresponding clean label to train the bridging module. Additional constraints during training are introduced to enhance the robustness of the bridging module further. Each utterance is evaluated by the ASR back-end using various OA coefficients to obtain the word error rates (WERs). The WERs are used to construct a multidimensional vector. This vector is introduced into the bridging module with multi-task learning and is used to determine the optimal OA coefficients. The experimental results on the CHiME-4 dataset show that the proposed methods all had significant improvement compared with the simulated data trained bridging module, especially under real evaluation sets.	cs.SD, eess.AS	2025-01-05	ICASSP 2025	voice						
20260627	LongbiaoWang	https://export.arxiv.org/api/query?search_query=au:Wang_Longbiao&max_results=200	https://arxiv.org/abs/2408.05758	VQ-CTAP: Cross-Modal Fine-Grained Sequence Representation Learning for Speech Processing	Chunyu Qiang, Wang Geng, Yi Zhao, Ruibo Fu, Tao Wang, Cheng Gong, Tianrui Wang, Qiuyu Liu, Jiangyan Yi, Zhengqi Wen, Chen Zhang, Hao Che, Longbiao Wang, Jianwu Dang, Jianhua Tao	"Deep learning has brought significant improvements to the field of cross-modal representation learning. For tasks such as text-to-speech (TTS), voice conversion (VC), and automatic speech recognition (ASR), a cross-modal fine-grained (frame-level) sequence representation is desired, emphasizing the semantic content of the text modality while de-emphasizing the paralinguistic information of the speech modality. We propose a method called ""Vector Quantized Contrastive Token-Acoustic Pre-training (VQ-CTAP)"", which uses the cross-modal aligned sequence transcoder to bring text and speech into a joint multimodal space, learning how to connect text and speech at the frame level. The proposed VQ-CTAP is a paradigm for cross-modal sequence representation learning, offering a promising solution for fine-grained generation and recognition tasks in speech processing. The VQ-CTAP can be directly applied to VC and ASR tasks without fine-tuning or additional structures. We propose a sequence-aware semantic connector, which connects multiple frozen pre-trained modules for the TTS task, exhibiting a plug-and-play capability. We design a stepping optimization strategy to ensure effective model convergence by gradually injecting and adjusting the influence of various loss components. Furthermore, we propose a semantic-transfer-wise paralinguistic consistency loss to enhance representational capabilities, allowing the model to better generalize to unseen data and capture the nuances of paralinguistic information. In addition, VQ-CTAP achieves high-compression speech coding at a rate of 25Hz from 24kHz input waveforms, which is a 960-fold reduction in the sampling rate. The audio demo is available at https://qiangchunyu.github.io/VQCTAP/"	cs.AI, cs.CL, cs.SD, eess.AS	2024-08-11		voice						
20260627	LongbiaoWang	https://export.arxiv.org/api/query?search_query=au:Wang_Longbiao&max_results=200	https://arxiv.org/abs/2605.09413	Evaluating the Expressive Appropriateness of Speech in Rich Contexts	Tianrui Wang, Ziyang Ma, Yizhou Peng, Haoyu Wang, Zhikang Niu, Zikang Huang, Yihao Wu, Yi-Wen Chao, Yu Jiang, Yuheng Lu, Guanrou Yang, Xuanchen Li, Hexin Liu, Chunyu Qiang, Cheng Gong, Yifan Yang, Tianchi Liu, Junyu Wang, Nana Hou, Meng Ge, Fuming You, Wei Yang, Zhongqian Sun, Haifeng Hu, Xiaobao Wang, Eng Siong Chng, Xie Chen, Longbiao Wang, Jianwu Dang	Evaluating expressive speech remains challenging, as existing methods mainly assess emotional intensity and overlook whether a speech sample is expressively appropriate for its contextual setting. This limitation hinders reliable evaluation of speech systems used in narrative-driven and interactive applications, such as audiobooks and conversational agents. We introduce CEAEval, a Context-rich framework for Evaluating Expressive Appropriateness in speech, which assesses whether a speech sample expressively aligns with the underlying communicative intent implied by its discourse-level narrative context. To support this task, we construct CEAEval-D, the first context-rich speech dataset with real human performances in Mandarin conversational speech, providing narrative descriptions together with fifteen dimensions of human annotations covering expressive attributes and expressive appropriateness. We further develop CEAEval-M, a model that integrates knowledge distillation, planner-based multi-model collaboration, adaptive audio attention bias, and reinforcement learning to perform context-rich expressive appropriateness evaluation. Experiments on a human-annotated test set demonstrate that CEAEval-M substantially outperforms existing speech evaluation and analysis systems.	eess.AS	2026-05-10		voice						
20260627	LongbiaoWang	https://export.arxiv.org/api/query?search_query=au:Wang_Longbiao&max_results=200	https://arxiv.org/abs/2509.23832	LORT: Locally Refined Convolution and Taylor Transformer for Monaural Speech Enhancement	Junyu Wang, Zizhen Lin, Tianrui Wang, Meng Ge, Longbiao Wang, Jianwu Dang	Achieving superior enhancement performance while maintaining a low parameter count and computational complexity remains a challenge in the field of speech enhancement. In this paper, we introduce LORT, a novel architecture that integrates spatial-channel enhanced Taylor Transformer and locally refined convolution for efficient and robust speech enhancement. We propose a Taylor multi-head self-attention (T-MSA) module enhanced with spatial-channel enhancement attention (SCEA), designed to facilitate inter-channel information exchange and alleviate the spatial attention limitations inherent in Taylor-based Transformers. To complement global modeling, we further present a locally refined convolution (LRC) block that integrates convolutional feed-forward layers, time-frequency dense local convolutions, and gated units to capture fine-grained local details. Built upon a U-Net-like encoder-decoder structure with only 16 output channels in the encoder, LORT processes noisy inputs through multi-resolution T-MSA modules using alternating downsampling and upsampling operations. The enhanced magnitude and phase spectra are decoded independently and optimized through a composite loss function that jointly considers magnitude, complex, phase, discriminator, and consistency objectives. Experimental results on the VCTK+DEMAND and DNS Challenge datasets demonstrate that LORT achieves competitive or superior performance to state-of-the-art (SOTA) models with only 0.96M parameters, highlighting its effectiveness for real-world speech enhancement applications with limited computational resources.	cs.SD, eess.AS	2025-09-28		voice						
20260627	LongbiaoWang	https://export.arxiv.org/api/query?search_query=au:Wang_Longbiao&max_results=200	https://arxiv.org/abs/2110.09951	Talking Head Generation with Audio and Speech Related Facial Action Units	Sen Chen, Zhilei Liu, Jiaxing Liu, Zhengxiang Yan, Longbiao Wang	The task of talking head generation is to synthesize a lip synchronized talking head video by inputting an arbitrary face image and audio clips. Most existing methods ignore the local driving information of the mouth muscles. In this paper, we propose a novel recurrent generative network that uses both audio and speech-related facial action units (AUs) as the driving information. AU information related to the mouth can guide the movement of the mouth more accurately. Since speech is highly correlated with speech-related AUs, we propose an Audio-to-AU module in our system to predict the speech-related AU information from speech. In addition, we use AU classifier to ensure that the generated images contain correct AU information. Frame discriminator is also constructed for adversarial training to improve the realism of the generated face. We verify the effectiveness of our model on the GRID dataset and TCD-TIMIT dataset. We also conduct an ablation study to verify the contribution of each component in our model. Quantitative and qualitative experiments demonstrate that our method outperforms existing methods in both image quality and lip-sync accuracy.	cs.CV, cs.MM	2021-10-19		voice						
20260627	LongbiaoWang	https://export.arxiv.org/api/query?search_query=au:Wang_Longbiao&max_results=200	https://arxiv.org/abs/2011.09624	Multi-stage Speaker Extraction with Utterance and Frame-Level Reference Signals	Meng Ge, Chenglin Xu, Longbiao Wang, Eng Siong Chng, Jianwu Dang, Haizhou Li	Speaker extraction requires a sample speech from the target speaker as the reference. However, enrolling a speaker with a long speech is not practical. We propose a speaker extraction technique, that performs in multiple stages to take full advantage of short reference speech sample. The extracted speech in early stages is used as the reference speech for late stages. For the first time, we use frame-level sequential speech embedding as the reference for target speaker. This is a departure from the traditional utterance-based speaker embedding reference. In addition, a signal fusion scheme is proposed to combine the decoded signals in multiple scales with automatically learned weights. Experiments on WSJ0-2mix and its noisy versions (WHAM! and WHAMR!) show that SpEx++ consistently outperforms other state-of-the-art baselines.	cs.LG, eess.AS	2020-11-19		voice						
20260627	LongbiaoWang	https://export.arxiv.org/api/query?search_query=au:Wang_Longbiao&max_results=200	https://arxiv.org/abs/2104.08510	Exploring Deep Learning for Joint Audio-Visual Lip Biometrics	Meng Liu, Longbiao Wang, Kong Aik Lee, Hanyi Zhang, Chang Zeng, Jianwu Dang	Audio-visual (AV) lip biometrics is a promising authentication technique that leverages the benefits of both the audio and visual modalities in speech communication. Previous works have demonstrated the usefulness of AV lip biometrics. However, the lack of a sizeable AV database hinders the exploration of deep-learning-based audio-visual lip biometrics. To address this problem, we compile a moderate-size database using existing public databases. Meanwhile, we establish the DeepLip AV lip biometrics system realized with a convolutional neural network (CNN) based video module, a time-delay neural network (TDNN) based audio module, and a multimodal fusion module. Our experiments show that DeepLip outperforms traditional speaker recognition models in context modeling and achieves over 50% relative improvements compared with our best single modality baseline, with an equal error rate of 0.75% and 1.11% on the test datasets, respectively.	cs.CV, cs.MM, cs.SD, eess.AS	2021-04-17		voice						
20260627	LongbiaoWang	https://export.arxiv.org/api/query?search_query=au:Wang_Longbiao&max_results=200	https://arxiv.org/abs/2202.09995	L-SpEx: Localized Target Speaker Extraction	Meng Ge, Chenglin Xu, Longbiao Wang, Eng Siong Chng, Jianwu Dang, Haizhou Li	Speaker extraction aims to extract the target speaker's voice from a multi-talker speech mixture given an auxiliary reference utterance. Recent studies show that speaker extraction benefits from the location or direction of the target speaker. However, these studies assume that the target speaker's location is known in advance or detected by an extra visual cue, e.g., face image or video. In this paper, we propose an end-to-end localized target speaker extraction on pure speech cues, that is called L-SpEx. Specifically, we design a speaker localizer driven by the target speaker's embedding to extract the spatial features, including direction-of-arrival (DOA) of the target speaker and beamforming output. Then, the spatial cues and target speaker's embedding are both used to form a top-down auditory attention to the target speaker. Experiments on the multi-channel reverberant dataset called MC-Libri2Mix show that our L-SpEx approach significantly outperforms the baseline system.	cs.SD, eess.AS	2022-02-21		voice						
20260627	LongbiaoWang	https://export.arxiv.org/api/query?search_query=au:Wang_Longbiao&max_results=200	https://arxiv.org/abs/2207.07307	MIMO-DoAnet: Multi-channel Input and Multiple Outputs DoA Network with Unknown Number of Sound Sources	Haoran Yin, Meng Ge, Yanjie Fu, Gaoyan Zhang, Longbiao Wang, Lei Zhang, Lin Qiu, Jianwu Dang	Recent neural network based Direction of Arrival (DoA) estimation algorithms have performed well on unknown number of sound sources scenarios. These algorithms are usually achieved by mapping the multi-channel audio input to the single output (i.e. overall spatial pseudo-spectrum (SPS) of all sources), that is called MISO. However, such MISO algorithms strongly depend on empirical threshold setting and the angle assumption that the angles between the sound sources are greater than a fixed angle. To address these limitations, we propose a novel multi-channel input and multiple outputs DoA network called MIMO-DoAnet. Unlike the general MISO algorithms, MIMO-DoAnet predicts the SPS coding of each sound source with the help of the informative spatial covariance matrix. By doing so, the threshold task of detecting the number of sound sources becomes an easier task of detecting whether there is a sound source in each output, and the serious interaction between sound sources disappears during inference stage. Experimental results show that MIMO-DoAnet achieves relative 18.6% and absolute 13.3%, relative 34.4% and absolute 20.2% F1 score improvement compared with the MISO baseline system in 3, 4 sources scenes. The results also demonstrate MIMO-DoAnet alleviates the threshold setting problem and solves the angle assumption problem effectively.	cs.LG, cs.SD, eess.AS	2022-07-15		voice						
20260627	LongbiaoWang	https://export.arxiv.org/api/query?search_query=au:Wang_Longbiao&max_results=200	https://arxiv.org/abs/2210.06177	VCSE: Time-Domain Visual-Contextual Speaker Extraction Network	Junjie Li, Meng Ge, Zexu Pan, Longbiao Wang, Jianwu Dang	Speaker extraction seeks to extract the target speech in a multi-talker scenario given an auxiliary reference. Such reference can be auditory, i.e., a pre-recorded speech, visual, i.e., lip movements, or contextual, i.e., phonetic sequence. References in different modalities provide distinct and complementary information that could be fused to form top-down attention on the target speaker. Previous studies have introduced visual and contextual modalities in a single model. In this paper, we propose a two-stage time-domain visual-contextual speaker extraction network named VCSE, which incorporates visual and self-enrolled contextual cues stage by stage to take full advantage of every modality. In the first stage, we pre-extract a target speech with visual cues and estimate the underlying phonetic sequence. In the second stage, we refine the pre-extracted target speech with the self-enrolled contextual cues. Experimental results on the real-world Lip Reading Sentences 3 (LRS3) database demonstrate that our proposed VCSE network consistently outperforms other state-of-the-art baselines.	cs.CL, cs.CV, cs.SD, eess.AS	2022-10-09		voice						
20260627	LongbiaoWang	https://export.arxiv.org/api/query?search_query=au:Wang_Longbiao&max_results=200	https://arxiv.org/abs/2409.00387	Progressive Residual Extraction based Pre-training for Speech Representation Learning	Tianrui Wang, Jin Li, Ziyang Ma, Rui Cao, Xie Chen, Longbiao Wang, Meng Ge, Xiaobao Wang, Yuguang Wang, Jianwu Dang, Nyima Tashi	Self-supervised learning (SSL) has garnered significant attention in speech processing, excelling in linguistic tasks such as speech recognition. However, jointly improving the performance of pre-trained models on various downstream tasks, each requiring different speech information, poses significant challenges. To this purpose, we propose a progressive residual extraction based self-supervised learning method, named ProgRE. Specifically, we introduce two lightweight and specialized task modules into an encoder-style SSL backbone to enhance its ability to extract pitch variation and speaker information from speech. Furthermore, to prevent the interference of reinforced pitch variation and speaker information with irrelevant content information learning, we residually remove the information extracted by these two modules from the main branch. The main branch is then trained using HuBERT's speech masking prediction to ensure the performance of the Transformer's deep-layer features on content tasks. In this way, we can progressively extract pitch variation, speaker, and content representations from the input speech. Finally, we can combine multiple representations with diverse speech information using different layer weights to obtain task-specific representations for various downstream tasks. Experimental results indicate that our proposed method achieves joint performance improvements on various tasks, such as speaker identification, speech recognition, emotion recognition, speech enhancement, and voice conversion, compared to excellent SSL methods such as wav2vec2.0, HuBERT, and WavLM.	cs.SD, eess.AS	2024-08-31		voice						
20260627	LongbiaoWang	https://export.arxiv.org/api/query?search_query=au:Wang_Longbiao&max_results=200	https://arxiv.org/abs/2508.02849	SecoustiCodec: Cross-Modal Aligned Streaming Single-Codecbook Speech Codec	Chunyu Qiang, Haoyu Wang, Cheng Gong, Tianrui Wang, Ruibo Fu, Tao Wang, Ruilong Chen, Jiangyan Yi, Zhengqi Wen, Chen Zhang, Longbiao Wang, Jianwu Dang, Jianhua Tao	Speech codecs serve as a crucial bridge in unifying speech and text language models. Existing codec methods face several challenges in semantic encoding, such as residual paralinguistic information (e.g., timbre, emotion), insufficient semantic completeness, limited reconstruction capability, and lack of support for streaming. To address these challenges, we propose SecoustiCodec, a cross-modal aligned low-bitrate streaming speech codec that disentangles semantic and paralinguistic information in a single-codebook space. To ensure semantic completeness and reconstruction fidelity, paralinguistic encoding is introduced to bridge the information gap between semantic and acoustic encoding. A semantic-only efficient quantization method based on VAE (Variational Autoencoder) and FSQ (Finite Scalar Quantization) is proposed. This approach alleviates the long-tail distribution problem of tokens while maintaining high codebook utilization. A semantic disentanglement method based on contrastive learning is proposed, which aligns text and speech in a joint multimodal frame-level space, effectively removing paralinguistic information from semantic encoding. An acoustic-constrained multi-stage optimization strategy is proposed to ensure robust and stable convergence. Figure~\ref{fig:pesq_kbps_below_2kbps} shows SecoustiCodec achieves SOTA (state-of-the-art) reconstruction quality (PESQ) of 1.77/2.58 at 0.27/1 kbps. The code and model weights for SecoustiCodec will be open-sourced upon the completion of the peer-review process. We've open-sourced SecoustiCodec's demo, code, and model weights.	cs.AI, cs.CL, cs.SD, eess.AS	2025-08-04		voice						
