date_seen	source_name	source_url	paper_url	title	authors	abstract	keywords	pub_date	place	category	viewed	read	bookmarked	labelled	impactful_researcher	impactful_institution
20260627	LongbiaoWang	https://export.arxiv.org/api/query?search_query=au:Wang_Longbiao&max_results=200	https://arxiv.org/abs/2307.15484	Minimally-Supervised Speech Synthesis with Conditional Diffusion Model and Language Model: A Comparative Study of Semantic Coding	Chunyu Qiang, Hao Li, Hao Ni, He Qu, Ruibo Fu, Tao Wang, Longbiao Wang, Jianwu Dang	Recently, there has been a growing interest in text-to-speech (TTS) methods that can be trained with minimal supervision by combining two types of discrete speech representations and using two sequence-to-sequence tasks to decouple TTS. However, existing methods suffer from three problems: the high dimensionality and waveform distortion of discrete speech representations, the prosodic averaging problem caused by the duration prediction model in non-autoregressive frameworks, and the information redundancy and dimension explosion problems of existing semantic encoding methods. To address these problems, three progressive methods are proposed. First, we propose Diff-LM-Speech, an autoregressive structure consisting of a language model and diffusion models, which models the semantic embedding into the mel-spectrogram based on a diffusion model to achieve higher audio quality. We also introduce a prompt encoder structure based on a variational autoencoder and a prosody bottleneck to improve prompt representation ability. Second, we propose Tetra-Diff-Speech, a non-autoregressive structure consisting of four diffusion model-based modules that design a duration diffusion model to achieve diverse prosodic expressions. Finally, we propose Tri-Diff-Speech, a non-autoregressive structure consisting of three diffusion model-based modules that verify the non-necessity of existing semantic encoding models and achieve the best results. Experimental results show that our proposed methods outperform baseline methods. We provide a website with audio samples.	cs.AI, cs.CL, cs.SD, eess.AS	2023-07-28		voice						
20260627	LongbiaoWang	https://export.arxiv.org/api/query?search_query=au:Wang_Longbiao&max_results=200	https://arxiv.org/abs/2210.05254	Deep Spectro-temporal Artifacts for Detecting Synthesized Speech	Xiaohui Liu, Meng Liu, Lin Zhang, Linjuan Zhang, Chang Zeng, Kai Li, Nan Li, Kong Aik Lee, Longbiao Wang, Jianwu Dang	The Audio Deep Synthesis Detection (ADD) Challenge has been held to detect generated human-like speech. With our submitted system, this paper provides an overall assessment of track 1 (Low-quality Fake Audio Detection) and track 2 (Partially Fake Audio Detection). In this paper, spectro-temporal artifacts were detected using raw temporal signals, spectral features, as well as deep embedding features. To address track 1, low-quality data augmentation, domain adaptation via finetuning, and various complementary feature information fusion were aggregated in our system. Furthermore, we analyzed the clustering characteristics of subsystems with different features by visualization method and explained the effectiveness of our proposed greedy fusion strategy. As for track 2, frame transition and smoothing were detected using self-supervised learning structure to capture the manipulation of PF attacks in the time domain. We ranked 4th and 5th in track 1 and track 2, respectively.	cs.AI, cs.SD, eess.AS	2022-10-11		voice						
20260627	LongbiaoWang	https://export.arxiv.org/api/query?search_query=au:Wang_Longbiao&max_results=200	https://arxiv.org/abs/2211.01091	I4U System Description for NIST SRE'20 CTS Challenge	Kong Aik Lee, Tomi Kinnunen, Daniele Colibro, Claudio Vair, Andreas Nautsch, Hanwu Sun, Liang He, Tianyu Liang, Qiongqiong Wang, Mickael Rouvier, Pierre-Michel Bousquet, Rohan Kumar Das, Ignacio Viñals Bailo, Meng Liu, Héctor Deldago, Xuechen Liu, Md Sahidullah, Sandro Cumani, Boning Zhang, Koji Okabe, Hitoshi Yamamoto, Ruijie Tao, Haizhou Li, Alfonso Ortega Giménez, Longbiao Wang, Luis Buera	This manuscript describes the I4U submission to the 2020 NIST Speaker Recognition Evaluation (SRE'20) Conversational Telephone Speech (CTS) Challenge. The I4U's submission was resulted from active collaboration among researchers across eight research teams - I$^2$R (Singapore), UEF (Finland), VALPT (Italy, Spain), NEC (Japan), THUEE (China), LIA (France), NUS (Singapore), INRIA (France) and TJU (China). The submission was based on the fusion of top performing sub-systems and sub-fusion systems contributed by individual teams. Efforts have been spent on the use of common development and validation sets, submission schedule and milestone, minimizing inconsistency in trial list and score file format across sites.	cs.AI, cs.SD, eess.AS	2022-11-02		voice						
20260627	LongbiaoWang	https://export.arxiv.org/api/query?search_query=au:Wang_Longbiao&max_results=200	https://arxiv.org/abs/2211.01585	The ISCSLP 2022 Intelligent Cockpit Speech Recognition Challenge (ICSRC): Dataset, Tracks, Baseline and Results	Ao Zhang, Fan Yu, Kaixun Huang, Lei Xie, Longbiao Wang, Eng Siong Chng, Hui Bu, Binbin Zhang, Wei Chen, Xin Xu	This paper summarizes the outcomes from the ISCSLP 2022 Intelligent Cockpit Speech Recognition Challenge (ICSRC). We first address the necessity of the challenge and then introduce the associated dataset collected from a new-energy vehicle (NEV) covering a variety of cockpit acoustic conditions and linguistic contents. We then describe the track arrangement and the baseline system. Specifically, we set up two tracks in terms of allowed model/system size to investigate resource-constrained and -unconstrained setups, targeting to vehicle embedded as well as cloud ASR systems respectively. Finally we summarize the challenge results and provide the major observations from the submitted systems.	cs.SD, eess.AS	2022-11-03		voice						
20260627	LongbiaoWang	https://export.arxiv.org/api/query?search_query=au:Wang_Longbiao&max_results=200	https://arxiv.org/abs/2305.17860	speech and noise dual-stream spectrogram refine network with speech distortion loss for robust speech recognition	Haoyu Lu, Nan Li, Tongtong Song, Longbiao Wang, Jianwu Dang, Xiaobao Wang, Shiliang Zhang	In recent years, the joint training of speech enhancement front-end and automatic speech recognition (ASR) back-end has been widely used to improve the robustness of ASR systems. Traditional joint training methods only use enhanced speech as input for the backend. However, it is difficult for speech enhancement systems to directly separate speech from input due to the diverse types of noise with different intensities. Furthermore, speech distortion and residual noise are often observed in enhanced speech, and the distortion of speech and noise is different. Most existing methods focus on fusing enhanced and noisy features to address this issue. In this paper, we propose a dual-stream spectrogram refine network to simultaneously refine the speech and noise and decouple the noise from the noisy input. Our proposed method can achieve better performance with a relative 8.6% CER reduction.	cs.SD, eess.AS	2023-05-29		voice						
20260627	LongbiaoWang	https://export.arxiv.org/api/query?search_query=au:Wang_Longbiao&max_results=200	https://arxiv.org/abs/2306.02625	Rethinking the visual cues in audio-visual speaker extraction	Junjie Li, Meng Ge, Zexu pan, Rui Cao, Longbiao Wang, Jianwu Dang, Shiliang Zhang	The Audio-Visual Speaker Extraction (AVSE) algorithm employs parallel video recording to leverage two visual cues, namely speaker identity and synchronization, to enhance performance compared to audio-only algorithms. However, the visual front-end in AVSE is often derived from a pre-trained model or end-to-end trained, making it unclear which visual cue contributes more to the speaker extraction performance. This raises the question of how to better utilize visual cues. To address this issue, we propose two training strategies that decouple the learning of the two visual cues. Our experimental results demonstrate that both visual cues are useful, with the synchronization cue having a higher impact. We introduce a more explainable model, the Decoupled Audio-Visual Speaker Extraction (DAVSE) model, which leverages both visual cues.	cs.SD, eess.AS	2023-06-05		voice						
20260627	LongbiaoWang	https://export.arxiv.org/api/query?search_query=au:Wang_Longbiao&max_results=200	https://arxiv.org/abs/2302.11254	Cross-modal Audio-visual Co-learning for Text-independent Speaker Verification	Meng Liu, Kong Aik Lee, Longbiao Wang, Hanyi Zhang, Chang Zeng, Jianwu Dang	Visual speech (i.e., lip motion) is highly related to auditory speech due to the co-occurrence and synchronization in speech production. This paper investigates this correlation and proposes a cross-modal speech co-learning paradigm. The primary motivation of our cross-modal co-learning method is modeling one modality aided by exploiting knowledge from another modality. Specifically, two cross-modal boosters are introduced based on an audio-visual pseudo-siamese structure to learn the modality-transformed correlation. Inside each booster, a max-feature-map embedded Transformer variant is proposed for modality alignment and enhanced feature generation. The network is co-learned both from scratch and with pretrained models. Experimental results on the LRSLip3, GridLip, LomGridLip, and VoxLip datasets demonstrate that our proposed method achieves 60% and 20% average relative performance improvement over independently trained audio-only/visual-only and baseline fusion systems, respectively.	cs.CV, cs.LG, cs.SD, eess.AS, eess.IV	2023-02-22		voice						
20260627	LongbiaoWang	https://export.arxiv.org/api/query?search_query=au:Wang_Longbiao&max_results=200	https://arxiv.org/abs/2005.00723	Towards Efficient Processing and Learning with Spikes: New Approaches for Multi-Spike Learning	Qiang Yu, Shenglan Li, Huajin Tang, Longbiao Wang, Jianwu Dang, Kay Chen Tan	Spikes are the currency in central nervous systems for information transmission and processing. They are also believed to play an essential role in low-power consumption of the biological systems, whose efficiency attracts increasing attentions to the field of neuromorphic computing. However, efficient processing and learning of discrete spikes still remains as a challenging problem. In this paper, we make our contributions towards this direction. A simplified spiking neuron model is firstly introduced with effects of both synaptic input and firing output on membrane potential being modeled with an impulse function. An event-driven scheme is then presented to further improve the processing efficiency. Based on the neuron model, we propose two new multi-spike learning rules which demonstrate better performance over other baselines on various tasks including association, classification, feature detection. In addition to efficiency, our learning rules demonstrate a high robustness against strong noise of different types. They can also be generalized to different spike coding schemes for the classification task, and notably single neuron is capable of solving multi-category classifications with our learning rules. In the feature detection task, we re-examine the ability of unsupervised STDP with its limitations being presented, and find a new phenomenon of losing selectivity. In contrast, our proposed learning rules can reliably solve the task over a wide range of conditions without specific constraints being applied. Moreover, our rules can not only detect features but also discriminate them. The improved performance of our methods would contribute to neuromorphic computing as a preferable choice.	cs.NE	2020-05-02		voice						
20260627	LongbiaoWang	https://export.arxiv.org/api/query?search_query=au:Wang_Longbiao&max_results=200	https://arxiv.org/abs/1902.01094	Robust Environmental Sound Recognition with Sparse Key-point Encoding and Efficient Multi-spike Learning	Qiang Yu, Yanli Yao, Longbiao Wang, Huajin Tang, Jianwu Dang, Kay Chen Tan	The capability for environmental sound recognition (ESR) can determine the fitness of individuals in a way to avoid dangers or pursue opportunities when critical sound events occur. It still remains mysterious about the fundamental principles of biological systems that result in such a remarkable ability. Additionally, the practical importance of ESR has attracted an increasing amount of research attention, but the chaotic and non-stationary difficulties continue to make it a challenging task. In this study, we propose a spike-based framework from a more brain-like perspective for the ESR task. Our framework is a unifying system with a consistent integration of three major functional parts which are sparse encoding, efficient learning and robust readout. We first introduce a simple sparse encoding where key-points are used for feature representation, and demonstrate its generalization to both spike and non-spike based systems. Then, we evaluate the learning properties of different learning rules in details with our contributions being added for improvements. Our results highlight the advantages of the multi-spike learning, providing a selection reference for various spike-based developments. Finally, we combine the multi-spike readout with the other parts to form a system for ESR. Experimental results show that our framework performs the best as compared to other baseline approaches. In addition, we show that our spike-based framework has several advantageous characteristics including early decision making, small dataset acquiring and ongoing dynamic processing. Our framework is the first attempt to apply the multi-spike characteristic of nervous neurons to ESR. The outstanding performance of our approach would potentially contribute to draw more research efforts to push the boundaries of spike-based paradigm to a new horizon.	cs.NE	2019-02-04		voice						
20260627	LongbiaoWang	https://export.arxiv.org/api/query?search_query=au:Wang_Longbiao&max_results=200	https://arxiv.org/abs/1803.07738	Speech Emotion Recognition Considering Local Dynamic Features	Haotian Guan, Zhilei Liu, Longbiao Wang, Jianwu Dang, Ruiguo Yu	Recently, increasing attention has been directed to the study of the speech emotion recognition, in which global acoustic features of an utterance are mostly used to eliminate the content differences. However, the expression of speech emotion is a dynamic process, which is reflected through dynamic durations, energies, and some other prosodic information when one speaks. In this paper, a novel local dynamic pitch probability distribution feature, which is obtained by drawing the histogram, is proposed to improve the accuracy of speech emotion recognition. Compared with most of the previous works using global features, the proposed method takes advantage of the local dynamic information conveyed by the emotional speech. Several experiments on Berlin Database of Emotional Speech are conducted to verify the effectiveness of the proposed method. The experimental results demonstrate that the local dynamic information obtained with the proposed method is more effective for speech emotion recognition than the traditional global features.	cs.AI, cs.CL, cs.HC	2018-03-21		voice						
20260627	LongbiaoWang	https://export.arxiv.org/api/query?search_query=au:Wang_Longbiao&max_results=200	https://arxiv.org/abs/2204.12756	Talking Head Generation Driven by Speech-Related Facial Action Units and Audio- Based on Multimodal Representation Fusion	Sen Chen, Zhilei Liu, Jiaxing Liu, Longbiao Wang	Talking head generation is to synthesize a lip-synchronized talking head video by inputting an arbitrary face image and corresponding audio clips. Existing methods ignore not only the interaction and relationship of cross-modal information, but also the local driving information of the mouth muscles. In this study, we propose a novel generative framework that contains a dilated non-causal temporal convolutional self-attention network as a multimodal fusion module to promote the relationship learning of cross-modal features. In addition, our proposed method uses both audio- and speech-related facial action units (AUs) as driving information. Speech-related AU information can guide mouth movements more accurately. Because speech is highly correlated with speech-related AUs, we propose an audio-to-AU module to predict speech-related AU information. We utilize pre-trained AU classifier to ensure that the generated images contain correct AU information. We verify the effectiveness of the proposed model on the GRID and TCD-TIMIT datasets. An ablation study is also conducted to verify the contribution of each component. The results of quantitative and qualitative experiments demonstrate that our method outperforms existing methods in terms of both image quality and lip-sync accuracy.	cs.CV, cs.MM	2022-04-27		voice						
20260627	LongbiaoWang	https://export.arxiv.org/api/query?search_query=au:Wang_Longbiao&max_results=200	https://arxiv.org/abs/2407.00743	AIMDiT: Modality Augmentation and Interaction via Multimodal Dimension Transformation for Emotion Recognition in Conversations	Sheng Wu, Jiaxing Liu, Longbiao Wang, Dongxiao He, Xiaobao Wang, Jianwu Dang	Emotion Recognition in Conversations (ERC) is a popular task in natural language processing, which aims to recognize the emotional state of the speaker in conversations. While current research primarily emphasizes contextual modeling, there exists a dearth of investigation into effective multimodal fusion methods. We propose a novel framework called AIMDiT to solve the problem of multimodal fusion of deep features. Specifically, we design a Modality Augmentation Network which performs rich representation learning through dimension transformation of different modalities and parameter-efficient inception block. On the other hand, the Modality Interaction Network performs interaction fusion of extracted inter-modal features and intra-modal features. Experiments conducted using our AIMDiT framework on the public benchmark dataset MELD reveal 2.34% and 2.87% improvements in terms of the Acc-7 and w-F1 metrics compared to the state-of-the-art (SOTA) models.	cs.AI, cs.CL, cs.MM, eess.AS	2024-04-12		voice						
20260627	LongbiaoWang	https://export.arxiv.org/api/query?search_query=au:Wang_Longbiao&max_results=200	https://arxiv.org/abs/2505.18002	Rethinking Contrastive Learning in Graph Anomaly Detection: A Clean-View Perspective	Di Jin, Jingyi Cao, Xiaobao Wang, Bingdao Feng, Dongxiao He, Longbiao Wang, Jianwu Dang	Graph anomaly detection aims to identify unusual patterns in graph-based data, with wide applications in fields such as web security and financial fraud detection. Existing methods typically rely on contrastive learning, assuming that a lower similarity between a node and its local subgraph indicates abnormality. However, these approaches overlook a crucial limitation: the presence of interfering edges invalidates this assumption, since it introduces disruptive noise that compromises the contrastive learning process. Consequently, this limitation impairs the ability to effectively learn meaningful representations of normal patterns, leading to suboptimal detection performance. To address this issue, we propose a Clean-View Enhanced Graph Anomaly Detection framework (CVGAD), which includes a multi-scale anomaly awareness module to identify key sources of interference in the contrastive learning process. Moreover, to mitigate bias from the one-step edge removal process, we introduce a novel progressive purification module. This module incrementally refines the graph by iteratively identifying and removing interfering edges, thereby enhancing model performance. Extensive experiments on five benchmark datasets validate the effectiveness of our approach.	cs.LG	2025-05-23		voice						
20260627	LongbiaoWang	https://export.arxiv.org/api/query?search_query=au:Wang_Longbiao&max_results=200	https://arxiv.org/abs/2509.18816	Pay More Attention To Audio: Mitigating Imbalance of Cross-Modal Attention in Large Audio Language Models	Junyu Wang, Ziyang Ma, Zhengding Luo, Tianrui Wang, Meng Ge, Xiaobao Wang, Longbiao Wang	Large Audio-Language Models (LALMs) often suffer from audio-textual attention imbalance, prioritizing text over acoustic information, particularly in the multi-modal fusion layers of the Transformer architecture. This bias hinders their ability to fully utilize acoustic cues, causing suboptimal performance on audio reasoning tasks. To mitigate this, we propose \textbf{MATA}, a novel training-free method that dynamically pushes LALMs to pay \textbf{M}ore \textbf{A}ttention \textbf{T}o \textbf{A}udio tokens within the self-attention mechanism. Specifically, MATA intervenes post raw attention scoring, targeting only the last token in intermediate layers without introducing additional parameters or computational overhead. Experiments on the MMAU and MMAR benchmarks confirm MATA's effectiveness, with consistent performance gains. Notably, on MMAR, MATA enables an open-source model to surpass the proprietary Gemini 2.0 Flash for the first time. Our work provides an efficient solution to mitigate attention bias and opens a new research direction for enhancing the audio-processing capabilities of multi-modal models.	cs.CL, cs.MM, cs.SD, eess.AS	2025-09-23		voice						
20260627	LongbiaoWang	https://export.arxiv.org/api/query?search_query=au:Wang_Longbiao&max_results=200	https://arxiv.org/abs/2511.18487	InstructAudio: Unified speech and music generation with natural language instruction	Chunyu Qiang, Kang Yin, Xiaopeng Wang, Yuzhe Liang, Jiahui Zhao, Ruibo Fu, Tianrui Wang, Cheng Gong, Chen Zhang, Longbiao Wang, Jianwu Dang	Text-to-speech (TTS) and text-to-music (TTM) models face significant limitations in instruction-based control. TTS systems usually depend on reference audio for timbre, offer only limited text-level attribute control, and rarely support dialogue generation. TTM systems are constrained by input conditioning requirements that depend on expert knowledge annotations. The high heterogeneity of these input control conditions makes them difficult to joint modeling with speech synthesis. Despite sharing common acoustic modeling characteristics, these two tasks have long been developed independently, leaving open the challenge of achieving unified modeling through natural language instructions. We introduce InstructAudio, a unified framework that enables instruction-based (natural language descriptions) control of acoustic attributes including timbre (gender, age), paralinguistic (emotion, style, accent), and musical (genre, instrument, rhythm, atmosphere). It supports expressive speech, music, and dialogue generation in English and Chinese. The model employs joint and single diffusion transformer layers with a standardized instruction-phoneme input format, trained on 50K hours of speech and 20K hours of music data, enabling multi-task learning and cross-modal alignment. Fig. 1 visualizes performance comparisons with mainstream TTS and TTM models, demonstrating that InstructAudio achieves optimal results on most metrics. To our best knowledge, InstructAudio represents the first instruction-controlled framework unifying speech and music generation. Audio samples are available at: https://qiangchunyu.github.io/InstructAudio/	cs.AI, cs.CL, cs.SD, eess.AS	2025-11-23		voice						
20260627	LongbiaoWang	https://export.arxiv.org/api/query?search_query=au:Wang_Longbiao&max_results=200	https://arxiv.org/abs/2510.11124	Perturbation Self-Supervised Representations for Cross-Lingual Emotion TTS: Stage-Wise Modeling of Emotion and Speaker	Cheng Gong, Chunyu Qiang, Tianrui Wang, Yu Jiang, Yuheng Lu, Ruihao Jing, Xiaoxiao Miao, Xiaolei Zhang, Longbiao Wang, Jianwu Dang	Cross-lingual emotional text-to-speech (TTS) aims to produce speech in one language that captures the emotion of a speaker from another language while maintaining the target voice's timbre. This process of cross-lingual emotional speech synthesis presents a complex challenge, necessitating flexible control over emotion, timbre, and language. However, emotion and timbre are highly entangled in speech signals, making fine-grained control challenging. To address this issue, we propose EMM-TTS, a novel two-stage cross-lingual emotional speech synthesis framework based on perturbed self-supervised learning (SSL) representations. In the first stage, the model explicitly and implicitly encodes prosodic cues to capture emotional expressiveness, while the second stage restores the timbre from perturbed SSL representations. We further investigate the effect of different speaker perturbation strategies-formant shifting and speaker anonymization-on the disentanglement of emotion and timbre. To strengthen speaker preservation and expressive control, we introduce Speaker Consistency Loss (SCL) and Speaker-Emotion Adaptive Layer Normalization (SEALN) modules. Additionally, we find that incorporating explicit acoustic features (e.g., F0, energy, and duration) alongside pretrained latent features improves voice cloning performance. Comprehensive multi-metric evaluations, including both subjective and objective measures, demonstrate that EMM-TTS achieves superior naturalness, emotion transferability, and timbre consistency across languages.	cs.SD	2025-10-13		voice						
