date_seen	source_name	source_url	paper_url	title	authors	abstract	keywords	pub_date	place	category	viewed	read	bookmarked	labelled	impactful_researcher	impactful_institution
20260627	LongbiaoWang	https://export.arxiv.org/api/query?search_query=au:Wang_Longbiao&max_results=200	https://arxiv.org/abs/2602.14655	Breaking Data Efficiency Dilemma: A Federated and Augmented Learning Framework For Alzheimer's Disease Detection via Speech	Xiao Wei, Bin Wen, Yuqin Lin, Kai Li, Mingyang gu, Xiaobao Wang, Longbiao Wang, Jianwu Dang	Early diagnosis of Alzheimer's Disease (AD) is crucial for delaying its progression. While AI-based speech detection is non-invasive and cost-effective, it faces a critical data efficiency dilemma due to medical data scarcity and privacy barriers. Therefore, we propose FAL-AD, a novel framework that synergistically integrates federated learning with data augmentation to systematically optimize data efficiency. Our approach delivers three key breakthroughs: First, absolute efficiency improvement through voice conversion-based augmentation, which generates diverse pathological speech samples via cross-category voice-content recombination. Second, collaborative efficiency breakthrough via an adaptive federated learning paradigm, maximizing cross-institutional benefits under privacy constraints. Finally, representational efficiency optimization by an attentive cross-modal fusion model, which achieves fine-grained word-level alignment and acoustic-textual interaction. Evaluated on ADReSSo, FAL-AD achieves a state-of-the-art multi-modal accuracy of 91.52%, outperforming all centralized baselines and demonstrating a practical solution to the data efficiency dilemma. Our source code is publicly available at https://github.com/smileix/fal-ad.	cs.AI, cs.CL	2026-02-16		voice						
20260627	LongbiaoWang	https://export.arxiv.org/api/query?search_query=au:Wang_Longbiao&max_results=200	https://arxiv.org/abs/2509.24629	Word-Level Emotional Expression Control in Zero-Shot Text-to-Speech Synthesis	Tianrui Wang, Haoyu Wang, Meng Ge, Cheng Gong, Chunyu Qiang, Ziyang Ma, Zikang Huang, Guanrou Yang, Xiaobao Wang, Eng Siong Chng, Xie Chen, Longbiao Wang, Jianwu Dang	While emotional text-to-speech (TTS) has made significant progress, most existing research remains limited to utterance-level emotional expression and fails to support word-level control. Achieving word-level expressive control poses fundamental challenges, primarily due to the complexity of modeling multi-emotion transitions and the scarcity of annotated datasets that capture intra-sentence emotional and prosodic variation. In this paper, we propose WeSCon, the first self-training framework that enables word-level control of both emotion and speaking rate in a pretrained zero-shot TTS model, without relying on datasets containing intra-sentence emotion or speed transitions. Our method introduces a transition-smoothing strategy and a dynamic speed control mechanism to guide the pretrained TTS model in performing word-level expressive synthesis through a multi-round inference process. To further simplify the inference, we incorporate a dynamic emotional attention bias mechanism and fine-tune the model via self-training, thereby activating its ability for word-level expressive control in an end-to-end manner. Experimental results show that WeSCon effectively overcomes data scarcity, achieving state-of-the-art performance in word-level emotional expression control while preserving the strong zero-shot synthesis capabilities of the original TTS model.	cs.SD, eess.AS	2025-09-29		voice						
20260627	LongbiaoWang	https://export.arxiv.org/api/query?search_query=au:Wang_Longbiao&max_results=200	https://arxiv.org/abs/2501.14273	Efficient Emotion and Speaker Adaptation in LLM-Based TTS via Characteristic-Specific Partial Fine-Tuning	Tianrui Wang, Meng Ge, Cheng Gong, Chunyu Qiang, Haoyu Wang, Zikang Huang, Yu Jiang, Ye Ni, Yuheng Lu, Xiaobao Wang, Engsiong Chng, Xie Chen, Longbiao Wang, Jianwu Dang	While LLM-based TTS models exhibit zero-shot emotion and speaker cloning, their cloning fidelity and pronunciation clarity degrade on unseen domains. Fine-tuning is essential for adaptation, yet uniform approaches overlook specific parameter contributions. Uniform tuning on limited data causes slow training and catastrophic forgetting, leading to degraded pronunciation accuracy. To address this, we propose CSP-FT, a characteristic-specific partial fine-tuning strategy. By dynamically analyzing layer contributions via a weighted sum, we selectively fine-tune only the two layers capturing the most and least emotion and speaker information, maximizing the utility of the former while explicitly strengthening the capacity of the latter. Experiments on a combined corpus of 11 datasets show CSP-FT matches or exceeds the fidelity and intelligibility of full fine-tuning while updating only ~8% of parameters, accelerating training by ~2x, and significantly mitigating catastrophic forgetting.	cs.SD, eess.AS	2025-01-24		voice						
20260627	LongbiaoWang	https://export.arxiv.org/api/query?search_query=au:Wang_Longbiao&max_results=200	https://arxiv.org/abs/2409.18512	Expressive Prompting: Improving Emotion Intensity and Speaker Consistency in Zero-Shot TTS	Haoyu Wang, Chunyu Qiang, Tianrui Wang, Cheng Gong, Yu Jiang, Yuheng Lu, Chen Zhang, Longbiao Wang, Jianwu Dang	Recent advancements in speech synthesis have enabled large language model (LLM)-based systems to perform zero-shot generation with controllable content, timbre, speaker identity, and emotion through input prompts. As a result, these models heavily rely on prompt design to guide the generation process. However, existing prompt selection methods often fail to ensure that prompts contain sufficiently stable speaker identity cues and appropriate emotional intensity indicators, which are crucial for expressive speech synthesis. To address this challenge, we propose a two-stage prompt selection strategy specifically designed for expressive speech synthesis. In the static stage (before synthesis), we first evaluate prompt candidates using pitch-based prosodic features, perceptual audio quality, and text-emotion coherence scores evaluated by an LLM. We further assess the candidates under a specific TTS model by measuring character error rate, speaker similarity, and emotional similarity between the synthesized and prompt speech. In the dynamic stage (during synthesis), we use a textual similarity model to select the prompt that is most aligned with the current input text. Experimental results demonstrate that our strategy effectively selects prompt to synthesize speech with both high-intensity emotional expression and robust speaker identity, leading to more expressive and stable zero-shot TTS performance. Audio samples and codes will be available at https://whyrrrrun.github.io/ExpPro.github.io/.	cs.AI, cs.CL, cs.SD, eess.AS	2024-09-27		voice						
20260627	LongbiaoWang	https://export.arxiv.org/api/query?search_query=au:Wang_Longbiao&max_results=200	https://arxiv.org/abs/2605.02277	CECOR: Correction-oriented synthetic data construction for factual error correction	Lei Zhu, Xiaobao Wang, Jianbiao Yang, Chenyang Wang, Dongxiao He, Longbiao Wang, Jianwu Dang	Factual Error Correction (FEC) aims to revise inaccurate text into statements that are factually consistent with external evidence. Although recent methods perform well on single-hop correction, they often treat claims as atomic units and struggle with multi-hop cases that require compositional reasoning across multiple evidence sources. This challenge is further amplified by limited paired data and difficulties in locating semantic errors within complex reasoning chains. We present CECoR (Compositional Error Correction via Reasoning-aware Synthesis), a reasoning-aware framework that introduces a Decomposition and Injection paradigm for compositional error correction. CECoR decomposes multi-hop claims into interpretable reasoning steps and injects controlled perturbations to synthesize high-quality training pairs. A two-stage learning strategy combining supervised fine-tuning and reinforcement learning improves factual accuracy and robustness. Comprehensive evaluations show that CECoR achieves strong performance on multi-hop benchmarks, outperforming both distantly supervised methods and few-shot LLM baselines. It also generalizes effectively to single-hop correction and remains stable under noisy evidence, demonstrating its versatility for real-world factual correction.	cs.CL	2026-05-04		voice						
20260627	LongbiaoWang	https://export.arxiv.org/api/query?search_query=au:Wang_Longbiao&max_results=200	https://arxiv.org/abs/2606.07182	Audio Imitator: Controlling Timbre and Tempo in Video2Audio Synthesis with Audio Reference	Jiahui Zhao, Tianrui Wang, Chunyu Qiang, Cheng Gong, Xijuan Zeng, Feng Deng, Longbiao Wang	Video-to-audio generation has made significant progress in achieving semantic consistency and temporal alignment from silent videos. However, audio contains rich stylistic attributes such as timbre and tempo that are difficult to infer from visual and textual inputs alone. While reference audio can serve as additional conditioning, it is typically treated as a holistic signal, limiting fine-grained style control. We propose AudioIM, an attribute-aware framework that explicitly models timbre and tempo as separate control factors rather than relying on holistic prompt conditioning. Dual encoders extract complementary timbre-related and tempo-related representations, which are injected through global conditioning. A masking-based training strategy enables effective latent prompt conditioning at inference. Experiments on VGGSound show improved style similarity while preserving semantic alignment and synchronization. Audio samples are available at: https://anonymousdemo757.github.io/.	eess.AS	2026-06-05		voice						
20260627	LongbiaoWang	https://export.arxiv.org/api/query?search_query=au:Wang_Longbiao&max_results=200	https://arxiv.org/abs/2312.11201	A Refining Underlying Information Framework for Monaural Speech Enhancement	Rui Cao, Tianrui Wang, Meng Ge, Longbiao Wang, Jianwu Dang	Supervised speech enhancement has gained significantly from recent advancements in neural networks, especially due to their ability to non-linearly fit the diverse representations of target speech, such as waveform or spectrum. However, these direct-fitting solutions continue to face challenges with degraded speech and residual noise in hearing evaluations. By bridging the speech enhancement and the Information Bottleneck principle in this letter, we rethink a universal plug-and-play strategy and propose a Refining Underlying Information framework called RUI to rise to the challenges both in theory and practice. Specifically, we first transform the objective of speech enhancement into an incremental convergence problem of mutual information between comprehensive speech characteristics and individual speech characteristics, e.g., spectral and acoustic characteristics. By doing so, compared with the existing direct-fitting solutions, the underlying information stems from the conditional entropy of acoustic characteristic given spectral characteristics. Therefore, we design a dual-path multiple refinement iterator based on the chain rule of entropy to refine this underlying information for further approximating target speech. Experimental results on DNS-Challenge dataset show that our solution consistently improves 0.3+ PESQ score over baselines, with only additional 1.18 M parameters. The source code is available at https://github.com/caoruitju/RUI_SE.	cs.SD, eess.AS, eess.SP	2023-12-18		voice						
20260627	LongbiaoWang	https://export.arxiv.org/api/query?search_query=au:Wang_Longbiao&max_results=200	https://arxiv.org/abs/2212.03401	MIMO-DBnet: Multi-channel Input and Multiple Outputs DOA-aware Beamforming Network for Speech Separation	Yanjie Fu, Haoran Yin, Meng Ge, Longbiao Wang, Gaoyan Zhang, Jianwu Dang, Chengyun Deng, Fei Wang	Recently, many deep learning based beamformers have been proposed for multi-channel speech separation. Nevertheless, most of them rely on extra cues known in advance, such as speaker feature, face image or directional information. In this paper, we propose an end-to-end beamforming network for direction guided speech separation given merely the mixture signal, namely MIMO-DBnet. Specifically, we design a multi-channel input and multiple outputs architecture to predict the direction-of-arrival based embeddings and beamforming weights for each source. The precisely estimated directional embedding provides quite effective spatial discrimination guidance for the neural beamformer to offset the effect of phase wrapping, thus allowing more accurate reconstruction of two sources' speech signals. Experiments show that our proposed MIMO-DBnet not only achieves a comprehensive decent improvement compared to baseline systems, but also maintain the performance on high frequency bands when phase wrapping occurs.	cs.LG, cs.SD, eess.AS	2022-12-07		voice						
20260627	LongbiaoWang	https://export.arxiv.org/api/query?search_query=au:Wang_Longbiao&max_results=200	https://arxiv.org/abs/2305.10821	Locate and Beamform: Two-dimensional Locating All-neural Beamformer for Multi-channel Speech Separation	Yanjie Fu, Meng Ge, Honglong Wang, Nan Li, Haoran Yin, Longbiao Wang, Gaoyan Zhang, Jianwu Dang, Chengyun Deng, Fei Wang	Recently, stunning improvements on multi-channel speech separation have been achieved by neural beamformers when direction information is available. However, most of them neglect to utilize speaker's 2-dimensional (2D) location cues contained in mixture signal, which limits the performance when two sources come from close directions. In this paper, we propose an end-to-end beamforming network for 2D location guided speech separation merely given mixture signal. It first estimates discriminable direction and 2D location cues, which imply directions the sources come from in multi views of microphones and their 2D coordinates. These cues are then integrated into location-aware neural beamformer, thus allowing accurate reconstruction of two sources' speech signals. Experiments show that our proposed model not only achieves a comprehensive decent improvement compared to baseline systems, but avoids inferior performance on spatial overlapping cases.	eess.AS	2023-05-18		voice						
20260627	LongbiaoWang	https://export.arxiv.org/api/query?search_query=au:Wang_Longbiao&max_results=200	https://arxiv.org/abs/2005.04686	SpEx+: A Complete Time Domain Speaker Extraction Network	Meng Ge, Chenglin Xu, Longbiao Wang, Eng Siong Chng, Jianwu Dang, Haizhou Li	Speaker extraction aims to extract the target speech signal from a multi-talker environment given a target speaker's reference speech. We recently proposed a time-domain solution, SpEx, that avoids the phase estimation in frequency-domain approaches. Unfortunately, SpEx is not fully a time-domain solution since it performs time-domain speech encoding for speaker extraction, while taking frequency-domain speaker embedding as the reference. The size of the analysis window for time-domain and the size for frequency-domain input are also different. Such mismatch has an adverse effect on the system performance. To eliminate such mismatch, we propose a complete time-domain speaker extraction solution, that is called SpEx+. Specifically, we tie the weights of two identical speech encoder networks, one for the encoder-extractor-decoder pipeline, another as part of the speaker encoder. Experiments show that the SpEx+ achieves 0.8dB and 2.1dB SDR improvement over the state-of-the-art SpEx baseline, under different and same gender conditions on WSJ0-2mix-extr database respectively.	cs.SD, eess.AS	2020-05-10		voice						
20260627	LongbiaoWang	https://export.arxiv.org/api/query?search_query=au:Wang_Longbiao&max_results=200	https://arxiv.org/abs/1604.03276	Noise Robust Speech Recognition Using Multi-Channel Based Channel Selection And ChannelWeighting	Zhaofeng Zhang, Xiong Xiao, Longbiao Wang, EngSiong Chng, Haizhou Li	In this paper, we study several microphone channel selection and weighting methods for robust automatic speech recognition (ASR) in noisy conditions. For channel selection, we investigate two methods based on the maximum likelihood (ML) criterion and minimum autoencoder reconstruction criterion, respectively. For channel weighting, we produce enhanced log Mel filterbank coefficients as a weighted sum of the coefficients of all channels. The weights of the channels are estimated by using the ML criterion with constraints. We evaluate the proposed methods on the CHiME-3 noisy ASR task. Experiments show that channel weighting significantly outperforms channel selection due to its higher flexibility. Furthermore, on real test data in which different channels have different gains of the target signal, the channel weighting method performs equally well or better than the MVDR beamforming, despite the fact that the channel weighting does not make use of the phase delay information which is normally used in beamforming.	cs.MM, cs.SD	2016-04-12		voice						
20260627	LongbiaoWang	https://export.arxiv.org/api/query?search_query=au:Wang_Longbiao&max_results=200	https://arxiv.org/abs/2407.12817	Error Correction by Paying Attention to Both Acoustic and Confidence References for Automatic Speech Recognition	Yuchun Shu, Bo Hu, Yifeng He, Hao Shi, Longbiao Wang, Jianwu Dang	Accurately finding the wrong words in the automatic speech recognition (ASR) hypothesis and recovering them well-founded is the goal of speech error correction. In this paper, we propose a non-autoregressive speech error correction method. A Confidence Module measures the uncertainty of each word of the N-best ASR hypotheses as the reference to find the wrong word position. Besides, the acoustic feature from the ASR encoder is also used to provide the correct pronunciation references. N-best candidates from ASR are aligned using the edit path, to confirm each other and recover some missing character errors. Furthermore, the cross-attention mechanism fuses the information between error correction references and the ASR hypothesis. The experimental results show that both the acoustic and confidence references help with error correction. The proposed system reduces the error rate by 21% compared with the ASR model.	cs.CL, cs.SD, eess.AS	2024-06-29		voice						
20260627	LongbiaoWang	https://export.arxiv.org/api/query?search_query=au:Wang_Longbiao&max_results=200	https://arxiv.org/abs/2507.02666	ASDA: Audio Spectrogram Differential Attention Mechanism for Self-Supervised Representation Learning	Junyu Wang, Tianrui Wang, Meng Ge, Longbiao Wang, Jianwu Dang	In recent advancements in audio self-supervised representation learning, the standard Transformer architecture has emerged as the predominant approach, yet its attention mechanism often allocates a portion of attention weights to irrelevant information, potentially impairing the model's discriminative ability. To address this, we introduce a differential attention mechanism, which effectively mitigates ineffective attention allocation through the integration of dual-softmax operations and appropriately tuned differential coefficients. Experimental results demonstrate that our ASDA model achieves state-of-the-art (SOTA) performance across multiple benchmarks, including audio classification (49.0% mAP on AS-2M, 41.5% mAP on AS20K), keyword spotting (98.3% accuracy on SPC-2), and environmental sound classification (96.1% accuracy on ESC-50). These results highlight ASDA's effectiveness in audio tasks, paving the way for broader applications.	cs.AI, cs.CL, cs.SD, eess.AS	2025-07-03		voice						
20260627	LongbiaoWang	https://export.arxiv.org/api/query?search_query=au:Wang_Longbiao&max_results=200	https://arxiv.org/abs/2412.16626	Mamba-SEUNet: Mamba UNet for Monaural Speech Enhancement	Junyu Wang, Zizhen Lin, Tianrui Wang, Meng Ge, Longbiao Wang, Jianwu Dang	In recent speech enhancement (SE) research, transformer and its variants have emerged as the predominant methodologies. However, the quadratic complexity of the self-attention mechanism imposes certain limitations on practical deployment. Mamba, as a novel state-space model (SSM), has gained widespread application in natural language processing and computer vision due to its strong capabilities in modeling long sequences and relatively low computational complexity. In this work, we introduce Mamba-SEUNet, an innovative architecture that integrates Mamba with U-Net for SE tasks. By leveraging bidirectional Mamba to model forward and backward dependencies of speech signals at different resolutions, and incorporating skip connections to capture multi-scale information, our approach achieves state-of-the-art (SOTA) performance. Experimental results on the VCTK+DEMAND dataset indicate that Mamba-SEUNet attains a PESQ score of 3.59, while maintaining low computational complexity. When combined with the Perceptual Contrast Stretching technique, Mamba-SEUNet further improves the PESQ score to 3.73.	cs.AI, cs.SD, eess.AS	2024-12-21		voice						
20260627	LongbiaoWang	https://export.arxiv.org/api/query?search_query=au:Wang_Longbiao&max_results=200	https://arxiv.org/abs/2506.08490	Integration of Old and New Knowledge for Generalized Intent Discovery: A Consistency-driven Prototype-Prompting Framework	Xiao Wei, Xiaobao Wang, Ning Zhuang, Chenyang Wang, Longbiao Wang, Jianwu dang	Intent detection aims to identify user intents from natural language inputs, where supervised methods rely heavily on labeled in-domain (IND) data and struggle with out-of-domain (OOD) intents, limiting their practical applicability. Generalized Intent Discovery (GID) addresses this by leveraging unlabeled OOD data to discover new intents without additional annotation. However, existing methods focus solely on clustering unsupervised data while neglecting domain adaptation. Therefore, we propose a consistency-driven prototype-prompting framework for GID from the perspective of integrating old and new knowledge, which includes a prototype-prompting framework for transferring old knowledge from external sources, and a hierarchical consistency constraint for learning new knowledge from target domains. We conducted extensive experiments and the results show that our method significantly outperforms all baseline methods, achieving state-of-the-art results, which strongly demonstrates the effectiveness and generalization of our methods. Our source code is publicly available at https://github.com/smileix/cpp.	cs.CL	2025-06-10		voice						
20260627	LongbiaoWang	https://export.arxiv.org/api/query?search_query=au:Wang_Longbiao&max_results=200	https://arxiv.org/abs/2606.15141	EChO-Agent: Evidence Chain Orchestration Agent for Audio Reasoning	Siyuan Zhang, Jian Zong, Junyu Wang, Peiyuan Jiang, Jiahao Yan, Jingyu Zhang, Tianrui Wang, Xiaobao Wang, Longbiao Wang, Jianwu Dang	While LALMs show promise on audio question answering, they fail to focus on question-relevant segments of audio and provide a clear, checkable reasoning process when dealing with complex audio reasoning. Reinforcement learning and tool-augmented prompting can help models better relate questions to audio but lack a reliable way to understand, integrate, and self-verify audio segments. To address this gap, we present EChO-Agent, a modular agent framework that reformulates complex audio QA as a planning, tool execution, evidence integration, and answer verification workflow. Experiments on MMAR benchmark show EChO-Agent improves both accuracy and rubric scores over baseline and ablation studies show evidence integration is the key factor.	cs.AI, cs.SD, eess.AS	2026-06-13		voice						
20260627	LongbiaoWang	https://export.arxiv.org/api/query?search_query=au:Wang_Longbiao&max_results=200	https://arxiv.org/abs/2206.14580	Language-specific Characteristic Assistance for Code-switching Speech Recognition	Tongtong Song, Qiang Xu, Meng Ge, Longbiao Wang, Hao Shi, Yongjie Lv, Yuqin Lin, Jianwu Dang	Dual-encoder structure successfully utilizes two language-specific encoders (LSEs) for code-switching speech recognition. Because LSEs are initialized by two pre-trained language-specific models (LSMs), the dual-encoder structure can exploit sufficient monolingual data and capture the individual language attributes. However, most existing methods have no language constraints on LSEs and underutilize language-specific knowledge of LSMs. In this paper, we propose a language-specific characteristic assistance (LSCA) method to mitigate the above problems. Specifically, during training, we introduce two language-specific losses as language constraints and generate corresponding language-specific targets for them. During decoding, we take the decoding abilities of LSMs into account by combining the output probabilities of two LSMs and the mixture model to obtain the final predictions. Experiments show that either the training or decoding method of LSCA can improve the model's performance. Furthermore, the best result can obtain up to 15.4% relative error reduction on the code-switching test set by combining the training and decoding methods of LSCA. Moreover, the system can process code-switching speech recognition tasks well without extra shared parameters or even retraining based on two pre-trained LSMs by using our method.	cs.CL, eess.AS	2022-06-29		voice						
