date_seen	source_name	source_url	paper_url	title	authors	abstract	keywords	pub_date	place	category	viewed	read	bookmarked	labelled	impactful_researcher	impactful_institution
20260627	LongbiaoWang	https://export.arxiv.org/api/query?search_query=au:Wang_Longbiao&max_results=200	https://arxiv.org/abs/2312.13556	Multi-Level Knowledge Distillation for Speech Emotion Recognition in Noisy Conditions	Yang Liu, Haoqin Sun, Geng Chen, Qingyue Wang, Zhen Zhao, Xugang Lu, Longbiao Wang	Speech emotion recognition (SER) performance deteriorates significantly in the presence of noise, making it challenging to achieve competitive performance in noisy conditions. To this end, we propose a multi-level knowledge distillation (MLKD) method, which aims to transfer the knowledge from a teacher model trained on clean speech to a simpler student model trained on noisy speech. Specifically, we use clean speech features extracted by the wav2vec-2.0 as the learning goal and train the distil wav2vec-2.0 to approximate the feature extraction ability of the original wav2vec-2.0 under noisy conditions. Furthermore, we leverage the multi-level knowledge of the original wav2vec-2.0 to supervise the single-level output of the distil wav2vec-2.0. We evaluate the effectiveness of our proposed method by conducting extensive experiments using five types of noise-contaminated speech on the IEMOCAP dataset, which show promising results compared to state-of-the-art models.	cs.SD, eess.AS	2023-12-21		voice						
20260627	LongbiaoWang	https://export.arxiv.org/api/query?search_query=au:Wang_Longbiao&max_results=200	https://arxiv.org/abs/2303.14593	Time-domain Speech Enhancement Assisted by Multi-resolution Frequency Encoder and Decoder	Hao Shi, Masato Mimura, Longbiao Wang, Jianwu Dang, Tatsuya Kawahara	Time-domain speech enhancement (SE) has recently been intensively investigated. Among recent works, DEMUCS introduces multi-resolution STFT loss to enhance performance. However, some resolutions used for STFT contain non-stationary signals, and it is challenging to learn multi-resolution frequency losses simultaneously with only one output. For better use of multi-resolution frequency information, we supplement multiple spectrograms in different frame lengths into the time-domain encoders. They extract stationary frequency information in both narrowband and wideband. We also adopt multiple decoder outputs, each of which computes its corresponding resolution frequency loss. Experimental results show that (1) it is more effective to fuse stationary frequency features than non-stationary features in the encoder, and (2) the multiple outputs consistent with the frequency loss improve performance. Experiments on the Voice-Bank dataset show that the proposed method obtained a 0.14 PESQ improvement.	cs.SD, eess.AS	2023-03-26		voice						
20260627	LongbiaoWang	https://export.arxiv.org/api/query?search_query=au:Wang_Longbiao&max_results=200	https://arxiv.org/abs/2309.15512	High-Fidelity Speech Synthesis with Minimal Supervision: All Using Diffusion Models	Chunyu Qiang, Hao Li, Yixin Tian, Yi Zhao, Ying Zhang, Longbiao Wang, Jianwu Dang	Text-to-speech (TTS) methods have shown promising results in voice cloning, but they require a large number of labeled text-speech pairs. Minimally-supervised speech synthesis decouples TTS by combining two types of discrete speech representations(semantic \& acoustic) and using two sequence-to-sequence tasks to enable training with minimal supervision. However, existing methods suffer from information redundancy and dimension explosion in semantic representation, and high-frequency waveform distortion in discrete acoustic representation. Autoregressive frameworks exhibit typical instability and uncontrollability issues. And non-autoregressive frameworks suffer from prosodic averaging caused by duration prediction models. To address these issues, we propose a minimally-supervised high-fidelity speech synthesis method, where all modules are constructed based on the diffusion models. The non-autoregressive framework enhances controllability, and the duration diffusion model enables diversified prosodic expression. Contrastive Token-Acoustic Pretraining (CTAP) is used as an intermediate semantic representation to solve the problems of information redundancy and dimension explosion in existing semantic coding methods. Mel-spectrogram is used as the acoustic representation. Both semantic and acoustic representations are predicted by continuous variable regression tasks to solve the problem of high-frequency fine-grained waveform distortion. Experimental results show that our proposed method outperforms the baseline method. We provide audio samples on our website.	cs.AI, cs.CL, cs.SD, eess.AS	2023-09-27		voice						
20260627	LongbiaoWang	https://export.arxiv.org/api/query?search_query=au:Wang_Longbiao&max_results=200	https://arxiv.org/abs/2401.03473	ICMC-ASR: The ICASSP 2024 In-Car Multi-Channel Automatic Speech Recognition Challenge	He Wang, Pengcheng Guo, Yue Li, Ao Zhang, Jiayao Sun, Lei Xie, Wei Chen, Pan Zhou, Hui Bu, Xin Xu, Binbin Zhang, Zhuo Chen, Jian Wu, Longbiao Wang, Eng Siong Chng, Sun Li	To promote speech processing and recognition research in driving scenarios, we build on the success of the Intelligent Cockpit Speech Recognition Challenge (ICSRC) held at ISCSLP 2022 and launch the ICASSP 2024 In-Car Multi-Channel Automatic Speech Recognition (ICMC-ASR) Challenge. This challenge collects over 100 hours of multi-channel speech data recorded inside a new energy vehicle and 40 hours of noise for data augmentation. Two tracks, including automatic speech recognition (ASR) and automatic speech diarization and recognition (ASDR) are set up, using character error rate (CER) and concatenated minimum permutation character error rate (cpCER) as evaluation metrics, respectively. Overall, the ICMC-ASR Challenge attracts 98 participating teams and receives 53 valid results in both tracks. In the end, first-place team USTCiflytek achieves a CER of 13.16% in the ASR track and a cpCER of 21.48% in the ASDR track, showing an absolute improvement of 13.08% and 51.4% compared to our challenge baseline, respectively.	cs.AI, cs.SD, eess.AS	2024-01-07		voice						
20260627	LongbiaoWang	https://export.arxiv.org/api/query?search_query=au:Wang_Longbiao&max_results=200	https://arxiv.org/abs/2206.12273	Iterative Sound Source Localization for Unknown Number of Sources	Yanjie Fu, Meng Ge, Haoran Yin, Xinyuan Qian, Longbiao Wang, Gaoyan Zhang, Jianwu Dang	Sound source localization aims to seek the direction of arrival (DOA) of all sound sources from the observed multi-channel audio. For the practical problem of unknown number of sources, existing localization algorithms attempt to predict a likelihood-based coding (i.e., spatial spectrum) and employ a pre-determined threshold to detect the source number and corresponding DOA value. However, these threshold-based algorithms are not stable since they are limited by the careful choice of threshold. To address this problem, we propose an iterative sound source localization approach called ISSL, which can iteratively extract each source's DOA without threshold until the termination criterion is met. Unlike threshold-based algorithms, ISSL designs an active source detector network based on binary classifier to accept residual spatial spectrum and decide whether to stop the iteration. By doing so, our ISSL can deal with an arbitrary number of sources, even more than the number of sources seen during the training stage. The experimental results show that our ISSL achieves significant performance improvements in both DOA estimation and source number detection compared with the existing threshold-based algorithms.	cs.LG, eess.AS	2022-06-24		voice						
20260627	LongbiaoWang	https://export.arxiv.org/api/query?search_query=au:Wang_Longbiao&max_results=200	https://arxiv.org/abs/2110.04451	Using multiple reference audios and style embedding constraints for speech synthesis	Cheng Gong, Longbiao Wang, Zhenhua Ling, Ju Zhang, Jianwu Dang	The end-to-end speech synthesis model can directly take an utterance as reference audio, and generate speech from the text with prosody and speaker characteristics similar to the reference audio. However, an appropriate acoustic embedding must be manually selected during inference. Due to the fact that only the matched text and speech are used in the training process, using unmatched text and speech for inference would cause the model to synthesize speech with low content quality. In this study, we propose to mitigate these two problems by using multiple reference audios and style embedding constraints rather than using only the target audio. Multiple reference audios are automatically selected using the sentence similarity determined by Bidirectional Encoder Representations from Transformers (BERT). In addition, we use ''target'' style embedding from a Pre-trained encoder as a constraint by considering the mutual information between the predicted and ''target'' style embedding. The experimental results show that the proposed model can improve the speech naturalness and content quality with multiple reference audios and can also outperform the baseline model in ABX preference tests of style similarity.	cs.AI, cs.SD, eess.AS	2021-10-09		voice						
20260627	LongbiaoWang	https://export.arxiv.org/api/query?search_query=au:Wang_Longbiao&max_results=200	https://arxiv.org/abs/2312.14398	ZMM-TTS: Zero-shot Multilingual and Multispeaker Speech Synthesis Conditioned on Self-supervised Discrete Speech Representations	Cheng Gong, Xin Wang, Erica Cooper, Dan Wells, Longbiao Wang, Jianwu Dang, Korin Richmond, Junichi Yamagishi	Neural text-to-speech (TTS) has achieved human-like synthetic speech for single-speaker, single-language synthesis. Multilingual TTS systems are limited to resource-rich languages due to the lack of large paired text and studio-quality audio data. TTS systems are typically built using a single speaker's voices, but there is growing interest in developing systems that can synthesize voices for new speakers using only a few seconds of their speech. This paper presents ZMM-TTS, a multilingual and multispeaker framework utilizing quantized latent speech representations from a large-scale, pre-trained, self-supervised model. Our paper combines text-based and speech-based self-supervised learning models for multilingual speech synthesis. Our proposed model has zero-shot generalization ability not only for unseen speakers but also for unseen languages. We have conducted comprehensive subjective and objective evaluations through a series of experiments. Our model has proven effective in terms of speech naturalness and similarity for both seen and unseen speakers in six high-resource languages. We also tested the efficiency of our method on two hypothetically low-resource languages. The results are promising, indicating that our proposed approach can synthesize audio that is intelligible and has a high degree of similarity to the target speaker's voice, even without any training data for the new, unseen language.	cs.SD, eess.AS	2023-12-22		voice						
20260627	LongbiaoWang	https://export.arxiv.org/api/query?search_query=au:Wang_Longbiao&max_results=200	https://arxiv.org/abs/2406.08911	An Initial Investigation of Language Adaptation for TTS Systems under Low-resource Scenarios	Cheng Gong, Erica Cooper, Xin Wang, Chunyu Qiang, Mengzhe Geng, Dan Wells, Longbiao Wang, Jianwu Dang, Marc Tessier, Aidan Pine, Korin Richmond, Junichi Yamagishi	Self-supervised learning (SSL) representations from massively multilingual models offer a promising solution for low-resource language speech tasks. Despite advancements, language adaptation in TTS systems remains an open problem. This paper explores the language adaptation capability of ZMM-TTS, a recent SSL-based multilingual TTS system proposed in our previous work. We conducted experiments on 12 languages using limited data with various fine-tuning configurations. We demonstrate that the similarity in phonetics between the pre-training and target languages, as well as the language category, affects the target language's adaptation performance. Additionally, we find that the fine-tuning dataset size and number of speakers influence adaptability. Surprisingly, we also observed that using paired data for fine-tuning is not always optimal compared to audio-only data. Beyond speech intelligibility, our analysis covers speaker similarity, language identification, and predicted MOS.	cs.CL, eess.AS	2024-06-13		voice						
20260627	LongbiaoWang	https://export.arxiv.org/api/query?search_query=au:Wang_Longbiao&max_results=200	https://arxiv.org/abs/2412.16507	Adapting Whisper for Code-Switching through Encoding Refining and Language-Aware Decoding	Jiahui Zhao, Hao Shi, Chenrui Cui, Tianrui Wang, Hexin Liu, Zhaoheng Ni, Lingxuan Ye, Longbiao Wang	Code-switching (CS) automatic speech recognition (ASR) faces challenges due to the language confusion resulting from accents, auditory similarity, and seamless language switches. Adaptation on the pre-trained multi-lingual model has shown promising performance for CS-ASR. In this paper, we adapt Whisper, which is a large-scale multilingual pre-trained speech recognition model, to CS from both encoder and decoder parts. First, we propose an encoder refiner to enhance the encoder's capacity of intra-sentence swithching. Second, we propose using two sets of language-aware adapters with different language prompt embeddings to achieve language-specific decoding information in each decoder layer. Then, a fusion module is added to fuse the language-aware decoding. The experimental results using the SEAME dataset show that, compared with the baseline model, the proposed approach achieves a relative MER reduction of 4.1% and 7.2% on the dev_man and dev_sge test sets, respectively, surpassing state-of-the-art methods. Through experiments, we found that the proposed method significantly improves the performance on non-native language in CS speech, indicating that our approach enables Whisper to better distinguish between the two languages.	cs.CL, cs.SD, eess.AS	2024-12-21	ICASSP 2025	voice						
20260627	LongbiaoWang	https://export.arxiv.org/api/query?search_query=au:Wang_Longbiao&max_results=200	https://arxiv.org/abs/2412.10460	Enriching Multimodal Sentiment Analysis through Textual Emotional Descriptions of Visual-Audio Content	Sheng Wu, Xiaobao Wang, Longbiao Wang, Dongxiao He, Jianwu Dang	Multimodal Sentiment Analysis (MSA) stands as a critical research frontier, seeking to comprehensively unravel human emotions by amalgamating text, audio, and visual data. Yet, discerning subtle emotional nuances within audio and video expressions poses a formidable challenge, particularly when emotional polarities across various segments appear similar. In this paper, our objective is to spotlight emotion-relevant attributes of audio and visual modalities to facilitate multimodal fusion in the context of nuanced emotional shifts in visual-audio scenarios. To this end, we introduce DEVA, a progressive fusion framework founded on textual sentiment descriptions aimed at accentuating emotional features of visual-audio content. DEVA employs an Emotional Description Generator (EDG) to transmute raw audio and visual data into textualized sentiment descriptions, thereby amplifying their emotional characteristics. These descriptions are then integrated with the source data to yield richer, enhanced features. Furthermore, DEVA incorporates the Text-guided Progressive Fusion Module (TPF), leveraging varying levels of text as a core modality guide. This module progressively fuses visual-audio minor modalities to alleviate disparities between text and visual-audio modalities. Experimental results on widely used sentiment analysis benchmark datasets, including MOSI, MOSEI, and CH-SIMS, underscore significant enhancements compared to state-of-the-art models. Moreover, fine-grained emotion experiments corroborate the robust sensitivity of DEVA to subtle emotional variations.	cs.AI, cs.CV, cs.SD, eess.AS	2024-12-12	AAAI 2025	voice						
20260627	LongbiaoWang	https://export.arxiv.org/api/query?search_query=au:Wang_Longbiao&max_results=200	https://arxiv.org/abs/2511.09232	POTSA: A Cross-Lingual Speech Alignment Framework for Speech-to-Text Translation	Xuanchen Li, Chenrui Cui, Tianrui Wang, Meng Ge, Zikang Huang, Yizhou Peng, Jin Li, Yuheng Lu, Yu Jiang, Nyima Tashi, Longbiao Wang, Jianwu Dang	Speech Large Language Models have achieved breakthroughs in multilingual speech-to-text translation. However, existing approaches often overlook semantic commonalities across source languages, leading to biased translation performance. In this work, we propose POTSA (Parallel Optimal Transport for Speech Alignment), a new framework based on cross-lingual parallel speech pairs and Optimal Transport, designed to bridge high- and low-resource translation gaps. First, we introduce a Bias Compensation module to coarsely align initial speech representations. Second, we impose token-level OT constraints on a Q-Former using parallel pairs to establish fine-grained representation consistency. Then, we apply a layer scheduling strategy to focus OT constraints on semantically beneficial layers. Experiments on FLEURS show our method achieves SOTA performance, with +1.29 BLEU over five common languages and +2.93 BLEU on zero-shot languages, using only 10 hours of parallel speech per language.	cs.CL, cs.SD	2025-11-12		voice						
20260627	LongbiaoWang	https://export.arxiv.org/api/query?search_query=au:Wang_Longbiao&max_results=200	https://arxiv.org/abs/2603.23048	MSR-HuBERT: Self-supervised Pre-training for Adaptation to Multiple Sampling Rates	Zikang Huang, Meng Ge, Tianrui Wang, Xuanchen Li, Xiaobao Wang, Longbiao Wang, Jianwu Dang	Self-supervised learning (SSL) has advanced speech processing. However, existing speech SSL methods typically assume a single sampling rate and struggle with mixed-rate data due to temporal resolution mismatch. To address this limitation, we propose MSRHuBERT, a multi-sampling-rate adaptive pre-training method. Building on HuBERT, we replace its single-rate downsampling CNN with a multi-sampling-rate adaptive downsampling CNN that maps raw waveforms from different sampling rates to a shared temporal resolution without resampling. This design enables unified mixed-rate pre-training and fine-tuning. In experiments spanning 16 to 48 kHz, MSRHuBERT outperforms HuBERT on speech recognition and full-band speech reconstruction, preserving high-frequency detail while modeling low-frequency semantic structure. Moreover, MSRHuBERT retains HuBERT's mask-prediction objective and Transformer encoder, so existing analyses and improvements that were developed for HuBERT can apply directly.	cs.AI, cs.SD	2026-03-24		voice						
20260627	LongbiaoWang	https://export.arxiv.org/api/query?search_query=au:Wang_Longbiao&max_results=200	https://arxiv.org/abs/2604.22209	UniSonate: A Unified Model for Speech, Music, and Sound Effect Generation with Text Instructions	Chunyu Qiang, Xiaopeng Wang, Kang Yin, Yuzhe Liang, Yuxin Guo, Teng Ma, Ziyu Zhang, Tianrui Wang, Cheng Gong, Yushen Chen, Ruibo Fu, Chen Zhang, Longbiao Wang, Jianwu Dang	Generative audio modeling has largely been fragmented into specialized tasks, text-to-speech (TTS), text-to-music (TTM), and text-to-audio (TTA), each operating under heterogeneous control paradigms. Unifying these modalities remains a fundamental challenge due to the intrinsic dissonance between structured semantic representations (speech/music) and unstructured acoustic textures (sound effects). In this paper, we introduce UniSonate, a unified flow-matching framework capable of synthesizing speech, music, and sound effects through a standardized, reference-free natural language instruction interface. To reconcile structural disparities, we propose a novel dynamic token injection mechanism that projects unstructured environmental sounds into a structured temporal latent space, enabling precise duration control within a phoneme-driven Multimodal Diffusion Transformer (MM-DiT). Coupled with a multi-stage curriculum learning strategy, this approach effectively mitigates cross-modal optimization conflicts. Extensive experiments demonstrate that UniSonate achieves state-of-the-art performance in instruction-based TTS (WER 1.47%) and TTM (SongEval Coherence 3.18), while maintaining competitive fidelity in TTA. Crucially, we observe positive transfer, where joint training on diverse audio data significantly enhances structural coherence and prosodic expressiveness compared to single-task baselines. Audio samples are available at https://qiangchunyu.github.io/UniSonate/.	cs.AI, cs.CL, cs.SD, eess.AS	2026-04-24		voice						
20260627	LongbiaoWang	https://export.arxiv.org/api/query?search_query=au:Wang_Longbiao&max_results=200	https://arxiv.org/abs/2606.10368	Speech Meets ELF: Audio Conditional Continuous-Target Diffusion for Speech Recognition and Translation	Xuanchen Li, Tianrui Wang, Yuheng Lu, Zikang Huang, Yu Jiang, Chenghan Lin, Chenrui Cui, Ziyang Ma, Xingyu Ma, Chunyu Qiang, Guochen Yu, Xie Chen, Longbiao Wang, Jianwu Dang	Speech-to-text (S2T) systems for recognition (ASR) and translation (S2TT) typically generate discrete text tokens. In contrast, continuous-target language modelling performs generation in a continuous space, yet its potential for S2T remains unexplored. To bridge this gap, we propose ELF-S2T, an audio-conditioned continuous-target generative model for S2T. Built upon the pre-trained Embedded Language Flows (ELF) backbone, ELF-S2T processes speech via a frozen Whisper encoder and a single linear projector, prepending the resulting audio condition to the noisy text latent for in-context, flow-matching denoising. To prevent the model from over-relying on its pre-trained text context, we introduce audio forcing during training, and further amplify the audio condition via classifier-free guidance at inference. Experiments on LibriSpeech and CoVoST2 show that ELF-S2T achieves competitive ASR and S2TT performance. Crucially, our error analysis reveals that, although ASR and S2TT errors look very different on the surface, both stem from the same underlying cause, a close distance confusion in the continuous latent space. This finding naturally aligns with the continuous representation generation paradigm, indicating a common semantic mapping process beneath recognition and translation. Our code and pretrained models are publicly available at https://github.com/Sslnon/ELF-S2T.	cs.AI, cs.SD	2026-06-09		voice						
20260627	LongbiaoWang	https://export.arxiv.org/api/query?search_query=au:Wang_Longbiao&max_results=200	https://arxiv.org/abs/2309.00424	Learning Speech Representation From Contrastive Token-Acoustic Pretraining	Chunyu Qiang, Hao Li, Yixin Tian, Ruibo Fu, Tao Wang, Longbiao Wang, Jianwu Dang	"For fine-grained generation and recognition tasks such as minimally-supervised text-to-speech (TTS), voice conversion (VC), and automatic speech recognition (ASR), the intermediate representations extracted from speech should serve as a ""bridge"" between text and acoustic information, containing information from both modalities. The semantic content is emphasized, while the paralinguistic information such as speaker identity and acoustic details should be de-emphasized. However, existing methods for extracting fine-grained intermediate representations from speech suffer from issues of excessive redundancy and dimension explosion. Contrastive learning is a good method for modeling intermediate representations from two modalities. However, existing contrastive learning methods in the audio field focus on extracting global descriptive information for downstream audio classification tasks, making them unsuitable for TTS, VC, and ASR tasks. To address these issues, we propose a method named ""Contrastive Token-Acoustic Pretraining (CTAP)"", which uses two encoders to bring phoneme and speech into a joint multimodal space, learning how to connect phoneme and speech at the frame level. The CTAP model is trained on 210k speech and phoneme pairs, achieving minimally-supervised TTS, VC, and ASR. The proposed CTAP method offers a promising solution for fine-grained generation and recognition downstream tasks in speech processing. We provide a website with audio samples."	cs.AI, cs.CL, cs.SD, eess.AS	2023-09-01		voice						
